"taskID","userID","objectType","rightCorner","collection","site","toSearch","Lon","Lat","gridRef","dateDiscoveryDay","dateDiscoveryMonth","dateDiscoveryYear","length","width","edge","weight","patina","surface","thickness","other","composition","associations","description","publications","remarks","inputBy","imageURL","flickrURL"
"8011","13","TANGED SPEARHEAD","","MANCHESTER UNIV. MUS., 0.8664","isle of wight, arreton, arreton down.","arreton","-1.239935","50.67569","","None","None","None","","","","","","dull gold mainly, merging to dark brown, for lower part of tang; old pits (small) dark, brown + one or two with green corrosion products., none of damage to edges is obviously modern,, file-marks round tang, rounded corners, may be, modern","","","","","Either blade wing has a swollen centre line with bevel, outside; midribs asymetrical on face, more-or-less, symm. on reverse; triangular facet at tang/blade junction, rounded-original or modern rubbing? hammr ripple mark, on face of tang, and sides; tang twisted with, respect to blade;","Needham 1985, A6 no. 9","M., 2 Feb 78., CI SI.","Lucy Ellis","http://farm6.staticflickr.com/5483/14301792901_6a568eca7a_b.jpg","http://www.flickr.com/photos/MicroPasts/14301792901"
"8011","243","TANGED SPEARHEAD","","MANCHESTER UNIV. MUS. O. 8664","isle of wight, arreton, arreton down","arreton","-1.234141","50.67993","","None","None","None","","","","","","dull gold mainly, merging to dark brown for lower part of tang; odd pits (small) dark brown & one or two with green corrosion products., None of damage to edges is obviously modern, file-marks, and tang, rounding corners, may be modern","","","","","Either blade wing has a swollen centre line with bend outside; midrib asymmetrical on face, more-or-less symm. on reverse; triangular facet at tang/blade junction rounded - original or modern rubbing?, Hammer ripple mark on Faces of tang, and sides; tang twisted with respect to blade;","Needham 1985, A6 no. 9","CI, SI, M. 2 Feb 78","Jeff Okazaki","http://farm6.staticflickr.com/5483/14301792901_6a568eca7a_b.jpg","http://www.flickr.com/photos/MicroPasts/14301792901"
"8011","433","Tanged Spearhead","","Manchester University Museum,O.8664","england,isle of wight,arreton,arreton down","arreton down","-1.217957","50.70192","","None","None","None","","","","","","dull gold mainly, merging to dark brown for lower part of tang; odd pits (small) dark brown and one or two with green corrosion products. none of damage to edges is obviously modern; file-marks and tang, rounding corners, may be modern","","","","","Either blade wing has swollen centre line with bevel outside; midrib asymmetrical on face, more-or-less symm. on revers; triangular facet at tang/blade junction; rounded original or modern rubbing? hammer ripple marks on faces of tang, and sides; tang twisted with respect to blade.","Needham 1985, A6 no. 9","C1 S1,M 2 Feb. 78","Joellen mcGann","http://farm6.staticflickr.com/5483/14301792901_6a568eca7a_b.jpg","http://www.flickr.com/photos/MicroPasts/14301792901"
"8012","13","Palstave","","?","isle of wight, arreton, combley farm","arreton","-1.225601","50.69320","SZ 54832 88393","None","None","None","","","","","","","","Context Type 'SINGLE FIND', , , , Circumstances 'found whilst metal-detecting 14 inches, below surface, resting on natural bedrock, in 1997'","","","","","","Lucy Ellis","http://farm4.staticflickr.com/3692/14304566134_693fa9aa50_b.jpg","http://www.flickr.com/photos/MicroPasts/14304566134"
"8012","243","Palstave","","?","isle of wight, arreton, combley farm","arreton","-1.243068","50.68404","SZ 54832 88393 (from GPS)","None","None","1997","","","","","","","","Very little info on card.","","SINGLE FIND","","","found whilst metal-detecting 14 inches below surface, resting on natural bedrock in 1997.","Jeff Okazaki","http://farm4.staticflickr.com/3692/14304566134_693fa9aa50_b.jpg","http://www.flickr.com/photos/MicroPasts/14304566134"
"8012","433","Palstave","","?","england,isle of wight,arreton,combley farm","arreton down","-1.217957","50.70192","52 54832 88393 (from GPS)","None","None","1997","","","","","","","","","","","","","52 54832 88393 (From GPS),Single Find,Found whilst metal-detecting 14 inches below surface, resting on natural bedrock in 1997","Joellen mcGann","http://farm4.staticflickr.com/3692/14304566134_693fa9aa50_b.jpg","http://www.flickr.com/photos/MicroPasts/14304566134"
