"taskID","userID","objectType","rightCorner","collection","site","toSearch","Lon","Lat","gridRef","dateDiscoveryDay","dateDiscoveryMonth","dateDiscoveryYear","length","width","edge","weight","patina","surface","thickness","other","composition","associations","description","publications","remarks","inputBy","imageURL","flickrURL"
"10466","1","Flat celt","d","Private, F Ransom Esq, Hitchin","england, berkshire","berkshire","-1.03187293","51.45349","","None","None","None","115","","","279.95","Thick light brownish green. On one side this is almost earth colour and it is chipped off at the edges.","Smooth","","","","","","","","Daniel Pett","https://farm4.staticflickr.com/3803/13310712683_e57c29fa6e_b.jpg","https://www.flickr.com/photos/MicroPasts/13310712683"
"10466","64","Flat Celt","d","Private Collection,F. Ransom Esq.,Hitchin","england,berkshire","","-3.27657530","54.70235","","None","None","None","115","","","","thick light brownish green patina on one side this is almost earth colour & it is chipped off at the edges.","smooth","","Weight transcribed as written","","","","","","Hugh Fiske","https://farm4.staticflickr.com/3803/13310712683_e57c29fa6e_b.jpg","https://www.flickr.com/photos/MicroPasts/13310712683"
"10467","64","Flat axe","d","Reading Museum 44:52,T.C.B. Coll.","berks.,bray.,dredged from the thames, 400 yards above bray. march 1952.","bray berks","-0.70626143","51.50912","","None","3","1952","","","","","Cleaned.","","","","Bronze. Good Condition.","","","","J. Wymer","Hugh Fiske","https://farm4.staticflickr.com/3676/13310923184_af253d7593_b.jpg","https://www.flickr.com/photos/MicroPasts/13310923184"
"10467",,"Flat Axe","d","","berks., bray., dredged from the thames, 400 yards above bray.","bray on thames","-0.70036511","51.51129","","None","3","1952","","","","","Cleaned","","","There is a lot of information missing from this card. There are no measurements listed, weight etc so I have entered what I can see. There is no grid reference on the card so I have found the nearest point on the map that I can deduce from the description. The only letter in the top right corner is a letter d. Underneath that is:, ,    Reading Museum 44:52 T.C.B. Coll. , , The only other information is the signature J.Wymer.","","","","","","Anon.","https://farm4.staticflickr.com/3676/13310923184_af253d7593_b.jpg","https://www.flickr.com/photos/MicroPasts/13310923184"
"10468","243","Flat Celt.","d","Reading Museum A.L. XLIV.,Davies Collection (Wallingford) March 1891.","england,berkshire,cholsey,near church,found when ploughing,june 1878.","cholsey","-1.15471973","51.57844","","None","6","1878","126","","77","347.28","","yellow Bronze. with black stains.","12","2 cross section drawings of celt on reverse.,Blade widens more quickly as it nears edge, tips very slightly flared.,Edge blunted.","","","Butt slightly hammered. edge dented.","","","Jeff Okazaki","https://farm8.staticflickr.com/7403/13310711953_3f8cba2448_b.jpg","https://www.flickr.com/photos/MicroPasts/13310711953"
"10468","482","Flat Celt","d","","england, berkshire, cholsey","cholsey berkshire","-1.24194140","51.40222","","None","6","1878","126","27","77","347.288","","yellow Bronze with black stains","12","","Butt slightly hammered.edge dented","","","Reading Museum   A.L. XLIV, , Davies collection (Wallingford)  March 1891","found when ploughing","scruffyarcher","https://farm8.staticflickr.com/7403/13310711953_3f8cba2448_b.jpg","https://www.flickr.com/photos/MicroPasts/13310711953"
"10469","161","Flat Celt","d","Reading Museum, AL. XLV,Davies Coll. (Wallingford) March 1891.","england,berks,cholsey,near church,","cholsey","-1.15854992","51.57903","","None","6","1878","142","","101","432.33","dark with patches of apple green","badly pitted","9","found while ploughing, June 1878,","","","Butt broken + cracked. edge dented","","","Jared Obermeyer","https://farm8.staticflickr.com/7443/13310711633_11b4a8772c_b.jpg","https://www.flickr.com/photos/MicroPasts/13310711633"
"10469","482","Flat Celt","d","Reading Museum  A L  XLV, , Davies Coll[ection} (Wallingford) March 1891","england, berks, cholsey","cholsey berkshire","-1.24194140","51.40222","","None","6","1878","142","38","101","432.33","","badly pitted- dark with patches of apple green","9","","Butt broken and cracked, Edge dented","","","","found when ploughing","scruffyarcher","https://farm8.staticflickr.com/7443/13310711633_11b4a8772c_b.jpg","https://www.flickr.com/photos/MicroPasts/13310711633"
"10470","161","Flat Axe, (""Small bronze celt"")","unclassifiable","Item now untraced","berkshire, cholsey, halfpenny lane","cholsey, halfpenny lane","-1.16216200","51.55658","","None","None","None","","","","","","","","remark added in pencil at some time","","","","H. Peaks ""Berkshire"" 51.,J.K. Hodges. History of Wallingford. I. 148","Is this one of those in Reading Museum? (Found near church in 1878)","Jared Obermeyer","https://farm4.staticflickr.com/3743/13310551415_1947b09c06_b.jpg","https://www.flickr.com/photos/MicroPasts/13310551415"
"10470","482","Flat Axe (""small bronze celt"")","unidentifiable","Item now untraced","berkshire, cholsey, halfpenny lane","cholsey berkshire","-1.24194140","51.40222","","None","None","None","","","","","","","","","","","","H Peaks ""Berkshire""51, , JR Hedges History of Wallingford I 148","Is this one of those in Reading Museum? (found near church in 1878)","scruffyarcher","https://farm4.staticflickr.com/3743/13310551415_1947b09c06_b.jpg","https://www.flickr.com/photos/MicroPasts/13310551415"
"10471","535","Flat Celt","Ashmolean Museums, Oxford, , 1896-1908. Pr 371, , Rev J.C Clutterbuck Collection., , Given by Rev. J.C. Clutterbuck 1885","Rev. J.C. Clutterbuck Collection, , Ashmolean Museums Oxford","england, berkshire, long wittenham, found on the river thames","long wittenham, berkshire, england","-1.05249040","51.45698","","None","None","None","159","","79","390","brown patina","","11","","","","In good condition, brown patina, herring-bone ornament on lower half of edge, and across blade between A.B and X.Y","","","Nina Sharman","https://farm8.staticflickr.com/7315/13310550985_13d005a555_b.jpg","https://www.flickr.com/photos/MicroPasts/13310550985"
"10471",,"Flat. Celt.","d","Ashmolean Museum, Oxford, , 1896-1908. Pr.371, , Rev. J.C.Clutterbuck Collection, , Given by Rev. J.C.Clutterbuck. 1885.","england, berkshire, long wittenham, found near the river thames","long wittenham","-1.20979040","51.64110","","None","None","None","159","","79","390.8","","","11","My first try. There are 2 stats for width. Patina is included in Description.","","","In good condition, brown patina, herring-bone ornament on lower half of edge,and across blade between A.B and X.Y. A faint ridge at A.B.","","","Anon.","https://farm8.staticflickr.com/7315/13310550985_13d005a555_b.jpg","https://www.flickr.com/photos/MicroPasts/13310550985"
"10472","541","Flat Celt","d","Eton College Museum, , pres. by Reverand E. Hale","england, berkshire, from r. thames, maidenhead (near)","maidenhead","-0.70302539","51.52331","","None","None","None","163.5","","101","560","","","","","Bronze","","","","Lady Willis Chitty, daughter of the donor, says that most of the implements in her father's possession (now in Eton College Museum) were dredged from the R. Thames between Maidenhead and Windsor","Tim Mudie","https://farm8.staticflickr.com/7258/13310709903_59d3bda771_b.jpg","https://www.flickr.com/photos/MicroPasts/13310709903"
"10472",,"Flat Celt","","Eton College Museum, , pres. by Rev. E. Hale","england, berkshire, from r. thames, maidenhead (near)","maidenhead","-0.69221073","51.51247","","None","None","None","163.5","","101","560","","","","","Bronze","","","","Lady Willis Chitty, daughter of the donor, says that most of the implements in her father's possession (now in Eton College Museum) were dredged from the R. Thames between Maidenhead and Windsor.","Anon.","https://farm8.staticflickr.com/7258/13310709903_59d3bda771_b.jpg","https://www.flickr.com/photos/MicroPasts/13310709903"
"10473","541","Flat Axe","","Eton College Museum 190","berkshire, maidenhead (near)","maidenhead","-0.70126586","51.52537","","None","None","None","161","101","","","","","","","","","","","","Tim Mudie","https://farm4.staticflickr.com/3681/13310549945_ece68525b3_b.jpg","https://www.flickr.com/photos/MicroPasts/13310549945"
"10473",,"Flat Axe","","Eton College Museum, 190","r. thames, berks, nr. maidenhead","near maidenhead","-0.70319705","51.51589","","None","None","None","161","101","","","","","","Initials MJR appear below Surface.","","","","","","Anon.","https://farm4.staticflickr.com/3681/13310549945_ece68525b3_b.jpg","https://www.flickr.com/photos/MicroPasts/13310549945"
"10474","541","Flat Celt, Hammer - Flanged","d, , , ,","Borough of Newbury Museum, , I.63 (Old catalogue), , Given by Mr. J.W. Roake before 1854","england, berkshire, newbury (in the neighbourhood of), exact site unknown","newbury","-1.32364250","51.40201","","None","None","None","170","","76","520","","","115","","Assay by analysis: Copper 91.35, Tin 8.64","","There are slight signs of flanges, but the surface is much decayed","","It has been suggested by Mr. O.G.S. Crawford (Geog, Journ.) that perhaps this may be the flat celt found on a gravel heath to the north of Newbury and exhibited by Mr John Pardue in 1846 [...] B.A.A.I. (1846) 337","Tim Mudie","https://farm4.staticflickr.com/3691/13310549765_2a2fe4122c_b.jpg","https://www.flickr.com/photos/MicroPasts/13310549765"
"10474",,"Hammer-Flanged (Flat) Celt","d","Borough of Newbury Museum, , I.63 (Old catalogue), , Given by Mr. J.W.Roake, , before 1854.","england, berkshire, newbury, the neighbourhood of exact site unknown","newbury, berkshire","-1.32342792","51.40787","","None","None","None","170","","76","520","","","11.5","","Assay by analysis Copper 91.35, Tin 8.64, Total 99.99","","There are slight signs of flanges, but the surface is much decayed.","Victoria History of Berkshire. i.195., , Geographical Journal August and September, 1912. 185.207., , Man xiv.51.","It has been suggested by Mr. O.G.S.Crawford (Geo. Journ.) that perhaps this may be the flat celt found on a gravel heath to the north of Newbury and exhibited by Mr. John Pardue in 1846. J.B.A.A.I. (1846) 337.","Anon.","https://farm4.staticflickr.com/3691/13310549765_2a2fe4122c_b.jpg","https://www.flickr.com/photos/MicroPasts/13310549765"
"10475","541","Miniature Flat Axe","","Reading Museum A.L. XLII, , Davies Collection March 1891","england, berkshire, wallingford (?)","wallingford","-1.12521580","51.59823","","None","None","None","67","","42","63.78","Dark coloured","Much worn and blistered, one side rough as if cast in an open mould","6","Question marks under ""Site"" and ""Composition"" from original index card.  Not entered by transcriber.","copper ?","","","","This is probably Irish, as the specimens in Davies Collection were often wrongly described.","Tim Mudie","https://farm8.staticflickr.com/7218/13310920264_a3dc4eed96_b.jpg","https://www.flickr.com/photos/MicroPasts/13310920264"
"10475",,"Miniature Flat Axe","c","Reading Museum. A.L. XLII, , Davies Colln. March 1891.","england, berks, wallingford (?)","wallingford","-1.12521580","51.59823","","None","None","None","67","","42","63.78","","much worn & blistered, one side rough as if cast in an open mould. Dark coloured.","6","","? copper","","","","This is probably Irish, as the specimens in Davies Colln. were often wrongly described.","Anon.","https://farm8.staticflickr.com/7218/13310920264_a3dc4eed96_b.jpg","https://www.flickr.com/photos/MicroPasts/13310920264"
"10476","541","Flat Axe","","Derbyshire Museum Service, , , , x 5510/7","berkshire, windsor great park,, ex ball collection","","-76.51467340","37.14737","","None","None","None","139.7","","","","Golden Brown","Smooth","15","Palstave crossed out and replaced with Flat Axe in object box","","","Fine flat palstave in perfect condition","","","Tim Mudie","https://farm4.staticflickr.com/3716/13310708853_a27864430c_b.jpg","https://www.flickr.com/photos/MicroPasts/13310708853"
"10476",,"Flat Axe","d","Ex Ball Collection","berkshire, windsor great park","","-3.27657530","54.70235","","None","None","None","140","","","","golden brown","smooth","","Can't make out thickness","","","fine flat palstave in perfect condition","","","Anon.","https://farm4.staticflickr.com/3716/13310708853_a27864430c_b.jpg","https://www.flickr.com/photos/MicroPasts/13310708853"
"10477","541","Flat Celt","","Private collection, P. Waterhouse Esq. Yattendon Court","england, england, berkshire, yattendon, yattendon court","yattendon court","-1.20495080","51.46671","","None","None","1878","118","","78","297.67","Bright green, pale green in pit holes.","Badly pitted. Some rust adheres to one side.  The other partly covered with yellow clay.","11","","","Part of a hoard of 60 pieces, including (Evans, A.B. [...] p. 169) [...] celts, flat celts, palstaves, socketed celts, gonges, socketed and tanged knives, swords, scabbard ends, [...]-heads, and flat, conical and angular pieces of bronze.","Butt chipped: edge chipped and one corner missing","Evans. [...] B. Imp.s p.169 (not in chapter on Flat Celts).","","Tim Mudie","https://farm4.staticflickr.com/3721/13310918764_3690daf36d_b.jpg","https://www.flickr.com/photos/MicroPasts/13310918764"
"10477",,"Flat [...]","d","Private Collection 1923, P. Waterhouse Esq. Yattendon Court","england, berkshire, yattendon, yattendon court, in digging foundations of house, 1878","yattendon","-1.20495080","51.46671","","None","None","1878","2997","","1981","298","bright green, pale green in pit holes","badly pitted . Some rust adheres to one side. the other partly covered with yellow clay.","279","Length, width, thickness not recorded in any units. Have assumed inches & recorded accordingly","","part of a hoard of 60 pieces. including (Evans, A. B. Imps., p 169) [...], [...] gouges, socketed & tanged knives, swords, seatband [...] spearheads, & flat, conical & angular pieces [...]","Butt chipped: edge chipped & one corner missing","Proc. Soc. Ant. (2nd [...]) VII 480, V. C. H. B[...]ks i, 182-3 Evans. Anc. B. Imps. p. 169 (not in chapter on Flat [...])","","Anon.","https://farm4.staticflickr.com/3721/13310918764_3690daf36d_b.jpg","https://www.flickr.com/photos/MicroPasts/13310918764"
"10478","541","Hammer-Flanged/Flat Axe","","Scottish Antiquarian Museum, , Edinburgh, , Sim Collection, 1182., , No. DC.6.","scotland borders,","","-3.27657530","54.70235","","None","None","None","136.8","","66.7","299.2","","Thick","","Under ""Site"", Peeblesshire is crossed out and replaced with Borders in pencil.","","","Imperfect specimen, edge damaged, angles slightly recurved, oval hollow on face shown: this has the appearance of a blow-hole, the inside diameter being larger than the outer","","","Tim Mudie","https://farm4.staticflickr.com/3768/13310942534_2318efa3f5_b.jpg","https://www.flickr.com/photos/MicroPasts/13310942534"
"10478",,"Hammer, ?Flanged/Flat axe","d","Scottish Antiquarian Museum,, Edinburgh, Sim Collection, 1882. N. DC.6","scotland, peeblesshire","","-3.27657530","54.70235","","None","None","None","3475","","1694","299.2","","","","Length, width, thickness units not recorded. Assumed inches & converted. Can't make out word to left of Patina","","","Imperfect specimen, edge damaged, angles slightly recurved., Oval hollow on face [...]: this has the appearance of a blow-hole,, being larger than the outer.","","","Anon.","https://farm4.staticflickr.com/3768/13310942534_2318efa3f5_b.jpg","https://www.flickr.com/photos/MicroPasts/13310942534"
"10479","541","Flat Axe","","Scottish Antiquarian Museum, , Edinburgh, , No. DA 77, , Purchased 1912","scotland borders, ancrum (near), lilliards edge","lilliards edge","-2.60745570","55.53833","","None","None","None","120","","72.2","230.45","Removed","Corroded fairly deeply in places.","7.8","Under ""Site"" Roxburghshire crossed out and Borders written, in pencil and in different handwriting.","","","Blunt edge. Sides rounded. Piece broken off butt.","","","Tim Mudie","https://farm4.staticflickr.com/3794/13310942484_a5f1168845_b.jpg","https://www.flickr.com/photos/MicroPasts/13310942484"
"10479",,"Flat Axe","d","Scottish Antiquarian Museum,, Edinburgh, Purchased 1912 No. DA 77","scotland, roxburghshire borders, ancrum (near), lilliards edge","","-3.27657530","54.70235","","None","None","None","3048","","1834","230.45","removed","Corroded fairly deeply in places","198","","","","Blunt edge. Sides rounded., Piece broken off butt.","","","Anon.","https://farm4.staticflickr.com/3794/13310942484_a5f1168845_b.jpg","https://www.flickr.com/photos/MicroPasts/13310942484"
"10480","541","Flat Axe","","Scottish National Museum, Edinburgh., , No. DA 10, , Purchased 1881","scotland borders, ashybanks, from,, ""site and circumstances of discovery unknown""","","-3.27657530","54.70235","","None","None","None","169.1","","90","543.25","","","10.6","Under ""Site"", Roxburghshire crossed out and replaced with Borders, in pencil, different handwriting.","","","Moderately good condition.  Edge damaged.","Catalogue Nat. Mus. Scot. 1892: O.G.S. Crawford Geog. Journal XL (1912). List p. 313.","","Tim Mudie","https://farm3.staticflickr.com/2888/13310570625_96bc9a2601_b.jpg","https://www.flickr.com/photos/MicroPasts/13310570625"
"10480",,"Flat Axe","","Scottish National Museum,, Edinburgh, No. DA 10, Purchased 1881.","scotland, roxburghshire borders, ashybank, from, ""site & circumstances of discovery unknown""","","-3.27657530","54.70235","","None","None","None","4295","","2286","543","","","269","","Moderately good condition., Edge damaged.","","","Catalogue Nat.Mus.Scot. 1892: O. G. S. Crawford Geog Journal XL (1912), List p. 313.","","Anon.","https://farm3.staticflickr.com/2888/13310570625_96bc9a2601_b.jpg","https://www.flickr.com/photos/MicroPasts/13310570625"
"10481","541","Flat Axe","","Scottish National Museum , , Edinburgh, , , , No. DA 68, , Purchased 1900","scotland borders, harlaw moor","","-3.27657530","54.70235","","None","None","None","143.9","","73.5","357.35","in places","Thin","9.8","Under ""Site"" Peeblesshire crossed out and replaced with Borders, followed by a question mark, in pencil.  Also after Harlaw Moor, written in pencil [?= Harelaw, SE border of county]","","","Fairly good condition: Edge damaged, but moderately sharp; reground in antiquity.  Sides beaten up to form rudimentary flanges.","","","Tim Mudie","https://farm8.staticflickr.com/7191/13310729483_36c27009e6_b.jpg","https://www.flickr.com/photos/MicroPasts/13310729483"
"10481",,"Flat Axe","","","scotland, peeblesshire borders?, harlaw moor [? = harelaw, se border of county]","","-3.27657530","54.70235","Scottish National Museum,, Edinburgh., No. DA 68., Purchased 1900.","None","None","None","3655","","1862","357","Thin patina in places","","","Below 'Object Type' additional description: edges beaten up.","","","Fairly good condition:, Edge damaged, but moderately sharp; reground in antiquity., Sides beaten up to form rudimentary flanges.","","","Anon.","https://farm8.staticflickr.com/7191/13310729483_36c27009e6_b.jpg","https://www.flickr.com/photos/MicroPasts/13310729483"
"10482","541","Miniature Flat Celt","","Bishop Collection B14, , The University. Glasgow.","scotland border, lauder, hill house","","-3.27657530","54.70235","","None","None","None","62.2","","37.5","97.5","green patina in places","","9","Under ""Site"", Berwickshire crossed out and replaced with Borders.","","","","","","Tim Mudie","https://farm8.staticflickr.com/7060/13310569685_f93fc0ba4e_b.jpg","https://www.flickr.com/photos/MicroPasts/13310569685"
"10482","547","Miniature Hat Celt","B14","Bishop Collection, The University, Glasgow","scotland borders lauder hillhouses","td2 6td","-2.74943983","55.71961","","None","None","None","62.2","37.5","","97.5","green patina in places","","9","next to length and width is a measurement,, , , , butt  or hutt 23","","","","","","Lesley Ravenscroft","https://farm8.staticflickr.com/7060/13310569685_f93fc0ba4e_b.jpg","https://www.flickr.com/photos/MicroPasts/13310569685"
"10482",,"Miniature Flat [...]","d","Bishop Collection B14, The University. Glasgow.","scotland, berwickshire borders, lauder, hill house","","-3.27657530","54.70235","","None","None","None","62","","38","97.5","green patina in places","","9","","","","","","","Anon.","https://farm8.staticflickr.com/7060/13310569685_f93fc0ba4e_b.jpg","https://www.flickr.com/photos/MicroPasts/13310569685"
"10483","541","Flat Celt","","Bishop Collection B17, , The University. Glasgow.","scotland, borders, jedburg, scaisburgh farm 2 1/2 m. s.e. of jedburgh","","-3.27657530","54.70235","","None","None","None","137","","82","400.4","Light green","","","Under ""Site"" Roxburgh crossed out and replaced with Borders.","","","Shows traces of incipient wings [?], , Fair condition.","","","Tim Mudie","https://farm8.staticflickr.com/7263/13310728493_4db7dcf2d2_b.jpg","https://www.flickr.com/photos/MicroPasts/13310728493"
"10483",,"Flat [...]","d","Bishop Collection B17., The University. Glasgow","scotland, roxburgh borders, jedburgh (straisburgh), scraisburgh farm 2 1/8 m. s. e. of jedburgh.","","-3.27657530","54.70235","","None","None","None","137","","82","400","light green","","","","","","shows traces of incipient wings","","","Anon.","https://farm8.staticflickr.com/7263/13310728493_4db7dcf2d2_b.jpg","https://www.flickr.com/photos/MicroPasts/13310728493"
"10484","541","Flat Celt","","Anthropological Museum, Aberdeen University, , 243, , Given by Rev Professor John Christie","scotland, aberdeenshire, grampian","","-3.27657530","54.70235","","None","None","None","149","51","84","554","","","11","","","","","","","Tim Mudie","https://farm6.staticflickr.com/5578/14772628439_165246ac33_b.jpg","https://www.flickr.com/photos/MicroPasts/14772628439"
"10484",,"Falt Celt","d","Anthropological Museum, Aberdeen University, 243, Given by Rev. Professor John Christie","scotland, aberdeenshire grampian","","-3.27657530","54.70235","","None","None","None","149","","84","554","","","11","","","","","","","Anon.","https://farm6.staticflickr.com/5578/14772628439_165246ac33_b.jpg","https://www.flickr.com/photos/MicroPasts/14772628439"
"10485","541","Flat Celt","","Pitt-Rivers Museum, Oxford., , Pitt-Rivers Collection (no numbers)","england","","-3.27657530","54.70235","","None","None","None","126","","63","","","","6.5","","Bronze","","Squared lateral margins, , Partly smoothed surface","","","Tim Mudie","https://farm4.staticflickr.com/3880/14936364166_fc0640d892_b.jpg","https://www.flickr.com/photos/MicroPasts/14936364166"
"10485",,"Flat Celt","d","Pitt-Rivers Museum, Oxford., Pitt-Rivers Collection (no number)","england","","-3.27657530","54.70235","","None","None","None","126","","63","","","Partly smoothed surface.","7","","","","Bronze, squared lateral margins.","","","Anon.","https://farm4.staticflickr.com/3880/14936364166_fc0640d892_b.jpg","https://www.flickr.com/photos/MicroPasts/14936364166"
"10486","541","Flat Axe","","Pitt_Rivers Museum, Oxford, , Pitt-Rivers Collection 1439","england","","-3.27657530","54.70235","","None","None","None","129.5","","72","","","","9.5","Description has been changed from the original Flat Celt, to Hammer Flanged Flat Axe Celt","Bronze","","Squared lateral margins, , Partly smoothed surface","","","Tim Mudie","https://farm6.staticflickr.com/5553/14956255091_eb2a6b61be_b.jpg","https://www.flickr.com/photos/MicroPasts/14956255091"
"10486",,"Hammer Flanged Flat Axe, Celt","d","Pitt-Rivers Museum, Oxford., Pitt-Rivers Collection 1437.","england","","-3.27657530","54.70235","","None","None","None","130","","72","","","Partly smoothed surface","10","","","","Bronze, Squared lateral margins","","","Anon.","https://farm6.staticflickr.com/5553/14956255091_eb2a6b61be_b.jpg","https://www.flickr.com/photos/MicroPasts/14956255091"
"10487","541","Flat Celt","","Royal Scottish Museum, Edinburgh, , Reg. No. 1890. 498","scotland","","-3.27657530","54.70235","","None","None","None","138","","","","Light brown bronze colour, dark in places.","in good condition","7","","","","Celt bronze, flat type, expanding towards cutting edge.","","","Tim Mudie","https://farm4.staticflickr.com/3852/14772681799_0a696bda10_b.jpg","https://www.flickr.com/photos/MicroPasts/14772681799"
"10487",,"Flat Celt","d","Royal Scottish Museum, Edinburgh, Reg. No: 1890.498","scotland","","-3.27657530","54.70235","","None","None","None","138","","75","378","lgiht brown bronze colour, dark in places","in good condition","7","","","","Celt bronze, flat type, expanding towards cutting edge.","","","Anon.","https://farm4.staticflickr.com/3852/14772681799_0a696bda10_b.jpg","https://www.flickr.com/photos/MicroPasts/14772681799"
"10488","541","Flat Celt","","Manchester Museum L 54, , bought of G.C. Yates.","scotland","","-3.27657530","54.70235","","None","None","None","157","","88","481.95","Thin polished patina of green - various shades. Golden bronze just shows through.  Remainder of the patina is thicker and damaged by scratches","smooth","","","Bronze","","The bevel at the edge is very slight.","","","Tim Mudie","https://farm4.staticflickr.com/3911/14956254981_a16cb9f8fa_b.jpg","https://www.flickr.com/photos/MicroPasts/14956254981"
"10488",,"Flat Celt","d","Manchester Museum L54, bought of G. C. Yates.","scotland","","-3.27657530","54.70235","","None","None","None","157","","88","482","thin polished patina of green - various shades. Golden bronze just shows through., Remainder of the patine is thicker & damaged by scratches.","smooth","","","Bronze","","The bevel at the edge is very slight.","","","Anon.","https://farm4.staticflickr.com/3911/14956254981_a16cb9f8fa_b.jpg","https://www.flickr.com/photos/MicroPasts/14956254981"
