"taskID","userID","objectType","rightCorner","collection","site","toSearch","Lon","Lat","gridRef","dateDiscoveryDay","dateDiscoveryMonth","dateDiscoveryYear","length","width","edge","weight","patina","surface","thickness","other","composition","associations","description","publications","remarks","inputBy","imageURL","flickrURL"
"10719","528","Flat Celt","d","Earl of Powys, Powys Castle, Welshpool 1926, , Now National Museum of Wales, 31.62/1","wales, powys, welshpool, pool quay, ? recent association with lba hoard, crowther's camp","pool quay","-3.10276317","52.69604","","None","None","None","148","edge 75, middle 35, butt 21","","392.6","green","","10","","","Part of a bronze worker's hoard found with other implements and numerous pieces of bronze metal.  [Line below] This association is exceedingly doubtful - L.F. Chitty","Ornament on faces ommitted in this sketch - LFC, , Fair condition - cuts in butt","Kept with Guilsfield Hoard.  But E.L.  Barnwell, Arch. Camb., 1864, 213, expressly stated that ""no very early types"" were found in the hoard: evidence weighed up by L.F. Chitty Arch. Camb., 1939, 225, , Mount Coll. Vol. III, p. 438, , Arch. Camb., Vol. X, 3rd. S. p. 212, , Pur. no. 547","","Margaret Ellen Joy","https://farm4.staticflickr.com/3867/14772656539_eb4d7edd42_b.jpg","https://www.flickr.com/photos/MicroPasts/14772656539"
"10720","433","Flat Celt","d","Pitt-Rivers Museum, Oxford,Pitt-Rivers Collection 1437","england,shropshire,near much wenlock in coverdale","much wenlock, england","-2.55820160","52.59570","","None","None","None","137","32","84","","","Smoothed but corroded surfaces.","10","Width: butt 31.5mm; centre 44.5mm; edge 83.5mm,Thickness: 9.5mm","Bronze","","Squared lateral margins.","O.G.S. Crawford, Geog. Jo., XL (1912) 309.","","Joellen mcGann","https://farm4.staticflickr.com/3926/14958983052_15f7b8609c_b.jpg","https://www.flickr.com/photos/MicroPasts/14958983052"
"10720","528","Flat Celt","d","Pitt-Rivers Museum, Oxford., , Pitt-Rivers Collection 1437","england, shropshire, near much wenlock, in corvedale","much wenlock","-2.55820160","52.59570","","None","None","None","137","butt 31.5, centre 44.5, edge 83.5","","","","Smoothed but corroded surfaces","9.5","","Bronze","","Squared lateral margins","R.G.S. Crawford, Geog. Jo. XL (1912), 309","","Margaret Ellen Joy","https://farm4.staticflickr.com/3926/14958983052_15f7b8609c_b.jpg","https://www.flickr.com/photos/MicroPasts/14958983052"
"10721","433","Flat Celt","duplicate?","Shrewsbury Museum","england,shropshire,asterton prolemoor [?prolly moor?]","asterton, shropshire","-2.88902590","52.51504","","None","None","None","102","","47","","Dark green","Perfect in patches.","","","Bronze","","The surface is peculiar. Smooth on both sides, in patches. But on the cutting edge and some other parts, the surface has gone for 1/16 of an inch, leaving a thick ""scale"" of patination.","","Donor R. E. Clarke.","Joellen mcGann","https://farm6.staticflickr.com/5594/14772661700_cd25f65815_b.jpg","https://www.flickr.com/photos/MicroPasts/14772661700"
"10721","528","Flat Celt","duplicate >>","Shrewsbury Museum","england, shropshire, asterton protemoor[?]","asterton shropshire","-2.88902590","52.51504","","None","None","None","102","47 at cutting edge","","","Dark green","Perfect in patches","","Handwriting on card difficult to read in places: , , a) find site Asterton ?Protemoor?  Google Map does not help., , b) Possibly: ""The surface is ?peculiar? smooth on both sides in patches.""","Bronze","","The surface is [...] smooth on both sides in patches.  But on the cutting edge and around other parts, the surface has gone for 1/16th of an inch, leaving a thick ""scale"" of patination.","","Donor R. E. Clarke","Margaret Ellen Joy","https://farm6.staticflickr.com/5594/14772661700_cd25f65815_b.jpg","https://www.flickr.com/photos/MicroPasts/14772661700"
"10722","433","Hammer-Flanged Flat Axe","d","Powysland Museum, Welshpool,given by the Earl of Powis","england,shropshire,bettws-y-crwyn,castle bryn amlwg.","bettws y crwyn, shropshire","-3.16938080","52.42470","","None","None","None","115","18","61","192","","Covered green rust.","11","Width: edge 61mm; butt 18mm,Weight: 191.8 gms","","","Fairly good - lower cutting edge chipped.","","","Joellen mcGann","https://farm4.staticflickr.com/3852/14772730048_e8a84139a0_b.jpg","https://www.flickr.com/photos/MicroPasts/14772730048"
"10722","473","Hammer-Flanged Flat Axe","d","Powysland Museum. Welshpool., given by The Earl of Powis.","england, shropshire, bettws-y-crwyn, castle bryn amlwg","bettws y crwyn","-3.16938080","52.42470","","None","None","None","115","18","61","191.8","","covered green rust","11","","","","Fairly good - lower cutting edge chipped.","","","Dina Fathalla","https://farm4.staticflickr.com/3852/14772730048_e8a84139a0_b.jpg","https://www.flickr.com/photos/MicroPasts/14772730048"
"10723","226","Hammer Flanged Flat AXE","d","Mr. J.P. Morris,, Clunbury Hall, Aston-on-Clune, Shropshire, Drawn Feb. 1928, L.F. Chitty","england,shropshire, slo., clunbury, found by a workman while cultivating the late mr. grant's garden in 1928 at a depth of 16-18 ins. in subsoil. the ground is 4-5 ft above the level of the surrounding valley land. i am trying to get exact site & name of home. lfc","clunbury, shropshire, england","-2.92662060","52.41983","","None","None","1928","169","(butt) 25, centre 38.5","(edge, blunted angles) 78","489.029","Glossy green with brown stains broken down to core, blue-green on one face, purple-brown on reverse, with gold metal showing showing on edges.","Badly damaged, largely through attempt to clean it.","centre 12","Information about L.F. Chitty who completed the card, including the drawing at:  http://www.search.secretshropshire.org.uk/engine/resource/default.asp?theme=&originator=%2Fengine%2Ftheme%2Fdefault.asp&page=2&records=9610&direction=2&pointer=15346&text=1&resource=15123","Bronze.  Butt semicircular, thin - sides very slightly beaten up.  Faces rise to slight ridge above centre. Ornamented with radiating punched lines down faces, worn.  Edge almost straight, blunt, re-ground; angles battered recently.","Closely related to specimen from Titterstone Clee, Shropshire which has similar ornament","","Shrops. Arch. Trans. (to be written up) Note in Shrewsbury Chronicle, 2nd March, 1928","","Elaine Dale","https://farm4.staticflickr.com/3852/14772661290_f4ffe585f3_b.jpg","https://www.flickr.com/photos/MicroPasts/14772661290"
"10723","597","Hammer flanged Flat AXE","d","Mr. J. P. Morris, Cleobury Hall, [...], Shropshire, Drawn Feb. 1928, L. F. Chitty","england shropshire, sw. cleobury, found by a workman while cultivating the late mr grant's garden in 1928, at a depth of 16-18 ins in subsoil. the ground is 4.5 [...] above the level of the surrounding valley land.,","cleobury","-2.48225562","52.38879","","None","None","1928","169","25, 38.5","78","489.825","See transcriber's comments for the full text.","Badly damagedl, argely through attempt to clean it.","12","Patina: Glossy green with brown stains broken down to core, blue-green on one face, purple-brown on reverse, with gold metal showing on edges.","Bronze","-","Butt semicircular, thin. Sides very slightly beaten up. Faces rise to slight ridge above acute. Ornamented with radiating punched lines down faces, worn. Edge almost straight, blunt [...] ground; angles battered recently.","Note in Shrewsbury Chronicle, 2nd [...], 1928.","Closely related to specimen from Tittelstone Clee, Shropshire, which has similar ornament.","Olga Michalaka","https://farm4.staticflickr.com/3852/14772661290_f4ffe585f3_b.jpg","https://www.flickr.com/photos/MicroPasts/14772661290"
"10724","543","Flat Celt","C","Shrewsbury Museum","england,shropshire,little wenlock?,found in a morass near the [...]","","-3.27657530","54.70235","","None","None","None","129","","72","","Dark black green","Rough, undulating over both surfaces","","I haven't georeferenced the site because I can't be accurate to within 10km. Diagram gives measurements for width (37) and Thickness (10), but these have not been recorded on front of card so I didn't enter them. Diagram also has artist name and and date (E C MIddleton, April 25th 1921).","Cu 99.26,Pb trace,Fe .08,As .05,Ag .19,99.58","","Surfaces of an unusual character, possibly from acidity of soil","","Donor N. Johnson","Jane Fellows","https://farm6.staticflickr.com/5562/14772655829_8accbb62df_b.jpg","https://www.flickr.com/photos/MicroPasts/14772655829"
"10724","597","Hat celt","C","Shrewsbury Museum","england, shropshire, little wenlock?, found in a morass near the [...]","","-2.52598568","52.65904","","None","None","None","129","72","","","Dark black green","Rough undulating, over both surfaces","","Sketched by E. C. Middleton April 25th 1921","Cu 99.26, Pb trace, Fe .08, As .05, Ag .19, 99.58","","Surfaces of an unusual character - possibly from acidity of soil.","","Dona N. Johnson","Olga Michalaka","https://farm6.staticflickr.com/5562/14772655829_8accbb62df_b.jpg","https://www.flickr.com/photos/MicroPasts/14772655829"
"10725",,"Flat Cell","d1","Shrewsbury Museum; Presented by RE. Clarke Esq","england; shropshire; asterton prolimoor","asterton, shropshire","-2.88902590","52.51504","","None","None","1881","103","middle 23, butt 16","48","166.55","","Smooth green brown bronze, parts worn down to blue green core which powders off","14","","Cu.85.73; Sy 14.10; Pb 0.04; Fe 0.04, As. trace, Ag. 0.03","Palstrave, No.(1952), on ...","","Vic.Co.Hist.Shropshire Vol I. p.203 under Prolley Moor, , ...... SU7C 1893.6, p.77: Simple Notes & Queries Feb.17.1893","Asterton is the valley below the ancient pathway which runs the length of the Lang... there are many round barrows along it's course, several being above Asterton. 2 in the locality being oval.","Anon.","https://farm4.staticflickr.com/3873/14772796627_4e5b3b6972_b.jpg","https://www.flickr.com/photos/MicroPasts/14772796627"
"10725",,"Flat Celt","d","Shrewsbury Museum, , pres by R.E.Clarke, Esq., , (between 1881 & 1908)","england, shropshire, asterton","prolly moor, asterton, shropshire","-2.89005587","52.52653","","None","None","None","103","middle 23 butt 16","48","166.55","","smooth green brown bronze, parts worn down to blue green core which powders off","14","","Cu.85.73 Sn 14.10 Pb. .04 Fe. .07 As. trace Ag. .03 Total 99.97","Palstave No. (1957), on evidence of palstave's powder q.v.    Asterton is in the valley below the ancient Port  Way which runs the length of the Longmynd. There are many round burrows along its course, several being above Asterton, 2 in the locality being oval.","","Vic. Co. Hist. Shropshire Vol. I. p.203 (under Prolly Moor), , Trans. Caradoc & S.V.F.C. 1893.6 p.77, , Shrops. Notes & Queries, Feb. 17, 1893","","Anon.","https://farm4.staticflickr.com/3873/14772796627_4e5b3b6972_b.jpg","https://www.flickr.com/photos/MicroPasts/14772796627"
"10726","528","Flat Axe","","?","england, shropshire, knighton, stow","knighton shropshire","-3.01312515","52.35679","SO 3100 7344","None","None","1989","67.5","blade 84","","","","Corroded and pitted","","I have assumed that the ""Stow"" given as the find-site on the card is Stowe, nr. Knighton.","","Single find","Typology: flat axe, irregular straightish sides, crescent blade, lenticular profile, , Condition: complete","","Found by a metal detectorist Aug/Sept 1989 at a depth of 2.5cm","Margaret Ellen Joy","https://farm4.staticflickr.com/3883/14936338886_f21b8a8870_b.jpg","https://www.flickr.com/photos/MicroPasts/14936338886"
"10726","543","FLAT AXE","","?","england,shropshire,knighton,stow","stowe, shropshire","-3.01317237","52.35668","","None","8","1989","67.5","","84","","","Corroded and pitted","","A different layout than I am used to. Top left says ""50 3100 7344"" in a box labelled NGR. Maybe this is a grid reference? In the Site, ""Stow"" should be ""Stowe"". Circumnstaces says :""Found by a metal-detectorist Aug/Sep 1989 at a depth of 2.5cm"". Context says ""Single Find"". I transcribed the contents of the Typology and Condition fields into Description.","","","Flat axe, irregular straightish sides, crescent blade, lenticular profile., Complete","","","Jane Fellows","https://farm4.staticflickr.com/3883/14936338886_f21b8a8870_b.jpg","https://www.flickr.com/photos/MicroPasts/14936338886"
"10726",,"Flat Axe","","?","england, shropshire knighton, stow","stowe, knighton","-3.01291488","52.35893","SO 3100 7344","None","None","1989","67.5","blade 84","","","","corroded & pitted","","Other boxes:-, , Circumstances: Found by a metal-detectorist Aug/Sept 1989 at a depth of 2.5cm, , Context: Single find","","","Typology: Flat axe, irregular stylish sides, ""[...]"" blade, lenticular profile, , Condition: complete","","","Anon.","https://farm4.staticflickr.com/3883/14936338886_f21b8a8870_b.jpg","https://www.flickr.com/photos/MicroPasts/14936338886"
"10727","528","Flat Celt (? copper)","CL","Private: Rev. Rossendale Llloyd, Aston Hall, Oswestry, Salop., , (Drawn 8.viii.1927), , L.F.C.","england, shropshire, oswestry?, aston?","oswestry","-3.05482010","52.86031","","None","None","None","110","butt 31 edge 70","","403.9875","","Hammered, regularly rough.  Probably cast in open mould. Smoothed down to edge","12","References to publications is written very faintly in pencil","Appears to be pure copper (of Wrekin Celt)","Nothing known","Side and one face hacked to test metal; edge probably blunted by shaving off rim for same purpose.  Butt hammered anciently.  Sides roughly squared and hammered to meet edge.","To appear in Shrops. Arch. Trans.","This implement was found somewhere on the Aston Hall property.  Miss E.R. Aston Hall, who stayed at Aston as a child understood that a ? bronze axe was found during repairs to an old stone wall that crosses the wood near the Hall.  On seeing drawings of this and of the palstave (q.v.), she said it is this specimen that she recollects seeing there.  Both are preserved in a table case of family treasures, but have no labels., , Marks Severn to Dee valley route via. Oswestry Hills.","Margaret Ellen Joy","https://farm4.staticflickr.com/3887/14772660940_277f8f51bf_b.jpg","https://www.flickr.com/photos/MicroPasts/14772660940"
"10727","543","Flat Celt","","Rev. Rossendale Lloyd, Aston Hall, Oswestry, Salop,Drawn 8.viii.1927,L.F.C.","england ?,shropshire ?,oswestry ?,aston ?, there is no reason to doubt that this implement was found somewhere on the aston hall property. miss e.r autton hall, who stayed on the property as a child, understood that a ? bronze axe was found duringrepairs to an old stone wall that crosses the wood near the hall. on seeing drawings of this and of the palstave (q.v.), she said it is this specimen that she recollects seeing there. both are preserved in a table case of family treasures, but have no labels","aston hall, oswestry","-2.99507889","52.84077","","None","None","None","110","31","70","404","Dark brown-purple","Hammered, regularly rough - Probably cast in open mould. Smoothed down to edge.","12","Top right corner - lower case ""a""? Says ""to appear in Shrops. Arch. Times"" in Publications, but it's so faint I'm not sure it is meant to be there. Weight says ""14 1/4 oz."", which I have converted to grammes.","appears to be pure copper (of [...] celt)","Nothing known","Side and one face hacked to test metal; edge probably blunted by shaving off rim for some purpose. Butt hammered anciently. Sides roughly squared and hammered to meet edge.","","Marks Severn to Dee Valley route via Oswestry Hills","Jane Fellows","https://farm4.staticflickr.com/3887/14772660940_277f8f51bf_b.jpg","https://www.flickr.com/photos/MicroPasts/14772660940"
"10728","433","Flat Axe","IaG","? Lost. See Note on from Eyton Hall.,Formerly in possession of one of the Mr. Hoopers of Kinnersley.,1925","england,shropshire,preston upon the weald moors,in a field about 20 yards se of the culvert, where the crow brook croses the main road from kinley wick to preston. site marked on 6 inch o.s. shrops street 36 nw. marshy ground along edge of stream. dug up by a labourer, william pickering.","preston upon the weald moors, shropshire","-2.47476280","52.73442","","None","None","None","175","24","78","","","","","Width: edge 78mm; butt 24mm","","Found with four others.","","Miss. C. Eyton. Geology of N. Shrops (1869), p. 89 (""Celts of Artistic Workmanship""),""Bye Gones"" 23 Mar. 1910 (""Cooper"" misprint for Hooper),Kelly's Directory. 1913. p. 18 [Rev. W. Houghton Trans Severn Valley F. C. 1871, Vol. 1865-73, p. 106.,Shrops. Arch. Trans. VII (1884) 349 mentions one Celt.,Shrops. Arch. Trans. LIV (1953) 1241-8 (Chitty) (Off-point in Nots, Oxon, Shrop, ""Prehistory Pamphlets holder) see L.F. Chitty's letter of 3.4.1954.","Approx. Measurements,Drawn from tracing from a tracing from Ordnance Survey Note Book (original) 36 Plan 2 Salop.  Extract from O.N.B. ""The rough sketch (full size) given below represents one of the sides of the Celt which Mr. Hooper showed me.""","Joellen mcGann","https://farm4.staticflickr.com/3913/14936338576_1a583b1ebb_b.jpg","https://www.flickr.com/photos/MicroPasts/14936338576"
"10728","528","Flat Axe","I 2 L G 1925","? Lost.  See note on from Eyton Hall, , Formerly in the posession of one of the Mr. Hoopers of Kinnersley","england, shropshire, preston-on-the-weald moors, in a field about 20 yds. se of the culvert where the crow brook crosses the main road from kinley wick to preston. dug up by a labourer, william pickering. marshy ground along edge of stream","preston shropshire","-2.69792382","52.70360","6 inch OS Shropshire Sheet 36 NW","None","None","None","175 (approx)","edge 78 (approx) butt 24 (approx)","","","","","","Writing in top RH corner is unclear","","Found with some others","","Miss C. Eyton, ""Geology of N. Shrops."" 1869, p. 89 (""Celts of artistic workmanship""), , ""Byegones"", 23 Mar. 1910 (""Cooper"" misprint for Hooper), , Kelly's Directory, 1913, p. 18, , Rev. W. Houghton, Trans. Severn Valley F.C., 1871, vol. 1865-73, p. 106, , Shrops. Arch. Trans. VII (1884) 3 Qq mentions one celt., , Shrops. Arch. Trans LIV (1953) 1241-8 (Chitty) (off-print in ""Notts, Oxon, Salop"" Prehisotry Pamphlets holder) see L.F. Chitty's letter of 3.4.1954","?Wessex type, , Drawn from tracing from a tracing from Ordnance Survey Note Book (original) 36, plan 2, Salop.  Extract from O.N.B. ""The rough sketch (full size) given below represents the sides of the Celt which Mr. Hooper showed me.""","Margaret Ellen Joy","https://farm4.staticflickr.com/3913/14936338576_1a583b1ebb_b.jpg","https://www.flickr.com/photos/MicroPasts/14936338576"
"10729","433","Flat Celt","d","Shrewsbury Museum","england,shropshire,battlefield near shrewsbury,ploughed up near a hedge, 1862.","shrewsbury, shropshire","-2.75398290","52.70791","","None","None","1862","106","49","","","","Slightly rough","","","Bronze: Copper 87.4; Tin 12.00; Iron Trace; Silver 0.006 = 99.46; Analysus by Prof. C. O. Bannister, University of Liverpool","Part of a large hoard, mostly melted: 7 other objects remain, 5 of uncertain use,  + 2 unlooped palstaves, all in Shrewsbury Museum (S. Wood Collection)","Both edges thin and sharp: rise to centre.","Proc. Soc. Ant. II (2) 251-2:V (2), 431-2.,Evans, ABI, pp. 43, 86, 405, 460, 464.,Shrops Arch. Trans. IV (2), 279 (ref. Evans): X (2) 108, Exhibit Part: III (3), xxii, Misc.,V.C.H. Shrops. I. 202,Peake, ""Bronze Age and Celtic World,"" Pl. I, 21,""Bronze Age in Wales"", p. 17","Donor J. Beacall.","Joellen mcGann","https://farm4.staticflickr.com/3925/14772729278_29b65026da_b.jpg","https://www.flickr.com/photos/MicroPasts/14772729278"
"10729","528","Flat Celt","d","Shrewsbury Museum","england, shropshire, battlefield near shrewsbury, ploughed up near a hedge, 1862","shrewsbury","-2.71913564","52.74593","","None","None","1862","106","49","","","","Slightly rough","","","Bronze. Copper 87.4 ; Tin 12 ; Iron trace ; Silver 0.006 Total 99.46  Analysis by Prof. C.O. Bannister, University of Liverpool","Part of a large hoard, mostly melted: 7 other objects remain, 5 of uncertain use and 2 unlooped palstaves","","Proc. Soc. Ant. II (2), 251.2 : V (2) 431-2, , Evans, A.B.I., pp. 43, 86, 405, 460,464, , Shrops. Arch. Trans. IV (2) 279 (nf Evans): X (2), 108, Exhib. Part: III (3), xxii, Misc, , K.C.H. Shrops I. 202, , Peake, ""Bronze Age & Celtic World"" pl. I, 21, , ""Bronze Age in Wales"", p. 17","Donor J. Beacall","Margaret Ellen Joy","https://farm4.staticflickr.com/3925/14772729278_29b65026da_b.jpg","https://www.flickr.com/photos/MicroPasts/14772729278"
"10730","528","Flat Celt","d","Shrewsbury Museum","england, shropshire, titterstone, the hill, north side","titterstone","-2.60203773","52.39897","","None","None","1889","204","121","","","good, with green on plano side, possibly cleaned to show punching on the other","Good and smooth on one side and on the other decorated with punching","","","","Near Flanged Celt, boar's tusk and tooth","Very fine example","Shrops. Notes and Queries, 10th March 1892, , Shrops. Arch. Trans. IV (2), 279 : X (2), Exhib. part, p. 108, , Auden, V.C.H. Shrops. I 202 & pl. facing p. 200","Donor H. Hodges, Ludlow","Margaret Ellen Joy","https://farm4.staticflickr.com/3876/14956228701_3d2e4fa66b_b.jpg","https://www.flickr.com/photos/MicroPasts/14956228701"
"10730","543","Flat Celt","d","Shrewsbury Museum","england,shropshire,titterstone,clee hill, north side","hopton cangeford","-2.66670631","52.41693","","None","None","1889","204","","121","","good rich green on plain side, possibly cleaned to show punching on other","Good and smooth on one side and on the other decorated with punching","","Lots of Roman numerals in the Publications meant I couldn't transcribe it exactly as it appears. Surface and patina: I'm not 100% sure that word is ""punching"". Written next to the sketch: ""No. 69. sketched by E.C. Middleton, Hardwick Road, Streetly, April (or maybe March?) 25th 1921","Bronze","near phlanged celt, boar's tusk & tooth","Very fine example","Shrops. Notes & Queries, 10th March 1893,Shrops. Arch. Trans. IV(2), 279:X(2), Exhib Past, p108,Auden, V.C.H. Shrops. I.203 & pl. facing p200","Donor H. Hodges, Ludlow","Jane Fellows","https://farm4.staticflickr.com/3876/14956228701_3d2e4fa66b_b.jpg","https://www.flickr.com/photos/MicroPasts/14956228701"
"10731","433","Flat Celt","a","Somerset Museum,Taunton Castle,Stradling Collection W.5.,Puchased 1902","england,somerset","somerset, england","-3.00000000","51.08333","","None","None","None","155","52","95","628","","","8","Site: unspecified location in Somerset,Width: edge 95mm; butt 52mm,Thickness: 8mm; 9mm","? Copper","","","Proc. Som. A + N.H.S., Vol. XLVIII, I page 83, line 8-9.","","Joellen mcGann","https://farm6.staticflickr.com/5581/14772729168_30af1daba1_b.jpg","https://www.flickr.com/photos/MicroPasts/14772729168"
"10731","528","Flat Celt","a","Somerset Museum, Taunton Castle, Stradling Collection W.5, , Purhased 1902","england, somerset","","-3.27657530","54.70235","","None","None","None","155","edge 95, butt 52","","628","","","8, 9","","? copper","","","Proc. Som. A & N. H. S. Vol XLVIII, I, page 83 lines 8-9","","Margaret Ellen Joy","https://farm6.staticflickr.com/5581/14772729168_30af1daba1_b.jpg","https://www.flickr.com/photos/MicroPasts/14772729168"
"10732","433","Flat Axe","d","Ashmolean Museum, Oxford,1927.2365, Evans Collection,W. Codrington, F. G. S. 1879.","england,?somerset,bought at bristol","somerset, england","-3.00000000","51.08333","","None","None","None","128","30","70","329","Dark green patina","","12","Width: edge 70mm; below butt 30mm,Weight: 329.3 gms","","","Butt imperfect?","","? Foreign","Joellen mcGann","https://farm4.staticflickr.com/3902/14772729088_e46e40d0b6_b.jpg","https://www.flickr.com/photos/MicroPasts/14772729088"
"10732","528","Flat Axe","d","Ashmolean Museum, Oxford, 1927.2365, Evans Coll. ""W. Codrington, F.G.S., 1879""","england, somerset, bought at bristol","","-3.27657530","54.70235","","None","None","None","12","edge 70, below butt 30","","329.3","","Dark green","12","Imprecise find site could not be Georeferenced","","","Butt imperfect","","? Foreign","Margaret Ellen Joy","https://farm4.staticflickr.com/3902/14772729088_e46e40d0b6_b.jpg","https://www.flickr.com/photos/MicroPasts/14772729088"
"10733","433","Flat Axe Miniature","d","Literary Scientific Institute, Bath","england,somerset,batheaston,banner down","batheaston, somerset","-2.29647013","51.42516","","None","None","None","88","21","48","83","Slight patina gone also lightly on sides.","Old gold colour.","6","Length: 87.8mm,Width: edge 48mm; butt 21mm,Thickness: 5.5mm,Weight: 83.3 gms","","","Good finish - no defects. Both cutting edges re-sharpened.","","","Joellen mcGann","https://farm4.staticflickr.com/3850/14772796177_9c81f58e40_b.jpg","https://www.flickr.com/photos/MicroPasts/14772796177"
"10733","528","Flat Axe Miniature","d","Literary & Scientific Institute, Bath","england, somerset, batheaston, banner down","batheaston","-2.31136176","51.40653","","None","None","None","87.8","edge 48 butt 21","","83.3","slight patina gone also slightly on sides","Rich gold colour","5.5","","","","Good finish - no defects.  Both cutting edges re-sharpened","","","Margaret Ellen Joy","https://farm4.staticflickr.com/3850/14772796177_9c81f58e40_b.jpg","https://www.flickr.com/photos/MicroPasts/14772796177"
"10734","433","Flat Celt","d","British Museum, 1964.12-6.11","england,avon,lansdown,either bartleigh, or lansdown, in the city of bath, probably the former","lansdown, somerset","-2.36659690","51.39527","","None","None","None","136","34","81","","","","","Width: edge 81mm; butt 34mm","","","","","AOK?","Joellen mcGann","https://farm4.staticflickr.com/3875/14772796077_55c8d30a19_b.jpg","https://www.flickr.com/photos/MicroPasts/14772796077"
