"taskID","userID","objectType","rightCorner","collection","site","toSearch","Lon","Lat","gridRef","dateDiscoveryDay","dateDiscoveryMonth","dateDiscoveryYear","length","width","edge","weight","patina","surface","thickness","other","composition","associations","description","publications","remarks","inputBy","imageURL","flickrURL"
"38988","226","Adze","","Herts. County Museum, St. Alban's, lent by Capt. J.H. Ball RAF, (from Canon Greenwell's Colln.)","site unknown","",,,"","None","None","None","269","across socket 56, blade at butt 45","72.5","1091.46","traces of medium green","smooth.  reddy brown copper.   Rougher on the underside (in hollow of blade etc.) from casting.  Traces of patina over this roughness.","socket 26","","","","","","","Elaine Dale","https://www.flickr.com/photos/115096994@N02/17314225383","https://farm6.staticflickr.com/5444/17314225383_bbb7056bd7_m.jpg"
"38988","580","Adze","","Herts County Museum, St. Albans,lent by Capt. J.H. Ball, RAF,(from Canon Greenwell's Collection)","Site unknown","",,,"","None","None","None","269","edge 72.25; across socket 56; blade at butt 45","","1091.46","traces of patina medium green.","smooth. reddy brown copper. Rougher on the underside (in hollow of blade etc) from casting. Traces of patina over this roughness.","socket 26","","","","","","","Denis Antoine","https://www.flickr.com/photos/115096994@N02/17314225383","https://farm6.staticflickr.com/5444/17314225383_bbb7056bd7_m.jpg"
"38988","658","Adze","","Herts. County Museum, St. Albans,, , lent by Capt. J.H. Ball, R.A.F.,, , (from Canon Greenwell's Coll'n)","","",,,"Site unknown","None","None","None","269","edge 72.14, across socket 56, blade at butt 45","","1091.46","traces of patina medium green.","smooth, reddy brown copper. Rougher on the underside (in hollow of blade etc.) from,casting. Tracers of patina over this roughness.","socket 26","","","","","","","Susan Magyarody","https://www.flickr.com/photos/115096994@N02/17314225383","https://farm6.staticflickr.com/5444/17314225383_bbb7056bd7_m.jpg"
"38989","226","Adze","","Private, 1923, Lord Howard de Walden, Belgrave Square SW, 328","","",,,"","None","None","None","155","butt 69","166","1800.22","polished dark green, mottled black","smooth","middle 18, butt 37","","","","This tapers from thick butt to the edge.","","","Elaine Dale","https://www.flickr.com/photos/115096994@N02/17747960968","https://farm6.staticflickr.com/5441/17747960968_bf664faf06_m.jpg"
"38989","580","Adze","","Private Collection,1923,Lord Howard de Walden, Belgrave Square SW.,328.","","",,,"","None","None","None","155","edge 166; butt 69","","1800.22","polished dark green. mottled black.","smooth","middle 18; butt 37","","","","This tapers from thick butt to the edge.","","","Denis Antoine","https://www.flickr.com/photos/115096994@N02/17747960968","https://farm6.staticflickr.com/5441/17747960968_bf664faf06_m.jpg"
"38989","658","Adze","","Private Collection,1923,, , Lord Howard de Walden,, , Belgrave Square SW,, , 328","","",,,"","None","None","None","155","edge 166, butt 69","","1800.22","polished dark green, mottled black.","smooth","middle 18, butt 37","","","","This tapers from thick butt to the edge.","","","Susan Magyarody","https://www.flickr.com/photos/115096994@N02/17747960968","https://farm6.staticflickr.com/5441/17747960968_bf664faf06_m.jpg"
"38990","226","Adze","","Private, E.N. Witchell Esq., Stroud, Glos.","","",,,"","None","None","None","189.5","butt 21, 36","59","425.25","of rough green, which practically covers the specimen.","rough.  Dark red copperish metal shows in places & traces of light earth encrusted.","blade 6.5, 8.5, near the edge 8, butt end 10","","","","The butt is flat & thick.  The sides from butt to edge are rounded off, but get flatter towards the edge.  Edge is bevelled & sharpened on one side only.","","","Elaine Dale","https://www.flickr.com/photos/115096994@N02/17932735672","https://farm6.staticflickr.com/5321/17932735672_0906231624_m.jpg"
"38990","580","Adze","","Private Collection,E.N. Witchell Esq., Strand, Glos.","","",,,"","None","None","None","189.5","edge 59,butt 21; 36","","425.25","encristed patina of rough green, which practically covers the specimen.","rough. Dark red copperish metal shows in places, & traces of light earth.","blade 6.5; 8.5,near the edge 8,butt end 10","","","","The butt is flat & thick. The sides from butt to edge are rounded off, but get flatter towards the edge. Edge is bevelled & sharpened on one side only.","","","Denis Antoine","https://www.flickr.com/photos/115096994@N02/17932735672","https://farm6.staticflickr.com/5321/17932735672_0906231624_m.jpg"
"38990","658","","","","","",,,"","None","None","None","","","","","","","","","","","","","","Susan Magyarody","https://www.flickr.com/photos/115096994@N02/17932735672","https://farm6.staticflickr.com/5321/17932735672_0906231624_m.jpg"
"38991","226","Axe Hammer","","Charterhouse Museum, No. 86/4","","",,,"","None","None","None","157","butt 17, hole 24","31","604","patches of green","in rough condition, dark rich brown","46.5","","","","","","","Elaine Dale","https://www.flickr.com/photos/115096994@N02/17747585218","https://farm9.staticflickr.com/8805/17747585218_c3b2830906_m.jpg"
"38991","580","Axe Hammer","","Charterhouse Museum. No. 86/4.","","",,,"","None","None","None","157","edge 31; butt 17; hole 24 (diam)","","604","patches of green patina","in rough condition. dark rich brown","46.5","","","","","","","Denis Antoine","https://www.flickr.com/photos/115096994@N02/17747585218","https://farm9.staticflickr.com/8805/17747585218_c3b2830906_m.jpg"
"38991","658","Axe Hammer","","Charterhouse Museum, No. 86/4","","",,,"","None","None","None","157","edge 31, butt 17, hole 24 (diam.)","","604","patches of green patina.","in rough condition, dark rich brown.","46.5","","","","","","","Susan Magyarody","https://www.flickr.com/photos/115096994@N02/17747585218","https://farm9.staticflickr.com/8805/17747585218_c3b2830906_m.jpg"
"38992","226","Perforated Axe","","Brentford Public Library, Layton Collection, O.1257","","",,,"","None","None","None","154","(socket) 40","55","","Green, worn off and chipped showing red on copper-coloured metal.","corroded","(socket) 36","","","","","","","Elaine Dale","https://www.flickr.com/photos/115096994@N02/17932735272","https://farm6.staticflickr.com/5348/17932735272_bdabc16854_m.jpg"
"38992","580","Perforated Axe","","Brentford Public Library,Layton Collection,O.1257.","","",,,"","None","None","None","154","edge 55; socket 40","","","Green patina, worn off and chipped showing red or copper-coloured metal.","corroded.","socket 36","","","","","","","Denis Antoine","https://www.flickr.com/photos/115096994@N02/17932735272","https://farm6.staticflickr.com/5348/17932735272_bdabc16854_m.jpg"
"38992","658","Perforated Axe","","Brentford Public Library,, , Layton Collection,, , 0.1257","","",,,"","None","None","None","154","(edge) 55, (socket) 40","","","Green patina, worn off and chipped showing red or coffee-coloured metal.","corroded.","(socket) 36","","","","","","","Susan Magyarody","https://www.flickr.com/photos/115096994@N02/17932735272","https://farm6.staticflickr.com/5348/17932735272_bdabc16854_m.jpg"
"38993","226","Axe head","","Royal Scottish Museum, Edinburgh, Reg. No. 1882.59.21","Note: From the colour of the bronze and the patina it would appear to come from Egypt or Assyria, but examples similar in form have been found in S. Italy","",,,"","None","None","None","90","32, centre 20","","94","Bronze colour with patches of light green.","in fair condition","23","","","","Axe head (wanting the spike or hammer portion)","","","Elaine Dale","https://www.flickr.com/photos/115096994@N02/17748965019","https://farm8.staticflickr.com/7758/17748965019_feae21836d_m.jpg"
"38993","658","Axe head","","Royal Scottish Museum,, , Edinburgh,, , Reg. No. 1882.59.21","Note: from the colour of the,bronze and the patina, it,would appear to come from Egypt or Assyria, but examples,similar in form have been,found in S. Italy.","",,,"","None","None","None","90","32, centre 20","","94","Bronze colour with patches,of light green.","in fair condition.","23, 7","","","","Axe head (wanting,the spike or hammer,portion).","","","Susan Magyarody","https://www.flickr.com/photos/115096994@N02/17748965019","https://farm8.staticflickr.com/7758/17748965019_feae21836d_m.jpg"
"38993","677","Axe head","","Royal Scottish Museum, , Edinburgh , , Reg. No: 1882.59.21.","Note: From the colour of the bronze and the patina it would appear to come from Egypt or Assyria, but examples similar in form have been found in S. Italy.","",,,"","None","None","None","90","32 centre 20","","948","Bronze colour with patches of light green.","in fair condition","23 : 7","There does appear to be some information missing.","","","Axe head (wanting the spike or hammer portion)","","","Michael George Adams","https://www.flickr.com/photos/115096994@N02/17748965019","https://farm8.staticflickr.com/7758/17748965019_feae21836d_m.jpg"
"38994","226","Axe","","Royal Scottish Museum, Edinburgh, Reg. No. 1894.191","Uncertain. Similar implements assigned to the Bronze Age, have been found in the terramare in the vicinity of Parma.","",,,"","None","None","None","184","90, centre 38, butt 22","","16382","green","in good condition","20, 6","no decimal point in the weight but I'm guessing there should be one??","","","Implement, flat, thin spade with open socket partitioned lengthwise, and having one nail hole.","","","Elaine Dale","https://www.flickr.com/photos/115096994@N02/17932857022","https://farm6.staticflickr.com/5350/17932857022_9c16215867_m.jpg"
"38994","658","Axe","","Royal Scottish Museum,, , Edinburgh,, , Reg. No. 1894.191, ,","Uncertain,(Similar implements assigned to,the Bronze Age, have been,found in the terramare in the vicinity of Parma.)","",,,"","None","None","None","184","990 centre, butt 38, 22","","163","Green patina.","in good condition.","20, 6","","","","Implement, flat,,thin spade with,open socket partitioned,lengthwise,,[and having one,nail hole.","","","Susan Magyarody","https://www.flickr.com/photos/115096994@N02/17932857022","https://farm6.staticflickr.com/5350/17932857022_9c16215867_m.jpg"
"38994","677","Axe.","","Royal Scottish Museum, , Edinburgh, , Reg. No: 1894.191.","Uncertain., [Similar implements assigned to the Bronze Age, have been found in the terramase in the vicinity of Parma.","",,,"","None","None","None","184","90 centre 38. butt 22","","16382","green","in good condition","20 - 6","Some of the handwriting was difficult to decipher/ follow. I made my best possible judgement. Also some information appears to be missing.","","","Implement, flat, thin spade with open socket partitioned lengthwise, and having one nail hole.","","","Michael George Adams","https://www.flickr.com/photos/115096994@N02/17932857022","https://farm6.staticflickr.com/5350/17932857022_9c16215867_m.jpg"
"38995","580","Axe (Hungarian Type)","","Private collection,Professor Sir Lucas-White-King CSI. LLD. FSA,late of Roebuck Hall, Co Dublin.,Sold by Auction at Sotheby's 9. 11. 21. Lot 139.","Locality unknown","",,,"","None","None","None","100","edge 45.5; socket end 25","","","thick dar green.","smooth","37","","","","","","","Denis Antoine","https://www.flickr.com/photos/115096994@N02/17748082128","https://farm8.staticflickr.com/7749/17748082128_905ddf80e0_m.jpg"
"38995","658","Axe (Hungarian Type)","","Private Collection,, , Professor Sir Lucas White-King, CSI, LLD, FSA.,, , Late of Roebuck Hall, Co. Dublin,, , Sold by auction at Sotheby's, 9/11/21,, , Lot 139.","Locality unknown","",,,"","None","None","None","100","edge 45.5, socket end 25","","","thick dark green.","smooth","37","","","","","","","Susan Magyarody","https://www.flickr.com/photos/115096994@N02/17748082128","https://farm8.staticflickr.com/7749/17748082128_905ddf80e0_m.jpg"
"38995","973","axe (Hungarian Type)","-","Private,Professor Sir Lucas White-King. CSI. LLD. FSA.,Late of Roebuck Hall. Co. Dublin.,Sold by auction at Sotheby's 9.11.21.,Lot 139.","Locality unknown","",,,"-","None","None","None","100","25","45.5","-","thick dark green","smooth","37","Width recorded as ""edge 45.5 socket end 25"" - I have recorded only the numbers in the boxes themselves","-","-","-","-","-","Alexandra Hayes","https://www.flickr.com/photos/115096994@N02/17748082128","https://farm8.staticflickr.com/7749/17748082128_905ddf80e0_m.jpg"
"38996","580","Axe","","Peabidy Museum,Harvard University, Cambridge, Mass. E 2182,Bequest of Prof. H.W. Haynes. 1912","Locality unknown","",,,"","None","None","None","159","edge 68; butt 65","","992.25","heavy dark.","","socket 38","","","","","","","Denis Antoine","https://www.flickr.com/photos/115096994@N02/17747416700","https://farm9.staticflickr.com/8834/17747416700_d95e640c69_m.jpg"
"38996","658","Axe","","Peabody Museum,, , Harvard University, E2182,, , Cambridge, Mass.,, , Bequest of Prof. Id. W. Haynes, 1912.","locality unknown","",,,"","None","None","None","159","edge 68, butt 65","","992.25","heavy, dark.","","socket 38","","","","","","","Susan Magyarody","https://www.flickr.com/photos/115096994@N02/17747416700","https://farm9.staticflickr.com/8834/17747416700_d95e640c69_m.jpg"
"38996","973","axe","-","Peabody Museum,Harvard University E2182,Cambridge,Mass.,Bequest of Prof. Id. W. Haynes 1912","locality unknown","",,,"-","None","None","None","159","65","68","992.25","heavy. dark","","38","Width field: ""edge 68 butt 65"", , Thickness field: ""socket 38""","-","-","-","","-","Alexandra Hayes","https://www.flickr.com/photos/115096994@N02/17747416700","https://farm9.staticflickr.com/8834/17747416700_d95e640c69_m.jpg"
"38997","580","Axe","","Peabody Museum,Harvard University, Cambridge, Mass. E 2406,Bequest of Prof. H.W. Haynes, 1912.","Locality unknown","",,,"","None","None","None","127","edge 53; butt 29","","","dark","","socket 43; butt 29","","","","","","","Denis Antoine","https://www.flickr.com/photos/115096994@N02/17909029326","https://farm6.staticflickr.com/5466/17909029326_ba5aa122ee_m.jpg"
"38997","658","Axe","","Peabody museum,, , Harvard University, E2406,, , Cambridge, Mass.,, , Bequest of Prof. Id. W. Haynes, 1912, ,","locality unknown","",,,"","None","None","None","127","edge 53, butt 29","","","dark.","","socket 43, butt 29","","","","","","","Susan Magyarody","https://www.flickr.com/photos/115096994@N02/17909029326","https://farm6.staticflickr.com/5466/17909029326_ba5aa122ee_m.jpg"
"38997","973","axe","-","Peabody Museum,Harvard University E 2406,Cambridge. Mass.,Bequest of Prof. Id. W. Haynes 1912","Locality unknown","",,,"","None","None","None","127","29","53","-","dark","-","43","Width field: ""edge 53 butt 29"", , Thickness field: ""socket 43 butt 29""","-","-","-","-","-","Alexandra Hayes","https://www.flickr.com/photos/115096994@N02/17909029326","https://farm6.staticflickr.com/5466/17909029326_ba5aa122ee_m.jpg"
"38998","580","Axe","","Peabody Museum,Harvard University, Cambridge, Mass. E 2226.,Bequest of Prof. H.W. Haynes, 1912.","locality unknown","",,,"","None","None","None","194","edge 64; butt 50","","","light","","socket 38","","","","","","","Denis Antoine","https://www.flickr.com/photos/115096994@N02/17748440919","https://farm6.staticflickr.com/5455/17748440919_47df0679fa_m.jpg"
"38998","658","Axe","","Peabody Museum, E2226[,, , Harvard University,, , Cambridge, Mass.,, , Bequest of Hy. W. Haynes, 1912.","locality unknown","",,,"","None","None","None","194","edge 64, butt 50","","","light.","","socket 38","","","","","","","Susan Magyarody","https://www.flickr.com/photos/115096994@N02/17748440919","https://farm6.staticflickr.com/5455/17748440919_47df0679fa_m.jpg"
"38998","973","axe","-","Peabody Museum E2226.,Harvard University,Cambridge Mass.,Bequest of Hy. W. Haynes. 1912","Locality unknown","",,,"-","None","None","None","194","50","64","-","light","-","38","Width field: ""edge 64 butt 50"", , Thickness field: ""38 socket""","-","","-","","","Alexandra Hayes","https://www.flickr.com/photos/115096994@N02/17748440919","https://farm6.staticflickr.com/5455/17748440919_47df0679fa_m.jpg"
"38999","580","Axe-head?","","Sotheby's Sale, 27. v. 29.,Lot No. 182,(with scription arrow-head).","Site unknown.","",,,"","None","None","None","182","137; butt 85","","1559.224 [...] Troy.","","","17","","Bronze","","","","","Denis Antoine","https://www.flickr.com/photos/115096994@N02/17746851338","https://farm6.staticflickr.com/5324/17746851338_a9c1dab131_m.jpg"
"38999","658","Axe-head?","","Sotheby's Sale: 27/V/29,, , Lot No. 182,, , (with Scythian arrow-head).","Site unknown.","",,,"","None","None","None","182","137, butt 85","","1559.22","","","17","","Bronze","","","","","Susan Magyarody","https://www.flickr.com/photos/115096994@N02/17746851338","https://farm6.staticflickr.com/5324/17746851338_a9c1dab131_m.jpg"
"38999","973","axe-head?","-","Sotheby's sale, 27.v.29-,Lot No. 182,(with Scythian arrow-head)-","Site unknown.","",,,"","None","None","None","182","137","21","1726.24296","-","-","17","Width field: ""137 mm, butt 85 mm"", , Weight is given in Troy ounces and pennyweight: ""55 oz. 10 dwt,Troy"", , Edge is recorded in the drawing, not on the main section of the card","Bronze","-","-","-","-","Alexandra Hayes","https://www.flickr.com/photos/115096994@N02/17746851338","https://farm6.staticflickr.com/5324/17746851338_a9c1dab131_m.jpg"
"39000","580","Axe","","Museum of London,Brentford Public Library,Layton Collection, O 1257","locality unknown","",,,"","None","None","None","151","edge 55.25; at section 34.5; socket 42","","","dark reddy brown, medium & light green & light blue.","slightly encrusted, roughish & pitted.","section 17; 26,socket 41.5","","","","Edge is burred.","","","Denis Antoine","https://www.flickr.com/photos/115096994@N02/17314439343","https://farm9.staticflickr.com/8838/17314439343_f5307d5687_m.jpg"
"39000","658","Axe","","Museum of London,, , Brentford Public Library,, , Layton Coll'n., 01257","locality unknown","",,,"","None","None","None","151","edge 55.25, at section 34.5, socket 42","","","dark reddy brown, medium & light green & light blue.","slightly encrusted, roughish & pitted.","section 17, 26, socket 41.5","","","","Edge is burred.","","","Susan Magyarody","https://www.flickr.com/photos/115096994@N02/17314439343","https://farm9.staticflickr.com/8838/17314439343_f5307d5687_m.jpg"
"39000","973","axe","-","Museum of London,Brentford Public Library,Layton Coll. 01257","Locality unknown","",,,"-","None","None","None","151","34.5","55.25","-","dark reddy brown, medium & light green & light blue.","slightly encrusted, roughish & pitted.","41.5","Not sure of last word in Composition field - poss. 'honed'?, , Width field: ""edge 55.25 at section 34.5 socket 42"", , Thickness field: ""section 17.  26.  socket 41.5"", , Bottom of the drawing section marked as 'hollowed'","Edge is [...]","-","-","-","-","Alexandra Hayes","https://www.flickr.com/photos/115096994@N02/17314439343","https://farm9.staticflickr.com/8838/17314439343_f5307d5687_m.jpg"
"39001","433","Axe","","Sotheby's Sale 14.12.25, lot 285,Property of Mons. Fenardent","Locality unknown","",,,"","None","None","None","162","edge 83; butt 39.5","","","Mostly medium green this side. On other side patina is covered with greyish soil.","About 3/4 roughs.","5 to 10.5","","","","A flat blade which thickens towards butt. Edge bevelled on one side only.","","Painted on: 14076 BL/-","Joellen mcGann","https://www.flickr.com/photos/115096994@N02/17748835839","https://farm8.staticflickr.com/7757/17748835839_41ff696c08_m.jpg"
"39001","580","Axe","","Sotheby's Sale 14. 12. 25. Lot 285,property of Mons. Fenardent.","locality unknown","",,,"","None","None","None","162","edge 83; butt 39.5","","","mostly medium green this side. on other side patina is covered with greyish soil.","about 3/4 roughs.","5 to 10.5","","","","a flat blade which thickens towards butt. Edge bevelled on one side only.","","Painted on ""14076. BL/-""","Denis Antoine","https://www.flickr.com/photos/115096994@N02/17748835839","https://farm8.staticflickr.com/7757/17748835839_41ff696c08_m.jpg"
"39001","658","Axe","","Sotheby's Sale, 14/12/25, Lot 285,, , property of Mons. Fenardent.","locality unknown.","",,,"","None","None","None","162","edge 83, butt39.5","","","mostly medium green this side, on other side patina is covered with greyish,soil.","about ¾ roughs.","5 to 10.5","","","","A flat blade which thickens toward butt.,, , Edge beveled on one side only.","","Painted on: 14076,BL/-, ,","Susan Magyarody","https://www.flickr.com/photos/115096994@N02/17748835839","https://farm8.staticflickr.com/7757/17748835839_41ff696c08_m.jpg"
"39002","433","Axe","","Private Collection,1924,H. Mothersole Esq.,Warren House. Roxwell Road, Chelmsford","Locality unknown,Label: owner brought from Northern part of England. Been in possession of family over 60 years. Purchased at Boreham, near Chelmsford, 1923. locality unknown","",,,"","None","None","None","168","edge 61; butt 25.5","","655.28","Fairly thick patina, very dark brown + a dark reddy brown. Medium green on socket sides.","Rather pocked round edge. Each side of socket is much pocked. Slightly corroded in sock. holes.","socket 33","","","","Dented edge. The butt is flattened. Cast mark at C. The dotted lines indicate a bevel to the socket + a hollow that runs along the side of blade. This is only on the other side. Greatest depth 2.5mm.","","","Joellen mcGann","https://www.flickr.com/photos/115096994@N02/17312516094","https://farm8.staticflickr.com/7708/17312516094_5f43739abe_m.jpg"
"39002","580","Axe","","Private Collection, 1924.,H. Mothersole Esq., Warren House, Roxwell Road, Chelmsford.","locality unknown,label: owner brought from Northern part of England. Been in possession of family over 60 years. Purchased at Boreham, near Chelmsford 1923. locality unknown.","",,,"","None","None","None","168","edge 61; butt 25.5","","655.28","fairly thick patina very dark brown & a dark reddy brown. Medium green on socket sides.","rather pocked roudn edge.Each side of socket is much pocked, slightly corroded in pock holes.","socket 33","","","","Dented edge. The butt is flattened. Cast mark at C. The dotteed lines indicate a bevel to the socket & a hollow that runs along side of blade. This is only on the other side. Greatest depth 2.5 mm.","","","Denis Antoine","https://www.flickr.com/photos/115096994@N02/17312516094","https://farm8.staticflickr.com/7708/17312516094_5f43739abe_m.jpg"
"39002","658","Axe","","Private Collection, 1924,, , Id. Mothersole, Esq.,, , Warren House, Roxwell Road,, , Chelmsford.","locality unknown,, Label -,, owner brought from Northern part,of England. Been in possession,of family over 60 years. Purch'd at Boreham, near Chelmsford, 1923.,Locality unknown.","",,,"","None","None","None","168","edge 61, butt 25.5","","655.28","fairly thick patina, very dark brown & a dark reddy brown. Medium green on socket sides.","rather pocked round edge. Each side of socket is much pocked. Slightly corroded in pock holes.","socket 33","","","","Dented edge.,, , The butt is flattened. Cast marks at C. The dotted lines indicate a bevel to the socket,& a hollow that runs along side of blade. This is only on the other side. Greatest depth 2.5 mm.","","","Susan Magyarody","https://www.flickr.com/photos/115096994@N02/17312516094","https://farm8.staticflickr.com/7708/17312516094_5f43739abe_m.jpg"
"39003","433","Axe","","Private Collection,F. Ransom Esq., Hitchin","","",,,"","None","None","None","139.5","edge 106; stem 18; socket 36","","590.85","Dark green rough patina shows where encrustment is chipped, near edge at one side.","Rough and much encrusted - light greyish green + rust colour.","socket 35","","","","Decorated with a hollowed pattern on each side. Socket is full of clay and some in hollows of decoration.","","","Joellen mcGann","https://www.flickr.com/photos/115096994@N02/17934681725","https://farm8.staticflickr.com/7753/17934681725_de67a94b51_m.jpg"
"39003","580","Axe","","Private Collection,F. Ransom Esq., Hitchin.","","",,,"","None","None","None","139.5","edge 106; stem 18; socket 36","","590.85","dark green rough patina shows where encrustment is chipped, near edge at one side.","rough & much encrusted. light greyish green & rust colour.","socket 35","","","","Decorated with a hollowed pattern on each side. Socket is full of clay & some hollows of decoration.","","","Denis Antoine","https://www.flickr.com/photos/115096994@N02/17934681725","https://farm8.staticflickr.com/7753/17934681725_de67a94b51_m.jpg"
"39003","658","Axe","","Private Collection,, , F. Ransom, Esq., Hitchin.","","",,,"","None","None","None","139.5","edge 106, stem 18, socket 36","","590.85","Dark green rough patina shows where encrustment is chipped, near edge at one side.","rough & much encrusted - light greyish green & rust colour.","socket 35","","","","Decorated with a hollowed pattern on each side. Socket is full of clay & some in hollows of decoration.","","","Susan Magyarody","https://www.flickr.com/photos/115096994@N02/17934681725","https://farm8.staticflickr.com/7753/17934681725_de67a94b51_m.jpg"
"39004","433","Axe","","W. C. Martins, George Rd. Edgbaston","Locality unknown","",,,"","None","None","None","137","","103","","Dark Bronze-Green","Smooth but considerably ""bellied""","","","","","","","See Windle pp. 94-95, Fig. 39","Joellen mcGann","https://www.flickr.com/photos/115096994@N02/17748425009","https://farm9.staticflickr.com/8869/17748425009_73ee4c5ffc_m.jpg"
"39004","580","Axe","","Mr. C. Martins, George Rd., Edgbaston","Locality unknown.","",,,"","None","None","None","137","edge 103","","","Dark Bronze-Green","Smooth but considerably ""bellied""","","","Bronze","","","See Windle pp. 94-95, Fig. 39","See Windle pp. 94-95, Fig. 39","Denis Antoine","https://www.flickr.com/photos/115096994@N02/17748425009","https://farm9.staticflickr.com/8869/17748425009_73ee4c5ffc_m.jpg"
