"taskID","userID","objectType","rightCorner","collection","site","toSearch","Lon","Lat","gridRef","dateDiscoveryDay","dateDiscoveryMonth","dateDiscoveryYear","length","width","edge","weight","patina","surface","thickness","other","composition","associations","description","publications","remarks","inputBy","imageURL","flickrURL"
"39004","658","Axe","","W.C. Martins,,, , Genge Rd., Edgbaston","Locality unknown.","",,,"","None","None","None","137","(edge) 103","","","Dark bronze-green.","Smooth but considerably ""bellied"".","","","Bronze","","","","See Windle, pp. 94-95,Fig. 39.","Susan Magyarody","https://www.flickr.com/photos/115096994@N02/17748425009","https://farm9.staticflickr.com/8869/17748425009_73ee4c5ffc_m.jpg"
"39005","433","Flanged Celt","","Private Collection,Sotheby's 24.v.21, Lot 308","","",,,"","None","None","None","181","24","58","","A polished pale green patina showing beneath above.","Rough all over, with a sort of ""bubbly"" yet rough corrosion covering the surface. This is of various shades of green.","11, 9, 12; 10,15","","","","This looks as if it might have been subjected to fire.","","Labelled on blade: Bazzans, Italy, St/-","Joellen mcGann","https://www.flickr.com/photos/115096994@N02/17936559631","https://farm6.staticflickr.com/5337/17936559631_2342fa0bdd_m.jpg"
"39005","580","Flanged Celt","","Private Collection,Sotheby's 24. v. 21. Lot 308.","","",,,"","None","None","None","181","edge 58; butt 24","","","a polished pale green patina showing beneath above.","rough all over, with a sort of ""bubby"" yet rough corrosion covering the surface. This is of various shades of green.","11; 9; 12,10; 15","","","","This looks as if it might have been subjected to fire.","","Labelled on blade: ""Bazzano, Italy. st/-""","Denis Antoine","https://www.flickr.com/photos/115096994@N02/17936559631","https://farm6.staticflickr.com/5337/17936559631_2342fa0bdd_m.jpg"
"39005","658","","","","","",,,"","None","None","None","","","","","","","","","","","","","","Susan Magyarody","https://www.flickr.com/photos/115096994@N02/17936559631","https://farm6.staticflickr.com/5337/17936559631_2342fa0bdd_m.jpg"
"39006","433","Flanged Celt","","Private Collection,Sotheby's 24.v.21, Lot 308","","",,,"","None","None","None","190","39","60","","Pale olive green patina with golden bronze showing on sides of flanges.","Smooth. Clay adhering on septum about position of section.","34, 36, 8, 16","","Bronze","","","","A note on blade in ink: ""Roman or Etrexcan. Bought 15/- 1/10/49 (79, 99?)"" ? the year is indistinct.","Joellen mcGann","https://www.flickr.com/photos/115096994@N02/17935486091","https://farm9.staticflickr.com/8891/17935486091_0d01670291_m.jpg"
"39006","580","Flanged Celt","","Private Collection,Sotheby's Sale, 24. v. 21. Lot 308.","","",,,"","None","None","None","190","edge 60; butt 39","","","pale olive green patina with golden bronze showing on sides of flanges.","smooth. Clay adhering on septum about position of section.","34; 36; 8; 16","","bronze","","","","A note on blade in ink ""Roman ot Etrexean. Bought 15 /- 1/10/49-79-99 (? the year is indistinct)","Denis Antoine","https://www.flickr.com/photos/115096994@N02/17935486091","https://farm9.staticflickr.com/8891/17935486091_0d01670291_m.jpg"
"39006","658","","","","","",,,"","None","None","None","","","","","","","","","","","","","","Susan Magyarody","https://www.flickr.com/photos/115096994@N02/17935486091","https://farm9.staticflickr.com/8891/17935486091_0d01670291_m.jpg"
"39007","433","Axe","","At Sotheby's Sale 31.7.23 (?),Bought by a dealer from MacGregor Collection (Lot 245)","Locality unknown","",,,"","None","None","None","","44 x 44 (edge to handle)","","49.61 gms including handle","","Rust coloured copper, with a few specks of corrosion","even thickness of 1mm","","","","The blade is wedged into a slot.","","Catalogued as: ""Ancient Egyptian Axe. Copper head + wood handle.""","Joellen mcGann","https://www.flickr.com/photos/115096994@N02/17936616151","https://farm9.staticflickr.com/8864/17936616151_9da755e06d_m.jpg"
"39007","580","Axe - Scraper (faked stick)","","At Sotheby's Sale 31. 7. 23 (?),bought by a dealer from Mac Gregor Collection (Lot 245)","locality unkonwn","",,,"","None","None","None","","44 x 44 (edge to handle)","","49.61 including handle","","rust coloured copper, with a few specks of corrosion.","even thickness of 1","","","","The blade is wedged into a slot","","Catalogued as ""Ancient Egyptian Axe. Copper head & wood handle.""","Denis Antoine","https://www.flickr.com/photos/115096994@N02/17936616151","https://farm9.staticflickr.com/8864/17936616151_9da755e06d_m.jpg"
"39007","658","Axe","","at Sotheby's Sale (31/7/23(?),, , bought by a dealer from MacGregor Coll'n. (Lot 245)","locality unknown","",,,"","None","None","None","","44 x 44 (edge to handle)","","49.61 including handle","","rust coloured copper, with a few specks of corrosion.","even thickness of 1 mm.","","","","The blade is wedged into a slot.","","Catalogued as -,""Ancient Egyptian Axe. Copper head & wood handle.""","Susan Magyarody","https://www.flickr.com/photos/115096994@N02/17936616151","https://farm9.staticflickr.com/8864/17936616151_9da755e06d_m.jpg"
"39008","433","Axe","","Mr. Christopher Martin,George Rd. Edgbaston, B'ham.","","",,,"","None","None","None","","","","","","","","","Bronze","","This was described to me as a ""double Axe"" it is one of 3 recorded on a staff card, it is certainly the roughest + most uncouth object I have ever sketched in sketches No. 55 + 56.","","","Joellen mcGann","https://www.flickr.com/photos/115096994@N02/17935922295","https://farm8.staticflickr.com/7791/17935922295_265b945227_m.jpg"
"39008","580","Axe","","Mr. Christopher Martin, George Rd., Edgbaston, Bham.","","",,,"","None","None","None","","","","","","","","","Bronze.","","This was described to me as a ""double Axe"" it is one of 3 mounted on a stiff card, it is certainly the roughest & most uncouth object I have ever sketched. on sketches No. 55 & 56.","","","Denis Antoine","https://www.flickr.com/photos/115096994@N02/17935922295","https://farm8.staticflickr.com/7791/17935922295_265b945227_m.jpg"
"39008","658","Axe","","W.. Christopher Martin,, , George Rd., Edgbaston, B[...]","","",,,"","None","None","None","","","","","","Extremely rough.","","","Bronze","","This was described,to me as a ""double,axe"", it is one of 3,mounted on a stiff,card, it is certainly,the roughest & most,uncouth object I have,ever sketched. [...] sketches No. 55 & 56.","","","Susan Magyarody","https://www.flickr.com/photos/115096994@N02/17935922295","https://farm8.staticflickr.com/7791/17935922295_265b945227_m.jpg"
"39009","433","Dagger","","Sotheby's Sale 31.7.23, (Mrs. Randolph Berens) Lot 96,14 Princes Gdns, S.W.","Locality unknown","",,,"","None","None","None","227","blade 21, 43.5; hilt 50","","99.22","Dark brown matte.","Slightly rough - a little encrustment. Very coppery in appearance.","19 hilt; 3.5 blade","","","","The hilt consists of ivory + wood, in which are 11 rivets.","","","Joellen mcGann","https://www.flickr.com/photos/115096994@N02/17748412269","https://farm9.staticflickr.com/8757/17748412269_789e6ceb9c_m.jpg"
"39009","580","Dagger","","Sotheby's Sale 31. 7. 23. Lot 96.,(Mrs. Rnadolph Berens, 14 Princes Gdns. SW.)","locality unknown","",,,"","None","None","None","227","blade 21; 43.5,hilt 50","","99.22","dark brown matte.","slightly rough. a little encrustment. Very coppery appearance.","hilt 19","","","","The hilt consists of ivory & wood, in which are 11 rivets.","","","Denis Antoine","https://www.flickr.com/photos/115096994@N02/17748412269","https://farm9.staticflickr.com/8757/17748412269_789e6ceb9c_m.jpg"
"39009","658","Dagger","","Sotheby's: 31/7/23,, , Sale (Mrs. Randolph Berens) Lot 96,, , 14 Princes' Gdns. SW","Locality unknown","",,,"","None","None","None","227","blade 21, 43.5; hilt 50","","99.22","dark brown matte.","Slightly rough - a little encrustment. Very coppery in appearance.","19 hilt, 3.5 blade","","","","The hilt consists of ivory & wood, in which are 11 rivets.","","","Susan Magyarody","https://www.flickr.com/photos/115096994@N02/17748412269","https://farm9.staticflickr.com/8757/17748412269_789e6ceb9c_m.jpg"
"39010","433","Tanged Dagger","","Sotheby's Sale, 12.ix.28,Lot No. 346 - 3 Daggers,Vendor, a Nobleman","","",,,"","None","None","None","155","25","","56.7","","","7","Weight: 2 oz. = 56.69 gms","","","","","","Joellen mcGann","https://www.flickr.com/photos/115096994@N02/17312473334","https://farm8.staticflickr.com/7727/17312473334_87b9d7dc37_m.jpg"
"39010","580","Tanged Dagger","","Sotheby's Sale, 12. xi. 28. Lot No. 346. 3 Daggers,Vendor, a Nobleman.","?","",,,"","None","None","None","155","25","","56.69905","","","7","Weight: 2 oz","","","","","","Denis Antoine","https://www.flickr.com/photos/115096994@N02/17312473334","https://farm8.staticflickr.com/7727/17312473334_87b9d7dc37_m.jpg"
"39010","658","Tanged Dagger","","Sotheby's Sale, 21/XI/28,, , Lot No. 346 - 3 Daggers.,, , Vendor: a Nobleman.","?","",,,"","None","None","None","155","25","","56.69","","","7","","","","","","","Susan Magyarody","https://www.flickr.com/photos/115096994@N02/17312473334","https://farm8.staticflickr.com/7727/17312473334_87b9d7dc37_m.jpg"
"39011","433","Tanged Dagger","","Sotheby's Sale, 12.xi. 28,Lot No. 346 3 daggers,Vendor, a Nobleman","","",,,"","None","None","None","157","25","","56.7","","","6","Weight: 2 oz. = 56.699 gms","","","","","","Joellen mcGann","https://www.flickr.com/photos/115096994@N02/17314160143","https://farm8.staticflickr.com/7690/17314160143_d4c4d5ab5f_m.jpg"
"39011","580","Tanged Dagger","","Sotheby's Sale, 12. xi. 28. Lot No. 346. 3 daggers.,Vendor, a Nobleman.","?","",,,"","None","None","None","157","25","","56.69905","","","6","Weight: 2 oz","","","","","","Denis Antoine","https://www.flickr.com/photos/115096994@N02/17314160143","https://farm8.staticflickr.com/7690/17314160143_d4c4d5ab5f_m.jpg"
"39011","658","Tanged Dagger","","Sotheby's Sale, 12/XI/28,, , Lot No. 346 - 3 Daggers,, , Vendor: a Nobleman.","?","",,,"","None","None","None","1557","25","","56.69","","","6","","","","","","","Susan Magyarody","https://www.flickr.com/photos/115096994@N02/17314160143","https://farm8.staticflickr.com/7690/17314160143_d4c4d5ab5f_m.jpg"
"39012","433","Dagger","","Sotheby's Sale 31.7.23, Lot 96,(Mrs. Randolph Berens),14 Princes Gdns, SW","Locality unknown","",,,"","None","None","None","248","blade 36, 40; hilt 42","","128","Dark brown patina and golden bronze.","Smooth","blade 5","","","","The shaded portion denotes remains of wood rivetted and tacked to hilt.","","","Joellen mcGann","https://www.flickr.com/photos/115096994@N02/17748078808","https://farm6.staticflickr.com/5330/17748078808_83a3d16e7a_m.jpg"
"39012","580","Dagger","","Sotheby's Sale, 31. 7. 23. Lot No. 96.,(Mrs. Randolph Berens, 14 Princes Gdns, SW.)","locality unknown","",,,"","None","None","None","248","blade 36; 40,hilt 42","","128","dark brown patina & golden bronze.","smooth","blade 5","","","","The shaded portion denotes remains of wood rivetted & tacked to hilt.","","","Denis Antoine","https://www.flickr.com/photos/115096994@N02/17748078808","https://farm6.staticflickr.com/5330/17748078808_83a3d16e7a_m.jpg"
"39012","658","dagger","","Sotheby's, 31/7/23, Lot 96,, , Sale (Mrs. Randolph Berens),, , 14 Princes' Gdns. SW, ,","Locality unknown","",,,"","None","None","None","248","blade 36, 40; hilt 42","","128","dark brown & golden bronze.","smooth.","blade 5","","","","The shaded portion denotes remains of wood riveted & tacked to hilt.","","","Susan Magyarody","https://www.flickr.com/photos/115096994@N02/17748078808","https://farm6.staticflickr.com/5330/17748078808_83a3d16e7a_m.jpg"
"39013","433","Knife","","Peabody Museum,E 2326,Harvard University,Cambridge Mass., Bequest of Prof. H. W. Haynes, 1912","Locality unknown","",,,"","None","None","None","144","blade 18","","","Near tang. Point polished.","","blade 5","","","","","","","Joellen mcGann","https://www.flickr.com/photos/115096994@N02/17748078348","https://farm6.staticflickr.com/5339/17748078348_db8cb5c33b_m.jpg"
"39013","580","Knife","","Peabody Museum,Harvard University, Cambridge, Mass. E 2326,Bequest of Prof. H.W. Haynes, 1912.","locality unknown","",,,"","None","None","None","144","blade 18","","","near tang. point polished.","","blade 5","","","","","","","Denis Antoine","https://www.flickr.com/photos/115096994@N02/17748078348","https://farm6.staticflickr.com/5339/17748078348_db8cb5c33b_m.jpg"
"39013","658","Knife","","Peabody Museum,, , Harvard University, E2326,, , Cambridge, Mass.,, , Bequest of Prof. H.W. Haynes, 1912","Locality unknown","",,,"","None","None","None","144","blade 18","","","near tang, point polished.","","blade 5","","","","","","","Susan Magyarody","https://www.flickr.com/photos/115096994@N02/17748078348","https://farm6.staticflickr.com/5339/17748078348_db8cb5c33b_m.jpg"
"39014","433","Knife","","Brentford Public Library,Layton Collection, O 1274","Locality unknown","",,,"","None","None","None","147","18","","","No patina.","Dark brown bronze: smooth.","blade 3.25","","","","Very coppery. Edges are thinnest at curved top; this seems to have been the cutting edge. A - very slightly raised on this face only.","","","Joellen mcGann","https://www.flickr.com/photos/115096994@N02/17908374726","https://farm6.staticflickr.com/5342/17908374726_b5801e0b11_m.jpg"
"39014","580","Knife","","Brentford Public Library,Layton Collection O 1274.","locality unknown","",,,"","None","None","None","147","18","","","no patina","dark brown bronze. smooth","blade 3.25","","","","Very coppery. Edges are thinnest at curved top; this seems to have been the cutting edge. A - very slightly raised on this face only.","","","Denis Antoine","https://www.flickr.com/photos/115096994@N02/17908374726","https://farm6.staticflickr.com/5342/17908374726_b5801e0b11_m.jpg"
"39014","658","Knife","","Brentford Public Library,, , Layton Coll'n., 01274","Locality unknown","",,,"","None","None","None","147","18","","","no patina.","dark brown bronze; smooth.","blade 3.25","","","","Very coppery. Edges are thinnest at curved top; this seems to have been the cutting edge.,, , A - very slightly raised on this face only.","","","Susan Magyarody","https://www.flickr.com/photos/115096994@N02/17908374726","https://farm6.staticflickr.com/5342/17908374726_b5801e0b11_m.jpg"
"39015","433","Knife","","Pitt Rivers Museum, Farnham,Label: Bronze knife bought at Christie's Apl. 20, 1891","Locality unknown","",,,"","None","None","None","129","blade 17, 19; tang 8","","28.35","Yellow ochre","Smooth","blade 8","","","","Edge slightly indented.","","","Joellen mcGann","https://www.flickr.com/photos/115096994@N02/17932248762","https://farm6.staticflickr.com/5343/17932248762_ce40da81f9_m.jpg"
"39015","580","Knife","","Pitt Rivers Museum, Farnham.,label: Bronze Knife bought at Christie's Apl. 20, 1891.","locality unkonwn","",,,"","None","None","None","129","blade 17; 19,tang 8","","28.35","yellow ochre.","smooth","blade 8","","","","edge slightly indented","","","Denis Antoine","https://www.flickr.com/photos/115096994@N02/17932248762","https://farm6.staticflickr.com/5343/17932248762_ce40da81f9_m.jpg"
"39015","658","Knife","","Pitt Rivers Museum, Farnham,, , Label: Bronze Knife bought at Christie's, Apr. 20, 1891.","Locality unknown","",,,"","None","None","None","129","blade 17, 19; tang 8","","28.35","yellow ochre.","smooth.","blade 8","","","","edge slightly indented.","","","Susan Magyarody","https://www.flickr.com/photos/115096994@N02/17932248762","https://farm6.staticflickr.com/5343/17932248762_ce40da81f9_m.jpg"
"39016","433","Knife","","Ashmolean Museum, Oxford,1836 p. 122, No. 29,Old Collection","(Provenance unknown)","",,,"","None","None","None","226","21.5","","90.35","","","6","","","","","","","Joellen mcGann","https://www.flickr.com/photos/115096994@N02/17909523946","https://farm9.staticflickr.com/8857/17909523946_c34461d7eb_m.jpg"
"39016","580","Knife","","Ashmolean Museum, Oxford.,1836. p. 122. No. 29.,Old Collection.","(Provenance unknown)","",,,"","None","None","None","226","21.5","","90.35","","","6","","","","","","","Denis Antoine","https://www.flickr.com/photos/115096994@N02/17909523946","https://farm9.staticflickr.com/8857/17909523946_c34461d7eb_m.jpg"
"39016","658","Knife","","Ashmolean Museum, Oxford,, , 1836, p. 122, No. 29,, , Old Collection.","(Provenance unknown)","",,,"","None","None","None","226","21..5","","90.35","","","6","","","","","","","Susan Magyarody","https://www.flickr.com/photos/115096994@N02/17909523946","https://farm9.staticflickr.com/8857/17909523946_c34461d7eb_m.jpg"
"39017","433","Knife","","Private Collection,1923,Lord Howard de Walden,Belgrave Square, SW","","",,,"","None","None","None","251","blade 43.5; socket band 19","","141.75","Streaky grey green. Gold bronze shows along back.","Smooth, pitted.","17, 20.5, 7, 2.5","","","","The socket is round and broken away.","","","Joellen mcGann","https://www.flickr.com/photos/115096994@N02/17312317744","https://farm8.staticflickr.com/7661/17312317744_1d785fdfb3_m.jpg"
"39017","580","Knife","","Private Collection, 1923,Lord Howard de Walden, Belgrave Square, SW.","","",,,"","None","None","None","251","blade 43.5; socket band 19","","141.75","streaky grey green. Gold bronze shows along back.","smooth, pitted.","17; 20.5; 7; 2.5","","","","The socket is round & broken away.","","","Denis Antoine","https://www.flickr.com/photos/115096994@N02/17312317744","https://farm8.staticflickr.com/7661/17312317744_1d785fdfb3_m.jpg"
"39017","658","Knife","","Private Collection,, , 1927,, , Lord Howard de Walden,, , Belgrave Square SW","","",,,"","None","None","None","251","blade 43.5, socket band 19","","141.75","streaky grey green. Gold bronze shows along back.","smooth, pitted.","17, 20.5,7,  2.5","","","","The socket is round & broken away.","","","Susan Magyarody","https://www.flickr.com/photos/115096994@N02/17312317744","https://farm8.staticflickr.com/7661/17312317744_1d785fdfb3_m.jpg"
"39018","580","Knife","","Private Collection, 1923,Lord Howard de Walden, Belgrave Square, SW.","","",,,"","None","None","None","291","blade 34,tang 14; 6.5","","113.39","medium green matte.","smooth. one side almost covered with ligt earth.","blade 2.5,tang 14; 6.5","","","","very well preserved.","","","Denis Antoine","https://www.flickr.com/photos/115096994@N02/17748325340","https://farm6.staticflickr.com/5441/17748325340_82cd0f2fc6_m.jpg"
"39018","658","Knife","","Private Collection,, , 1923,, , Lord Howard de Walden,, , Belgrave Square SW","","",,,"","None","None","None","291","blade 34, tang 14, 6.5","","113.39","medium green matte.","Smooth, one side almost covered with light earth.","blade 2.5, tang 14, 6.5","","","","very well preserved.","","","Susan Magyarody","https://www.flickr.com/photos/115096994@N02/17748325340","https://farm6.staticflickr.com/5441/17748325340_82cd0f2fc6_m.jpg"
"39018","677","Knife.","","Private Collection, , 1928, , Lord Howard de Walden, , Belgrave Square . sw.","","",,,"","None","None","None","291","blade 34 tang 14. 6.5","","113.39","medium green matte.","smooth. one side almost covered with light earth.","blade 2.5 tang 14. 6.5","Some of the handwriting was difficult to decipher. I made my best possible judgement. Also some information appears to be missing.","very well preserved.","","","","","Michael George Adams","https://www.flickr.com/photos/115096994@N02/17748325340","https://farm6.staticflickr.com/5441/17748325340_82cd0f2fc6_m.jpg"
"39019","580","Pin","","Museum of Archaeology & Ethnology, Cambridge.","","",,,"","None","None","None","85","head 5.5","","5","dark brown patina & metal showing through.","corroded","","","","","Pin with small nail like head, finely decorated with lines of dots divided by long grooves. They all spring from a central dot on top of the head.","","","Denis Antoine","https://www.flickr.com/photos/115096994@N02/17746956748","https://farm9.staticflickr.com/8772/17746956748_02052a0a23_m.jpg"
"39019","658","Pin","","Museum of Archaeology & Ethnology, Cambridge","","",,,"","None","None","None","85","head 5.5","","5","dark brown & metal showing through.","corroded.","","","","","Pin with small nail-like head, finely decorated with lines of dots divided by long grooves.,They all spring from a central dot on top of the head.","","","Susan Magyarody","https://www.flickr.com/photos/115096994@N02/17746956748","https://farm9.staticflickr.com/8772/17746956748_02052a0a23_m.jpg"
"39019","677","Pin","","Museum of Archaeology & Ethnology. Cambridge","","",,,"","None","None","None","85","head 5.5","","5","Patina & metal showing through.","corroded dark brown","","Some information does appear to be missing.","Pin with small nail like head. finely decorated with lines of dots divided by long grooves. They all spring from a central dot on top of the head.","","","","","Michael George Adams","https://www.flickr.com/photos/115096994@N02/17746956748","https://farm9.staticflickr.com/8772/17746956748_02052a0a23_m.jpg"
"39020","433","Pin","","Museum of Archaeology + Ethnology, Cambridge","","",,,"","None","None","None","125","head 15","","20","A little black, mostly bright metal.","Smooth + shiny.","","","","","Large solid head, orange shaped with round flat disc on top + slight basal moulding.","","","Joellen mcGann","https://www.flickr.com/photos/115096994@N02/17931731222","https://farm8.staticflickr.com/7765/17931731222_0e563a17bf_m.jpg"
"39020","580","Pin","","Museum of Archaeology & Ethnology, Cambridge.","","",,,"","None","None","None","125","head 15","","20","a little black, mostly bright metal.","smooth & shiny","","","","","Large solid head. Orange shaped, with round flat disc on top & slight basal moulding.","","","Denis Antoine","https://www.flickr.com/photos/115096994@N02/17931731222","https://farm8.staticflickr.com/7765/17931731222_0e563a17bf_m.jpg"
"39020","658","Pin","","Museum of Archaeology & Ethnology, Cambridge","","",,,"","None","None","None","125","head 15","","20","Patina a little black, mostly bright metal.","smooth & shiny.","","","","","Large solid head, orange shaped, with round flat disc on top & slight basal moulding.","","","Susan Magyarody","https://www.flickr.com/photos/115096994@N02/17931731222","https://farm8.staticflickr.com/7765/17931731222_0e563a17bf_m.jpg"
"39021","433","Pin with double ring","","Museum of Archaeology + Ethnology, Cambridge,No. 354 (this number is not in the Murray Catalogue)","","",,,"","None","None","None","Pin 71.5; Ring 44","Width of ring 25 outside; 17 inside","","22","Very dark patina of grey + green.","Corroded","","","","","Pin with squared shank turned round upon itself, to form loop which holds a double ring shaped like a figure of eight. Flattened behind, rounded in front.","","","Joellen mcGann","https://www.flickr.com/photos/115096994@N02/17312432554","https://farm6.staticflickr.com/5468/17312432554_53a9472572_m.jpg"
"39021","580","Pin with double ring","","Museum of Archaeology & Ethnology, Cambridge,No. 354 (this number is not in the Murray Catalogue)","","",,,"","None","None","None","Pin 71.5; Ring 44","ring: 25 outside; 17 inside","","22","very dark patina of grey & green.","corroded","","","","","Pin with squared shank turned round upon itself, to form loop which holds a double ring shaped like a figure of eight. Flattened behind, rounded in front.","","","Denis Antoine","https://www.flickr.com/photos/115096994@N02/17312432554","https://farm6.staticflickr.com/5468/17312432554_53a9472572_m.jpg"
"39021","658","Pin with double ring.","","Museum of Archaeology & Ethnology,,Cambridge,, , No. 354 (this number is not in the Murray Catalogue), ,","","",,,"","None","None","None","Pin  71.5, Ring 44","Width of ring 25 outside, 17 inside.","","22","very dark patina of grey & green.","corroded.","","","","","Pin with squared shank turned round upon itself, to form loop which holds a double,ring shaped like a figure of eight. Flattened behind, rounded in front.","","","Susan Magyarody","https://www.flickr.com/photos/115096994@N02/17312432554","https://farm6.staticflickr.com/5468/17312432554_53a9472572_m.jpg"
"39022","433","Pin","","Private Collection,F. Ransom Esq., Hitchin","","",,,"","None","None","None","131","head 15.25 x 15","","24.8","No patina","Smooth. Dull golden bronze colour","pin nearly 4","","","","","","","Joellen mcGann","https://www.flickr.com/photos/115096994@N02/17935797445","https://farm9.staticflickr.com/8870/17935797445_1fd05f24a3_m.jpg"
"39022","580","Pin","","Private Collection,F. Ransom Esq., Hitchin.","","",,,"","None","None","None","131","head 15.25 x 15","","24.8","no patina.","smooth, dull golden bronze colour.","pin nearly 4","","","","","","","Denis Antoine","https://www.flickr.com/photos/115096994@N02/17935797445","https://farm9.staticflickr.com/8870/17935797445_1fd05f24a3_m.jpg"
"39022","658","Piin","","Private Collection,, , F. Ransom, Esq., Hitchin","","",,,"","None","None","None","131","head 15.25 x 15","","24.8","no patina.","smooth, dull golden bronze colour.","pin nearly 4","","","","","","","Susan Magyarody","https://www.flickr.com/photos/115096994@N02/17935797445","https://farm9.staticflickr.com/8870/17935797445_1fd05f24a3_m.jpg"
"39023","433","Pin","","Private Collection,F. Ransom Esq., Hitchin","","",,,"","None","None","None","136.5","head 15.5 x 16","","15.91","No patina","Smooth, a dark bronze colour.","4","","","","There are 4 holes in head, ringed with 3 lines + 4 at the top (without a hole).","","","Joellen mcGann","https://www.flickr.com/photos/115096994@N02/17935842981","https://farm8.staticflickr.com/7724/17935842981_f262e7e483_m.jpg"
