"taskID","userID","objectType","rightCorner","collection","site","toSearch","Lon","Lat","gridRef","dateDiscoveryDay","dateDiscoveryMonth","dateDiscoveryYear","length","width","edge","weight","patina","surface","thickness","other","composition","associations","description","publications","remarks","inputBy","imageURL","flickrURL"
"46724","580","Sword","IVa","Banff Museum","Scotland,Banffshire,[...] near Banff","Banff, Aberdeenshire, Royaume-Uni","-2.5240380000000187","57.666505","","None","None","None","","","","715.825","","","","Weight: 25 1/4 oz.","","","","","","Denis Antoine","https://www.flickr.com/photos/115096994@N02/21624317819","https://farm6.staticflickr.com/5645/21624317819_5aaa08b5ab_m.jpg"
"46724","817","Sword","IVa","Banff Museum","Scotland,Banffshire,probably near Banff","Banff AB45, UK","-2.554790799999978","57.64081959999999","","None","None","None","","","","715.83","","","","Weight shows ""25¼ ozs.""","","","","","","JP OConnor","https://www.flickr.com/photos/115096994@N02/21624317819","https://farm6.staticflickr.com/5645/21624317819_5aaa08b5ab_m.jpg"
"46725","433","Sword","IVa","Banff Museum","Scotland,Banffshire,Probably near Banff","Banff, Aberdeenshire, UK","-2.5240380000000187","57.666505","","None","None","None","","","","687.48","","","","Weight: 24 1/4 oz = 687.48 gms","","","","","","Joellen mcGann","https://www.flickr.com/photos/115096994@N02/21624318619","https://farm6.staticflickr.com/5655/21624318619_213c7f804f_m.jpg"
"46725","580","Sword","IVa","Banff Museum","Scotland,Banffshire,Probably near Banff","Banff, Aberdeenshire, Royaume-Uni","-2.5240380000000187","57.666505","","None","None","None","","","","687.475","","","","Weight: 24 1/4 ozs.","","","","","","Denis Antoine","https://www.flickr.com/photos/115096994@N02/21624318619","https://farm6.staticflickr.com/5655/21624318619_213c7f804f_m.jpg"
"46725","817","Sword","IVa","Banff Museum","Scotland,Banffshire,Probably near Banff","Banff AB45, UK","-2.554790799999978","57.64081959999999","","None","None","None","","","","687.48","","","","Weight shows ""24¼ ozs.""","","","","","","JP OConnor","https://www.flickr.com/photos/115096994@N02/21624318619","https://farm6.staticflickr.com/5655/21624318619_213c7f804f_m.jpg"
"46726","433","Sword","IVa","Banff Museum","Scotland,Banffshire,Banff,Blairshinnock Farm","Banff, Aberdeenshire, UK","-2.5240380000000187","57.666505","","None","None","None","","","","503.2","","","","Weight: 17 3/4 = 503.2 gms","","","","","","Joellen mcGann","https://www.flickr.com/photos/115096994@N02/21799406602","https://farm6.staticflickr.com/5735/21799406602_8f4fc17b80_m.jpg"
"46726","580","Sword","IVa","Banff Museum","Scotland,Banffshire,Banff,Blairshinnoch Farm","Banff, Aberdeenshire, Royaume-Uni","-2.5240380000000187","57.666505","","None","None","None","","","","503.204","","","","Weight: 17 3/4 ozs.","","","","","","Denis Antoine","https://www.flickr.com/photos/115096994@N02/21799406602","https://farm6.staticflickr.com/5735/21799406602_8f4fc17b80_m.jpg"
"46726","817","Sword","IVa","Banff Museum","Scotland,Banff shire,Banff.,[...]Farm","Banff AB45, UK","-2.554790799999978","57.64081959999999","","None","None","None","","","","503.2","","","","Weight shows ""17¾ ozs.""","","","","","","JP OConnor","https://www.flickr.com/photos/115096994@N02/21799406602","https://farm6.staticflickr.com/5735/21799406602_8f4fc17b80_m.jpg"
"46727","433","Sword","","Vale, Mr. E - private,26 Thorley Park Road, Bishop's Startford, Herts.,Landowner: Mr. Tinney, Matching Halls Farm,Site Rel. NBI/Or. 1","Essex,Matching,Matching Hall Farm,Found July 1987 in ploughing; the field previous pasture, had been ploughed for the first time in 'years'; sword found caught up in cultivation, but finder was satisfied that it was turned up in a particular part of field which showed a blackened rectangular surface discoloration - c. 25 x 25 yds.","Matching, Harlow, Essex CM17, UK","0.2080230000000256","51.788452","c. TL 5315 1190","None","None","1978","613","W. ht. 24.2, Wsh. 58.5","","","","Mostly pale yellow - green dry surface; odd few pits to light green - probably damage rather than pocking, etc.; small areas dark brown smoother out - poss. relif patina.","Max T bl. 8.8","","","","Dimensions: EL (straightened) 613; W ht. 24.2; Wsh. 58.5; Max B fg. 9.0; max T bl. 8.8; W ws. 31.7; max W. bl. 50.2,Typology: v. slight bowed fg. cross-section; 'slot' depressions around rivet holes; ricasso more-or-less flattened; hint of e. bev. below ricasso rapidly disappears; rounded loz. bl. section tending to lenticular towards tip; rivet holes markedly hour-glass,Manufacture: remains of thin cg. fl. within hilt slot; some likely porosity apparent on surface.,Condition: hilt terminal broken off in antiquity; remainder broken in two - fracture gold, [..[ recent, prob. due to find circumstances; whole length very twisted & contorted - prob. ancient, as are most of edge dents and 'tear' low on bl. c.; small gouging just below shoulders gold - recent; also odd gold flecks along edges & small even in one ricasso; very tip blunted - anc. (+ modern).,Attached Material: scattered orange staining - apparently on surface - possibly adhering dust.","","PIF (O); DF (S); SI; CI; SN 9 Oct. 78; Sb. A.; Mr. Vale, 8 Aug. 78","Joellen mcGann","https://www.flickr.com/photos/115096994@N02/21799408132","https://farm6.staticflickr.com/5770/21799408132_c76c176f5d_m.jpg"
"46727","580","Sword","","Private Collection: Vale, Mr. E., 26 Thorley Park Road, Bishhop's Stortford, Herts.,Landowner: Mr. Tinney, Matching Hall Farm","Essex,Matching,Matching Hall Farm,Found July 1978 in ploughing; the field, previously pasture, had been ploughed for the first time in 'years'; sword found caught up in cultivator, but finder was satisfied that it was turned up in particular part of field which showed a blackened rectangular surface discoloration. c. 25 x 35 yards.,Site Rel. NBI / or. I","Matching, Harlow, Essex CM17, Royaume-Uni","0.2080230000000256","51.788452","c. TL 5315,1190","None","7","1978","straightened 613","","","","","Mostly pale yellow-green dry surface; odd few pits to light green - prob. damage rather than pocking etc.; small areas dark brown smoother sur. - poss. relief patina,Attached material: scattered orange staining, apparently on surface - poss. adhering dust.","","","","Single","Dimensions: W kt. 24.2; Wsh. 58.5; max. B. fg. 9.0; max. T. bl. 8.8; W. ws. 31.7; max. W. bl. 50.2,Typology: v. sl. bowed fg. cross-section; 'slot' depressionsaround rivet holes; ricasso more-or-less flattened; hint of e.ber. below ricasso rapidly disappears; rounded [...] bl. section tending to lenticular towards tip; rivet-holes markedly hour-glass; remains of thin cg. fl. within hilt slot; some likely porosity apparent on surfaces.,Condition: hilt terminal broken off in antiquity; remainder broken in two; fracture qdd, [...] recent, prob. due to find circumstances; whole length v. twisted & contorted - prob. ancient, as are most of edge dents and 'tear' low on bl. e.; small gouging just below shoulders gold - recent; also odd gold flecks along edges & small beven in one ricasso; v. tip blunked - anc. (& modern)","","Rec. SR 9 Oct. 78,Sub. Inf. Mr. Vale 8 Aug. 78,PIF (o),DF S,SI,CI,Source Sb. A","Denis Antoine","https://www.flickr.com/photos/115096994@N02/21799408132","https://farm6.staticflickr.com/5770/21799408132_c76c176f5d_m.jpg"
"46727","817","SWORD","","VALE, Mr. E -- private,26 Thorley Park Road, Bishop's Stratford, Herts.","ESSEX,MATCHING,MATCHING HALL FARM","Matching, Harlow, Essex CM17, UK","0.2080230000000256","51.788452","c. TL 5315,1190","None","7","1978","613","50.2","","","","Mostly pale yellow-green dry surface; odd few pits to light green—prob. damage rather than pocking etc.; small areas dark brown smoother sur.—[…] relief patina","","Dimensions shows ""EL (straightened) 613; W ht. 24.2; Wsh. 58.5max. B. Fg. 9.0; max T. 66. 8.8; W.ws. 31.7; max. W.bl. 50.2"".","","","","","Circumstances: found in July 1978 in ploughing; the field, previously pasture, had been ploughed for the first time in ‘years’; sword found caught up in cultivator, but finder was satisfied that it was turned up in particular part of field which showed a blackened rectangular surface discoloration—c. 25 x 35 yds.,, , Typology: v.sl. bowed fg. cross section; ‘slot’ depressions around rivet holes; ricasso more-or-less flattened; hint of e. bev. below ricasso rapidly disappears; rounded loz. bl. section tending to renticular towards tip; rivet holes markedly bar-glass; remains of thin cg. Fl. within hilt slot; some likely porosity apparent on surfaces.,, , Condition: hilt terminal broken off in antiquity; remainder broken in two—fracture […], therefore, recent. Prob. Due to find circumstances; whole length v. twisted & contorted—prob. Ancient, as are most of the edge dent and ‘tear’ low on bl. c.; small gouging just below shoulders gold—recent; also odd gold flecks along edges & small beven in one ricasso; v. tip blunted—ancient (& modern),, , Attached Material: scattered orange staining—apparently on surface—poss. adhering dust.,Landowner: Mr. Tinney, Matching Hall Farm","JP OConnor","https://www.flickr.com/photos/115096994@N02/21799408132","https://farm6.staticflickr.com/5770/21799408132_c76c176f5d_m.jpg"
"46728","433","Sword (4 Fragments0","IIIb","Balfour Stet (Dec. 1924)","England,Essex,Ugley (near Bishop's Stortford),July 1955,About 1/2 S. of Ugley Hall,Found in filling a pothole","Ugley, Bishop's Stortford, Essex CM22, UK","0.21028599999999642","51.934157","","None","7","1955","530","39","","460","Grey-green, giving a ""tinny"" look.","","6","","","2 razors","Broken into 4 fragments: points missing, edges. Blunt and chipped, lower part of blade scratched. Smooth generally; a patch has flaked off in [..erately] below the hilt on one sides, bases of encrustment locally.","","Tinkers Hoard","Joellen mcGann","https://www.flickr.com/photos/115096994@N02/21190122233","https://farm1.staticflickr.com/579/21190122233_283ec4e4fe_m.jpg"
"46728","580","Sword (4 fragments)","","Balfour [...] [...]","England,Essex,Ugley (near Bishop's Stortford),About 1/2 m. S. of Ugley Hall,found in digging a post-hole.","Ugley Hall, Ugley, Bishop's Stortford, Essex CM22 6JB, Royaume-Uni","0.21083840000005694","51.9371451","","None","7","1935","530","38","","460","grey-green, giving a ""tinny"" look.","Smooth generally; a patch has flaked off immediately below the hilt on one side; traces of encrustment locally.","6","","","2 razors.","Broken into 4 fragments; point missing; edges blunt and chipped. Lowest part of blade scratched. 1 Rivet still in position. Hilt fragment slightly bent.","","Tinkers Hoard","Denis Antoine","https://www.flickr.com/photos/115096994@N02/21190122233","https://farm1.staticflickr.com/579/21190122233_283ec4e4fe_m.jpg"
"46728","677","Sword (4 fragments)","III b","Balfan Jley , , (Dn 1916), , Subway, , bia foghaj jCapapay Piwnay Kaeri dglap C (Cb legent 1925)","England, Essex, Ugly (hr Butai Stritford), July 1934., Ohar 1/2 = 5. of by my Hall., found in hiffy a boo hnhiu","Essex, UK",,,"Essex, UK","None","7","1934","820","39","","810","Sndey, gotten, joining a ""tiring ""look""","Smooth generally a faith tes flattened off in redistably better the kelt in me in one sides traces of ireneretour equirty","6","The handwriting was very difficult to decipher. Is out of focus/ blurry. I made my best possible judgement. Also some information appears to be missing.","Broken ink & fepub: fraint missing, edges that and chipped. Contat part if blade unremebant.","In Rogers.","","","Tinbus Honard","Michael George Adams","https://www.flickr.com/photos/115096994@N02/21190122233","https://farm1.staticflickr.com/579/21190122233_283ec4e4fe_m.jpg"
"46729","433","Leaf Sword","B","Southend-on-Sea Museum, 1929","England,Essex,Southend-on-sea,Southchurch,Thorpe Hall Brickfield (about 1000 yds. E. of Thorpe Bay, L.M.S. Rly. Station),3 ft. 6 in. deep in brick earth containing fragments of bone & charcoal.,23rd February 1929","Southchurch, Southend-on-Sea, Southend-on-Sea, Southend-on-Sea SS1, UK","0.7440239999999676","51.538996","","23","2","1929","without point Length 403, point 54; 457","Hilt 40; blade 41.5","","365; weight without point 343.74, point 21.26","","","hilt 6; blade 5","","","Found with 1 palstave & 1 fragment of sword blade","Hilt transitional between dirk & sword. 4 rivet holes, 1 rivet.","","The brickfield is worked to depth of 7 ft: beneath the earth is ballast & sand. Excavations around the site of discovery produced no additional objects.","Joellen mcGann","https://www.flickr.com/photos/115096994@N02/21624334099","https://farm1.staticflickr.com/620/21624334099_9ee629e539_m.jpg"
"46729","580","Leaf-Sword,or Ballintober","c 1/2,B","Ssouthend-on-Sea Museum, 1929.","England,Essex,Southend-on-Sea,Southchurch,Thorpe Hall Brickfield (about 1000 yards E. of Thorpe Bay L.M.S. Rly. Station) 3 ft. 6 in. deep in brick earth containing fragments of bone & charcoal,23rd February, 1929.","Southchurch, Southend-on-Sea, Southend-on-Sea, Southend-on-Sea SS1, Royaume-Uni","0.7440239999999676","51.538996","","23","2","1929","457,without point 403; point 54","hilt 40; blade 41.5","","365,weight without point 343.74; point 21.26","","","hilt 6; blade 5","","","Found with 1 palstave & 1 fragment of sword blade.","Hilt transitional between dirrk & sword. 4 rivet holes, 1 rivet.","","The brickfield is worked to a depth of 7 ft.; beneath the brick earth is ballast & sand. Excavation around the site of discovery produced no additional objects.","Denis Antoine","https://www.flickr.com/photos/115096994@N02/21624334099","https://farm1.staticflickr.com/620/21624334099_9ee629e539_m.jpg"
"46729","817","Leaf-Sword","C½,B","Southend-on-Sea Museum, 1929.","England,Essex,Southend-on-Sea,Southchurch,Thorpe Hall Brickfield (about 1000 yds. E. of Thorpe Bay LMS Rly. Station),3ft. 6in. deep in brick earth containing fragments of bone & charcoal","Southend-on-Sea, Southend-on-Sea, UK","0.7077123000000256","51.5459269","","23","2","1929","457","41.5","","365","","","5","Length shows ""without point, Length 403mm : point 54mm."" Width shows ""hilt 40mm, blade 41.5mm"". Thickness shows ""hilt 6mm, blade 5mm"". Weight shows ""weight without point 343.74  Point 21.26"".","","Found with 1 palstave & 1 fragment of sword blade.","Hilt transitional between dirk & sword.,4 rivet holes, 1 rivet.","","The brickfield is worked to a depth of 7 ft : beneath the brick earth is ballast & sand.,Excavating around the site of discovery produced no additional objects.","JP OConnor","https://www.flickr.com/photos/115096994@N02/21624334099","https://farm1.staticflickr.com/620/21624334099_9ee629e539_m.jpg"
"46730","433","Sword, Ballintober","B","Southend Museum, Prittlewell Priory, 375/2","Essex,Southchurch,Thorpe Hall Brickfield,1929,Found while digging brickearth. Other Bronze Age remains, including implement, from same field.","Southchurch, Southend-on-Sea, Southend-on-Sea, Southend-on-Sea SS1, UK","0.7440239999999676","51.538996","","None","None","1829","398.78","40.64","","","","Heavily corroded with bronze disease.","","Length: 15.7"" = 398.78mm,Width: 1.6"" = 40.64mm, Blade 2"" = 50.8mm, Rivets .5"" long = 12.7mm, breadth at end 1.2"" = 30.48","Bronze","No definite association, but possibly associated with 375/5, a looped flanged palstave.","Blade 2"", rivets .5"" long. Leaf shaped sword with midrib. Two rivets survive on both sides of the hilt, one broken off on one side of the hilt, one totally absent. Rivets are cylindrical, bronze. Circa 6.4"" not drawn of sword, broken off above the point. Breadth at end 1.2"".","Transactions of the Essex Archaeological Society, Vol. 19 (N.5), pp. 311-13, Illus.","Prepared by: D.G. Macleod, Assistant-in[Chrge, Prittlewell Priory Museum, June 1958","Joellen mcGann","https://www.flickr.com/photos/115096994@N02/21188487364","https://farm6.staticflickr.com/5789/21188487364_75085e7e62_m.jpg"
"46730","580","Sword,Ballintober","B","Southend Museum, Prittlewell Prriory: 375/2.","Essex,Southchurch,Thorpe Hall Brickfield, 1929.,Found while ddigging brickearth. Other Bronze Age remains, including implement, from same field.","Southchurch, Southend-on-Sea, Southend-on-Sea, Southend-on-Sea SS1, Royaume-Uni","0.7440239999999676","51.538996","","None","None","1929","398.78","40.64","","","","Heavily corroded with bronze disease.","","Length: 15.7""; Width: 1.6""","Bronze","No definite association, but possibly associated with 375/5, a looped flanged palstave.","Blade: 2""; rivets: 5"" long.,Leaf-shaped sword with midrib. Two rivets survive on both sides of the hilt, one broken off on one side of the hilt, on totally about. Rivets are cylindrical, bronze. Circa 6.4"" not drawn of sword, broken off above the point. Beneath at end 1.2"".","Transactions of the Essex Archaeological Society, Vol. 19 (N.S.) pp. 311-13. Illus.","Prepared by: D.G. Macleod, Assistant-in-Charge, Prittlewell Priory Museum. June 1958","Denis Antoine","https://www.flickr.com/photos/115096994@N02/21188487364","https://farm6.staticflickr.com/5789/21188487364_75085e7e62_m.jpg"
"46730","817","SWORD.,[...]","B","Southend Museum, Prittlewell Priory: 375/2.","Essex,Southchurch,Thorpe Hall Brickfield,Found while digging brickearth. Other Bronze Age remains, including implement, from same field.","Southchurch, Southend-on-Sea, Southend-on-Sea, Southend-on-Sea SS1, UK","0.7440239999999676","51.538996","","None","None","1929","398.78","40.64","","","","Heavily corroded with bronze disease.","50.8","Length shows '15.7"". Width shows '1.6""'. Thickness shows ""Blade: 2""; rivets .5"" long.""","Bronze.","No definitive association, but possibly associated with 375/5, a looped Flanged palstave.","Leaf-shaped sword with mid rib. Two rivets survive on both sides of the hilt, one broken off on one side of the hilt, one totally absent. Rivets are cylindrical, bronze. Circa 6.4"" not drawn of sword, broken off above the point. Breadth at end 1.2"".","Transactions of the Essex Archaeological Society, Vol. 19 (N.S.) pp. 311-13. Illus.","Prepared by : D.G. Macleod, Assistant-in-Charge, Prittlewell Priory Museum. June 1958","JP OConnor","https://www.flickr.com/photos/115096994@N02/21188487364","https://farm6.staticflickr.com/5789/21188487364_75085e7e62_m.jpg"
"46731","433","Fragment of Sword","IVa","British Museum,92.6-13.1,Presented by A. W. Franks, Esq.,13/6/1892","England,Essex,Shoebury,Hoard I","Shoeburyness Police, 71 High St, Great Wakering, Southend-on-Sea, Essex SS3 9AR, UK","0.8055894000000308","51.55295470000001","","None","None","None","110","34","","156","Green patina","Very corroded.","10","","","1-27: 2 Fragments swords; 1 Palstave; 3 Winged Celts; 15 Socketed Celts; 1 Bracelet; 6 Cakes Copper; 3 Fragments Pottery","Upper part, two rivet holes.","Described by C.H. Read in Proc. Soc. Ant., 1892, XIV","Inacc.,New Card Done","Joellen mcGann","https://www.flickr.com/photos/115096994@N02/21188489724","https://farm6.staticflickr.com/5629/21188489724_132ec816ea_m.jpg"
"46731","580","Fragment of Sword","IVa","British Museum,92.6-13.1,Presented by A.W. Franks Esq.,13/6/1892","England,Essex,Shoebury,Hoard I","Shoeburyness, Southend-on-Sea, Southend-on-Sea, Southend-on-Sea SS3, Royaume-Uni","0.7978530000000319","51.531522","","None","None","None","110","34","","156","green","vey corroded","10","","","1-27: 2 Fragments Swords, 1 Palstave, 3 Winged Celts, 15 Socketed Celts, 1 Bracelet, 6 Cakes Copper, 3 Fragments Pottery.","Upper part two rivet holes","Described by C.H. Read in Proc. Soc. Ant., 1892, XIV","Inacc.,new card done","Denis Antoine","https://www.flickr.com/photos/115096994@N02/21188489724","https://farm6.staticflickr.com/5629/21188489724_132ec816ea_m.jpg"
"46731","817","Fragment of Sword","IVa","British Museum,92.6.13.1,Presented by A.W. Franks Esqr.,13/6/1892","England,Essex,Shoebury,Hoard I","Shoeburyness, Southend-on-Sea, Southend-on-Sea, Southend-on-Sea SS3, UK","0.7978530000000319","51.531522","","None","None","None","11","3.4","","156","green","very corroded","1","Index card does not specify units of measure for length, width, or thicknkess; may be inches.","","1-27,2 Fragments sword,1 Palstave,3Winged Celts,15 Socketed Celts,1 Bracelet,6 Cakes Copper,3 Fragments Pottery.","Upper part two rivet holes","Described by C.H. Read in Proc. Soc. Ant. 1892 XIV","Inacc,new card done","JP OConnor","https://www.flickr.com/photos/115096994@N02/21188489724","https://farm6.staticflickr.com/5629/21188489724_132ec816ea_m.jpg"
"46732","433","Sword Hilt","Frag","The Priory, Prittlewell (Southend on Sea),276/104","England,Essex,Leigh,Fleming Avenue,Prittle Brook,29.1.26,(found by workmen)","Flemming Ave, Southend-on-Sea, Leigh-on-Sea, Southend-on-Sea SS9 3AU, UK","0.6491817999999512","51.551524","","29","1","1926","32","37.5","","21.26","Green","Smooth","6","","","A founder's hoard.","Cast marks at end of hilt.","","","Joellen mcGann","https://www.flickr.com/photos/115096994@N02/21811236255","https://farm1.staticflickr.com/777/21811236255_d13ffd1249_m.jpg"
"46732","580","Sword Hilt","Frag.","The Priory, Prittlewell (Southend on Sea),276/104","England,Essex,Leigh,Fleming Avenue,Prittle Brook,29. 1. 26.,(found by workmen)","Prittle Brook, Southend-on-Sea, Southend-on-Sea, Royaume-Uni","0.68456070000002","51.5524539","","None","None","None","32","37.5","","21.26","green","smooth","6","","","A founder's hoard.","Cast marks at end of hilt.","","","Denis Antoine","https://www.flickr.com/photos/115096994@N02/21811236255","https://farm1.staticflickr.com/777/21811236255_d13ffd1249_m.jpg"
"46732","817","Sword Hilt","Frag","The Priory. Prittlewell (Southend on Sea),276/104","England,Essex,Leigh,Fleming Avenue,Prittle Brook,(found by workmen)","Prittle Brook, Southend-on-Sea, Southend-on-Sea, UK","0.68456070000002","51.5524539","","26","1","1929","32","37.5","","21.26","green","smooth","6","","","A founder's hoard.","Cast mark at end of hilt.","","","JP OConnor","https://www.flickr.com/photos/115096994@N02/21811236255","https://farm1.staticflickr.com/777/21811236255_d13ffd1249_m.jpg"
"46733","433","Sword","V","The Priory, Prittlewell (Southend on Sea),276/65","England,Essex,Leigh,Fleming Avenue,Prittle Brook,29.1.26,(Found by workmen)","Flemming Ave, Southend-on-Sea, Leigh-on-Sea, Southend-on-Sea SS9 3AU, UK","0.6491817999999512","51.551524","","29","1","1926","39.5","35","","35.43","Green patina","Smooth, very slightly encrusted (flat)","8","","","A bronze founders hoard.","","","","Joellen mcGann","https://www.flickr.com/photos/115096994@N02/21811238435","https://farm1.staticflickr.com/728/21811238435_abc218d393_m.jpg"
"46733","580","Sword,[...] toughs","V","The Priory, Prittlewell (Southend on Sea),276/65","England,Essex,Leigh,Fleming Avenue,Prittle Brook,29. 1. 26.,(found by workmen)","Prittle Brook, Southend-on-Sea, Southend-on-Sea, Royaume-Uni","0.68456070000002","51.5524539","","29","1","1926","39.5","35","","35.43","green","smooth, very slightly encrusted (flat).","8","","","A bronze founder's hoard.","","","","Denis Antoine","https://www.flickr.com/photos/115096994@N02/21811238435","https://farm1.staticflickr.com/728/21811238435_abc218d393_m.jpg"
"46733","817","Sword.,[...] [...]","V","The Priory. Prittlewell (Southend on Sea),276/65","England,Essex,Leigh,Fleming Avenue,Prittle Brook,(found by workmen)","Prittle Brook, Southend-on-Sea, Southend-on-Sea, UK","0.68456070000002","51.5524539","","26","1","1929","39.5","35","","35.43","green","smooth, very slightly encrusted (flat).","8","","","A bronze founder's hoard.","","","","JP OConnor","https://www.flickr.com/photos/115096994@N02/21811238435","https://farm1.staticflickr.com/728/21811238435_abc218d393_m.jpg"
"46734","433","Leaf Shaped Sword","V","The Priory Prittlewell (Southend on Sea),276/64","England,Essex,Leigh,Fleming Avenue,Prittle Brook,29.1.26,(Found by workmen)","Flemming Ave, Southend-on-Sea, Leigh-on-Sea, Southend-on-Sea SS9 3AU, UK","0.6491817999999512","51.551524","","29","1","1926","84","blade 35; hilt plate 52","","131.1","","This side is clean golden bronze, slightly encrusted. Other side is encrusted nearly all over & golden bronze.","blade 9, 11","","","A bronze founder's hoard.","Marked with heavily indented lines down middle of blade & hilt","","","Joellen mcGann","https://www.flickr.com/photos/115096994@N02/21623348748","https://farm1.staticflickr.com/712/21623348748_98d1a3d272_m.jpg"
"46734","580","Leaf shaped Sword,[...] [...]","V","The Priory, Prittlewell (Southend on Sea),276/64.","England,Essex,Leigh,Fleming Avenue,Prittle Brook,29. 1. 26.,(found by workmen)","Prittle Brook, Southend-on-Sea, Southend-on-Sea, Royaume-Uni","0.68456070000002","51.5524539","","26","1","1929","84","blade 35; hilt plate 52","","131.1","","this side is clean golden bronze, slightly encrusted. Other side is encrusted nearly all over & golden bronze.","blade 9; 11","","","A bronze founder's hoard.","Marked with heavily indented lines down middle of blade & hilt.","","","Denis Antoine","https://www.flickr.com/photos/115096994@N02/21623348748","https://farm1.staticflickr.com/712/21623348748_98d1a3d272_m.jpg"
"46734","817","Leaf shaped sword.,[...] [...]","V","The Priory. Prittlewell (Southend on Sea),276/64.","England,Essex,Leigh,Fleming Avenue,Prittle Brook,(found by workmen)","Prittle Brook, Southend-on-Sea, Southend-on-Sea, UK","0.68456070000002","51.5524539","","None","None","None","84","35","","131.1","","this side is clean golden bronze, slightly encrusted. Other side is encrusted nearly all over & golden bronze.","9","Width shows ""blade 35  hilt plate 52"". Thickness shows ""blade 9.  11.""","","A bronze founder's hoard.","Marked with heavily indented lines down middle of blade & hilt","","","JP OConnor","https://www.flickr.com/photos/115096994@N02/21623348748","https://farm1.staticflickr.com/712/21623348748_98d1a3d272_m.jpg"
