"taskID","userID","objectType","rightCorner","collection","site","toSearch","Lon","Lat","gridRef","dateDiscoveryDay","dateDiscoveryMonth","dateDiscoveryYear","length","width","edge","weight","patina","surface","thickness","other","composition","associations","description","publications","remarks","inputBy","imageURL","flickrURL"
"46761","433","Sword","","Fleming, Mrs. Ian - private (1976) no. 1,Sevenhampton Place, Sevenhamption, Wilts.","Cornwall,""West Cornwall""","Cornwall, UK","-5.052712499999984","50.26604709999999","","None","None","None","549","","","","","","","","","","","","Context: 9. Undocumented,PIF; DF(C); SI; CI; Rec. SN Jan 82; Source: Sb. A, 1976","Joellen mcGann","https://www.flickr.com/photos/115096994@N02/21820797791","https://farm6.staticflickr.com/5767/21820797791_46b12bd3e6_m.jpg"
"46761","580","Sword","","Flerning, Mrs. Ian - private (1976) no. 1 Sevenhampton Place, Sevenhampton, Wilts.","Cornwall,'West Cornwall'","Cornouailles, Royaume-Uni","-4.652498199999968","50.5036299","","None","None","None","549","","","","","","","","","","","","Contect: 9. Undocumented.,Rec. SR. Jan. 82,PIF,DF C,SI,CI,Sb. A. 1976","Denis Antoine","https://www.flickr.com/photos/115096994@N02/21820797791","https://farm6.staticflickr.com/5767/21820797791_46b12bd3e6_m.jpg"
"46761","817","SWORD","","Fleming, Mrs Ian -- private (1976) no. 1,Sevenhampton Place, Sevenhampton, Wilts","CORNWALL,'WEST CORNWALL'","Cornwall, UK","-5.052712499999984","50.26604709999999","","None","None","None","549","","","","","","","","","9. UNDOCUMENTED","","","","JP OConnor","https://www.flickr.com/photos/115096994@N02/21820797791","https://farm6.staticflickr.com/5767/21820797791_46b12bd3e6_m.jpg"
"46762","433","Sword (Hilt Frag.)","Cast Bronze Hilt","The Museum of the Societe Jersiaise,St. Heliers, Jersey","Channel Islands,Jersey,St. Martin,Rozel,La Petite Cesaree (Le Catel)","Le Câtel, Jersey","-2.054599199999984","49.237089","","None","None","None","207","hilt 33; blade 37","","280","","Corroded","blade 11","","","Gaulish & Roman coins, some pottery & stone implements. The site is within a coast earthenworks of unknown date.","","J.J. Hawks, Jersey, 439, 193, pl. IX, 1, 109","ib.ii ""Probably in 1 BC + of [L....] Time","Joellen mcGann","https://www.flickr.com/photos/115096994@N02/21820798741","https://farm6.staticflickr.com/5700/21820798741_892a99ab30_m.jpg"
"46762","580","Sword - hilt fragment","Cast Bronze,Hilt","The Museum of the Société Jersiaise, St. Heliers, Jersey.","Channel Islands,Jersey,St. Martin,Rozel,La Petite Cesarée (Le Câtel)","Rozel, Jersey","-2.047140899999931","49.23636810000001","","None","None","None","207","hilt 33; blade 37","","280","","corroded","blade 11","ibid. ""prob. [...]B.C."" & of  [...] time","","Gaulish & Roman coins, some pottery & stone implements. The site is within a coast earthwork of unknown date.","","J.J. Hawkes, Jersey, 939, 193, [...] IX, I, 109","","Denis Antoine","https://www.flickr.com/photos/115096994@N02/21820798741","https://farm6.staticflickr.com/5700/21820798741_892a99ab30_m.jpg"
"46762","817","Sword,hilt frag.","Cust Bronze Hilt","The Museum of the Société Jersiaise,St. Heliers, Jersey.","Channel Islands,Jersey,St. Martin,Rozel,La Petite Cesarée,La Câtel)","St Martin, Jersey","-2.040081999999984","49.2205678","","None","None","None","207","37","","280","","corroded.","11","Width shows ""hilt 33  blade 37"". Thickness shows ""blade 11"".","","Gaulish & Roman coins, some pottery & stave implements.,The site is within a coast earthwork of unknown date.","","JJ Hawkes, Jersey, 1939. 193, pl. IX, 1; 109","ibid. ""prob. [...] B.C, "" & of [...] [...]","JP OConnor","https://www.flickr.com/photos/115096994@N02/21820798741","https://farm6.staticflickr.com/5700/21820798741_892a99ab30_m.jpg"
"46763","433","Leaf Shaped Sword/[Camp's Toungue?]/1 Hilt frag. + 1 Blade Frag","V","Guille Alles Museum, Guernsey,Gaudion Collection","Channel Islands,Alderney,Longy Common,1832","Longis Common, Guernsey","-2.1700596000000587","49.7206604","","None","None","1832","57, 112","32, 49, 40","","194","","(I) Green & grey green coloured - prominent parts are brighter green. A little mud adheres.,(II) This piece is very bent. Colour, green brown & green. One side deeply pitted and shows rust coloured spots. A little mud adheres on the other side.","12, 9","","","Hoard of about 200 pieces.","(II) The drawing shows the piece flattened out. Broken edge is very rough (hilt piece)","T.D. Kendrick, The Arch of the Channel Islands, Vol. I, p. 64, pl. VIII (1928 ed.)","","Joellen mcGann","https://www.flickr.com/photos/115096994@N02/21623412138","https://farm1.staticflickr.com/748/21623412138_baa2b3b47a_m.jpg"
"46763","580","Leaf shaped Sword - 1 hilt fragment  1 blade fragment","V","Guille Allès Museum, Guernsey,Gaudron Collection","Channel Islands,Alderney,Longy Common 1832","Alderney","-2.197355700000003","49.715004","","None","None","1832","57; 112","32; 49; 40","","194","","(i) Green & grey green coloured; prominent parts are brighter green. A little mud adheres.,(ii) Colour, green brown & green. One side deeply pitted & shows rust coloured spots. A little mud adheres on the othe side.","12; 9","","","Hoard of about 200 pieces.","(i) The drawing shown the piece flattened out.,Broken edge is very rough (hilt piece).,(ii) This piece is very bent.","T.D. Kendrick, The Arch. of the Channel Islands Vol. I, p. 64, pl. VIII (1928 ed.).","","Denis Antoine","https://www.flickr.com/photos/115096994@N02/21623412138","https://farm1.staticflickr.com/748/21623412138_baa2b3b47a_m.jpg"
"46763","817","Leaf shaped sword.","V","Guille Allés Museum. Guernsey,Gaudion Collection.","Channel Islands,Alderney,Longy Common","Alderney","-2.197355700000003","49.715004","","None","None","1832","112","49","","194","","(I) Green & grey green coloured. — prominent parts are brighter green. A little mud adheres.,(II) This piece is very bent. Colour, green brown & green. One side deeply pitted & shows rust coloured spots. A little mud adheres on the other side.","12","Length shows ""57mm  112."" Width shows ""32.  49.  40."" Thickness shows ""12.  9.""","","Hoard of about 200 pieces.","(II) The drawing shows the piece flattened out,Broken edge is very rough (hilt piece).","T.D. Kendrick. The Arch. of the Channel Islands. Vol.I p.64. Pl VIII (1928 ed.)","1 hilt frag. & 1 blade frag.","JP OConnor","https://www.flickr.com/photos/115096994@N02/21623412138","https://farm1.staticflickr.com/748/21623412138_baa2b3b47a_m.jpg"
"46764","433","Leaf Shaped Sword/[Camps Tongues?]/1 shoulder frag. + 1 blade frag.","V","T.D. Kendrick: The Arch of the Channel Islands, Vol. I. p. 62, pl. VII, (1928 ed)","Channel Islands,Alderney,Longy Common 1832","Longis Common, Guernsey","-2.1700596000000587","49.7206604","","None","None","1832","56, 89","blade 33; hilt 30, 51, 26","","202","","Hilt piece: Green, slightly pitted, a little mud adhering at the end. Shiny.; Blade: green, slightly pitted, has a thin covering of mud which makes it look dull. This piece is bent.","9, 9.5","","","Hoard of about 200 pieces.","","","","Joellen mcGann","https://www.flickr.com/photos/115096994@N02/21623413538","https://farm1.staticflickr.com/768/21623413538_b0b1ced8e3_m.jpg"
"46764","580","Leaf shaped Sword - 1 shoulder fragment  1 blade fragment","V","Guile Allès Museum, Guernsey.,Gaudion Collection.","Channel Islands,Alderney,Longy Common, 1832","Alderney","-2.197355700000003","49.715004","","None","None","1832","56; 89","blade 33,hilt 30; 51; 26","","202","","Hilt piece: green, slightly pitted, a little mud adhering at the end. Shiny.,Blade: green, slightly pitted had a thin covering of mud which makes it look dull. This piece is bent.","9; 9.5","","","Hoard of about 200 pieces.","","T.D. Kendrick. The Arch. of the Channe62, pl. VII (1928 ed.).","","Denis Antoine","https://www.flickr.com/photos/115096994@N02/21623413538","https://farm1.staticflickr.com/768/21623413538_b0b1ced8e3_m.jpg"
"46764","817","Leaf shaped sword","V","Guille Allés Museum. Guernsey,Gaudion Collection.","Channel Islands,Alderney,Longy Common","Alderney","-2.197355700000003","49.715004","","None","None","None","89","33","","202","","Hilt piece. Green. Slightly pitted a little mud showing at the end. Shiny.,Blade Green. Slightly pitted., has a thin covering of mud which makes it look dull. This piece is bent.","9.5","Length shows ""57mm  89."" Width shows ""blade. 33.  hilt 30.  51.  26."" Thickness shows ""9.  9.5"".","","Hoard of about 200 pieces.","","T.D. Kendrick. The Arch. of the Channel Islands. Vol.I p. 62, pl. VII (1928 ed).","","JP OConnor","https://www.flickr.com/photos/115096994@N02/21623413538","https://farm1.staticflickr.com/768/21623413538_b0b1ced8e3_m.jpg"
"46765","433","Sword Hilt/Hilt Frag.","III","Guille Alle's Museum, Guernsey,Gaudion Collection","Channel Islands,Alderney,Longy Common,1832","Longis Common, Guernsey","-2.1700596000000587","49.7206604","","None","None","1832","56","25, 37","","","","","2 (at top)","","","Hoard of about 200 pieces.","","T.D. Kendrick, The Arch. of the Channel Islands, Vol. I, p. 64, pl. VIII (1928 ed)","","Joellen mcGann","https://www.flickr.com/photos/115096994@N02/21623254480","https://farm1.staticflickr.com/709/21623254480_214a1a41d2_m.jpg"
"46765","580","Sword Hilt fragment","III","Guille Allès Museum, Guernsey.,Gaudion Collection.","Channel Islands,Alderney,Longy Common, 1832.","Alderney","-2.197355700000003","49.715004","","None","None","1832","56","25; 37","","","","","2 at top","","","Hoard of about 200 pieces.","","T.D. Kendrick. The Arch. of the Channel Islands, Vol. I, p. 64, pl. VIII (1928 ed.).","","Denis Antoine","https://www.flickr.com/photos/115096994@N02/21623254480","https://farm1.staticflickr.com/709/21623254480_214a1a41d2_m.jpg"
"46765","817","Sword Hilt,hilt frag.","III","Guille Allés Museum. Guernsey,Gaudion Collection.","Channel Islands,Alderney,Longy Common","Alderney","-2.197355700000003","49.715004","","None","None","1832","56","37","","","","","2","Width shows ""25.  37."" Thickness shows 2mm (at top)""","","Hoard of about 200 pieces.","","T.D. Kendrick. The Arch. of the Channel Islands. Vol.I p 64. pl. VIII (1928 ed).","","JP OConnor","https://www.flickr.com/photos/115096994@N02/21623254480","https://farm1.staticflickr.com/709/21623254480_214a1a41d2_m.jpg"
"46766","433","Sword","IVa","Anthropological Museum, Aberdeen University,253,Given by George Kerr, 1878","Scotland,Kincardineshire,Balnagubs,in line between Roman camps of Rae-dykes and Drumoak.,1809","Drumoak, Banchory, Aberdeenshire AB31, UK","-2.3458779999999706","57.08149","","None","None","1809","609","blade 41","","664","","","6","","","","Point broken.","","","Joellen mcGann","https://www.flickr.com/photos/115096994@N02/21799497642","https://farm1.staticflickr.com/590/21799497642_f5608f734e_m.jpg"
"46766","580","Sword","IVa","Anthropological Museum, Aberdeen University, 253,Given by George Kerr, 1878.","Scotland,Kincardineshire,Balnagubs,in line between Roman camps of Rae-dykes and Drumoak.,1809.","Netherley, Stonehaven, Aberdeenshire AB39, Royaume-Uni","-2.2429939999999533","57.0335","","None","None","1809","609","blade 41","","664","","","6","http://canmore.org.uk/site/37111/balnagubs !, ,","","","Point broken.","","","Denis Antoine","https://www.flickr.com/photos/115096994@N02/21799497642","https://farm1.staticflickr.com/590/21799497642_f5608f734e_m.jpg"
"46766","717","Sword","IVa","Anthropological Museum, Aberdeen University, 253, Given by George Kerr, 1878.","Scotland, Kincardineshire, Balmagube, in eine between Roman camp of Rae-Dyker and Drumoak","",,,"","None","None","1809","601","Blade 41","","664","","","6","","Point broken","","","","","Van C. Vives","https://www.flickr.com/photos/115096994@N02/21799497642","https://farm1.staticflickr.com/590/21799497642_f5608f734e_m.jpg"
"46767","433","Sword","","Haslam, Mr. - private,(one time site engineer at Funtham's Lane pit)","Cambridgeshire,Whittlesey,Funtham's Lane Pit","Funtham's Ln, Peterborough, Cambridgeshire PE7 2PG, UK","-0.17538860000001932","52.5601578","TL 2375 9688","None","None","None","","","","","","","","","","","","a) Pryor, 1978, no. 2","7a. Area Find,AFI; SI; CI; Rec: SN April 79; Source: R","Joellen mcGann","https://www.flickr.com/photos/115096994@N02/21623259140","https://farm1.staticflickr.com/671/21623259140_f32c5c4e10_m.jpg"
"46767","580","Sword","","Haslam, Mr. - private (one time site engineer at Funtham's Lane pit)","Cambridgeshire,Whittlesey,Funtham's Lane Pit","Whittlesey, Peterborough, Cambridgeshire PE7, Royaume-Uni","-0.1300956000000042","52.5581179","TL 2375 9688","None","None","None","","","","","","","","","","","","a) Pryor 1978, no. 2","7a. Area find.,Rec. SR. April 79,AFI,SI,CI,Source R","Denis Antoine","https://www.flickr.com/photos/115096994@N02/21623259140","https://farm1.staticflickr.com/671/21623259140_f32c5c4e10_m.jpg"
"46767","817","SWORD","","HASLAM, Mr. -- private,(one time site engineer at Funtham's Lane pit)","CAMBRIDGESHIRE,WHITTLESEY,FUNTHAM'S LANE PIT","Whittlesey, Peterborough, Cambridgeshire PE7, UK","-0.1300956000000042","52.5581179","TL 2375,9688","None","None","None","","","","","","","","","","7a. AREA FIND","","a) Pryor 1978, no. 2","","JP OConnor","https://www.flickr.com/photos/115096994@N02/21623259140","https://farm1.staticflickr.com/671/21623259140_f32c5c4e10_m.jpg"
"46768","433","Sword (portion)","IIIa","Museum of Archaeology & Ethnology, Cambridge,Purchased by the Cambridge Antiquarian Society, April 1919,1919.6","England,Cambridgeshire,Wilburton,In fen land belonging to Mr. Oliver Claude Pell,1882","Wilburton, Cambridgeshire, UK","0.1766450000000077","52.352064","","None","None","1882","204","60; 28","","167","Dull black patina all over except for one or two patches where the metal shows through","A little rough","","","","The Wilburton Hoard","","Archaeologia, XLVIII, 106,New Cambridge, 17 May 1919","","Joellen mcGann","https://www.flickr.com/photos/115096994@N02/21624415069","https://farm6.staticflickr.com/5617/21624415069_5c746496dd_m.jpg"
"46768","580","Sword (portion)","c,IIIa","Museum of Archaeology & Ethnology, Cambridge.,Purchased by the Cambridge Antiquarian Society, April 1919.,1919.6","England,Cambridgeshire,Wilburton,In fen land belonging to Mr. Oliver Claude Pell.,1882","Wilburton, Cambridgeshire, Royaume-Uni","0.1766450000000077","52.352064","","None","None","1882","204","60; 28","","167","dull black patina all over except for one or two patches where the metal shows through.","a little rough","","","","The Wilburton Hoard.","","Archaeologia XLVIII, 106.,New Cambridge, 17 May 1919.","","Denis Antoine","https://www.flickr.com/photos/115096994@N02/21624415069","https://farm6.staticflickr.com/5617/21624415069_5c746496dd_m.jpg"
"46768","817","Sword (portion).","IIIa","Museum of Archaeology & Ethnology,Cambridge,Purchased by the Cambridge Antiquarian Society April 1919.,1919.6","England,Cambridgeshire,Wilburton,In fen land belonging to Mr Oliver Claude Pell.","Wilburton, Cambridgeshire, UK","0.1766450000000077","52.352064","","None","None","1882","204","60","","167","dull black all over except for one or two patches where the metal shows through.","a little rough","","","","The Wilburton Hoard.","","Archaeologia XLVIII 106.,New Cambridge 17 May 1919.","","JP OConnor","https://www.flickr.com/photos/115096994@N02/21624415069","https://farm6.staticflickr.com/5617/21624415069_5c746496dd_m.jpg"
"46769","433","Leaf Shaped Sword (portion)","IIIb","Museum of Archaeology & Ethnology, Cambridge,Purchased by the Cambridge Antiquarian Society, April 1919,1919.6","England,Cambridgeshire,Wilburton,In fen land belonging to Mr. Oliver Claude Pell,1882","Wilburton, Cambridgeshire, UK","0.1766450000000077","52.352064","","None","None","1882","175","29, 44","","155","Black, yellow, & brown patina, Bronze & Tin shining through","Rough fused & bent","","","","The Wilburton Hoard","","Archaeologia, XLVIII, 106,New Cambridge, 17 May 1919","","Joellen mcGann","https://www.flickr.com/photos/115096994@N02/21811316395","https://farm6.staticflickr.com/5622/21811316395_bdc55a7b27_m.jpg"
"46769","580","Leaf shaped Sword (portion)","c,IIIb","Museum of Archaeology & Ethnology, Cambridge.,Purchased by the Cambridge Antiquarian Society, April 1919.,1919.6","England,Cambridgeshire,Wilburton,In fen land belonging to Mr. Oliver Claude Pell.,1882","Wilburton, Cambridgeshire, Royaume-Uni","0.1766450000000077","52.352064","","None","None","1882","175","29; 44","","155","Black, yellow & brown patina. Bronze & Tin shining through.","rough fused & bent","","","","The Wilburton Hoard.","","Archaeologia XLVIII, 106.,New Cambridge, 17 May, 1919","","Denis Antoine","https://www.flickr.com/photos/115096994@N02/21811316395","https://farm6.staticflickr.com/5622/21811316395_bdc55a7b27_m.jpg"
"46769","817","Leaf shaped sword (portion)","c,IIIG","Museum of Archaeology & Ethnology,Cambridge,Purchased by the Cambridge Antiquarian Society April 1919.,1919.6","England,Cambridgeshire,Wilburton,In fen land belonging to Mr Oliver Claude Pell","Wilburton, Cambridgeshire, UK","0.1766450000000077","52.352064","","None","None","1882","175","44","","155","Black, yellow & brown Bronze & Tin showing through.","rough fused & bent","","Width shows ""29mm  44mm"".","","The Wilbuton Hoard.","","Archaeologia XLVIII. 106.,New Cambridge 17 May 1919","","JP OConnor","https://www.flickr.com/photos/115096994@N02/21811316395","https://farm6.staticflickr.com/5622/21811316395_bdc55a7b27_m.jpg"
"46770","433","Sword (portion)","IIIb","Museum of Archaeology & Ethnology, Cambridge,Purchased by the Cambridge Antiquarian Society, April 1919,1919.6","England,Cambridgeshire,Wilburton,In fen land belonging to Mr. Oliver Claude Pell,1882","Wilburton, Cambridgeshire, UK","0.1766450000000077","52.352064","","None","None","1882","199","31","","192","Black brown & dust coloured patina.","Rough & corroded. 2 Rivets fused into holes, the other two broken away.","","","","The Wilburton Hoard","","Archaeologia, XLVIII, 106,New Cambridge, 17 May 1919","","Joellen mcGann","https://www.flickr.com/photos/115096994@N02/21623427438","https://farm6.staticflickr.com/5630/21623427438_945d5b8011_m.jpg"
"46770","580","Sword (portion)","Blade section,IIIb","Museum of Archaeology & Ethnology, Cambridge.,Purchased by the Cambridge Antiquarian Society, April 1919.,1919.6","England,Cambridgeshire,Wilburton,In fen land belonging to Mr. Oliver Claude Pell.,1882","Wilburton, Cambridgeshire, Royaume-Uni","0.1766450000000077","52.352064","","None","None","1882","199","31","","192","Black brown  & dust coloured.","rough & corroded. 2 rivets fused into holes, the other two broken away.","","","","The Wilburton Hoard.","","Archaeologia XLVIII, 106,New Cambridge, 17 May, 1919","","Denis Antoine","https://www.flickr.com/photos/115096994@N02/21623427438","https://farm6.staticflickr.com/5630/21623427438_945d5b8011_m.jpg"
"46770","817","Sword (portion)","Blade section,IIIG","Museum of Archaeology & Ethnology,Cambridge,Purchased by the Cambridge Antiquarian Society April 1919.,1919.6","England,Cambridgeshire,Wilburton,In fen land belonging to Mr Oliver Claude Pell.","Wilburton, Cambridgeshire, UK","0.1766450000000077","52.352064","","None","None","1882","199","31","","192","Black brown & dust coloured","rough & corroded. 2 Rivets fused into holes. the other two broken away.","","","","The Wilburton Hoard.","","Archaeologia XLVIII 106,New Cambridge 17 May 1919","","JP OConnor","https://www.flickr.com/photos/115096994@N02/21623427438","https://farm6.staticflickr.com/5630/21623427438_945d5b8011_m.jpg"
"46771","433","Sword Hilt","III","Museum of Archaeology & Ethnology, Cambridge,Purchased by the Cambridge Antiquarian Society, April 1919,1919.6","England,Cambridgeshire,Wilburton,In fen land belonging to Mr. Oliver Claude Pell,1882","Wilburton, Cambridgeshire, UK","0.1766450000000077","52.352064","","None","None","1882","89","34, 28.5","","54","Dull black patina","Rough","","","","The Wilburton Hoard","","Archaeologia, XLVIII, 106,New Cambridge, 17 May 1919","","Joellen mcGann","https://www.flickr.com/photos/115096994@N02/21190213953","https://farm1.staticflickr.com/718/21190213953_42d1dba34f_m.jpg"
"46771","580","Sword Hilt","Hilt section,III","Museum of Archaeology & Ethnology, Cambridge.,Purchased by the Cambridge Antiquarian Society, April 1919.,1919.6","England,Cambridgeshire,Wilburton,In fen land belonging to Mr. Oliver Claude Pell.,1882","Wilburton, Cambridgeshire, Royaume-Uni","0.1766450000000077","52.352064","","None","None","1882","89","34; 28.5","","54","dull black","rough","","","","The Wilburton Hoard.","","Archaeologia XLVIII, 106.,New Cambridge, 17 May, 1919.","","Denis Antoine","https://www.flickr.com/photos/115096994@N02/21190213953","https://farm1.staticflickr.com/718/21190213953_42d1dba34f_m.jpg"
"46771","817","Sword hilt.","Hilt section.,C,III","Museum of Archaeology & Ethnology,Cambridge,Purchased by the Cambridge Antiquarian Society April 1919.,1919.6","England,Cambridgeshire,Wilburton,In fen land belonging to Mr Oliver Claude Pell.","Wilburton, Cambridgeshire, UK","0.1766450000000077","52.352064","","None","None","None","89","34","","54","dull black","rough","","Width shows ""34mm  28.5mm"".","","The Wilburton Hoard.","","Archaeologia XLVIII. 106.,New Cambridge 17 May 1919","","JP OConnor","https://www.flickr.com/photos/115096994@N02/21190213953","https://farm1.staticflickr.com/718/21190213953_42d1dba34f_m.jpg"
"46772","226","Leaf-shaped sword","IIIb","Museum of Archaeology & Ethnology, Cambridge, Purchased by the Cambridge Antiquarian Society April 1919, 1919.6","England, Cambridge, Wilburton, In fen land belonging to Mr. Oliver Claude Pell, 1882","Wilburton, Cambridgeshire, UK","0.1766450000000077","52.352064","","None","None","1882","total 573.5","blade 39, widest part of hilt 57.5","","total 556.5","","slightly fused & bent","","","","found with the Wilburton Hoard","","Archaeologica xlviii.106, New Cambridge, 17 May 1919","","Elaine Dale","https://www.flickr.com/photos/115096994@N02/21623431888","https://farm6.staticflickr.com/5807/21623431888_a967ab7717_m.jpg"
"46772","433","Leaf Shaped Sword/1 hilt + 1 shoulder frag. adjoining + 2 blade frags. adjoining?","IIIb","Museum of Archaeology & Ethnology, Cambridge,Purchased by the Cambridge Antiquarian Society, April 1919,1919.6","England,Cambridgeshire,Wilburton,In fen land belonging to Mr. Oliver Claude Pell,1882","Wilburton, Cambridgeshire, UK","0.1766450000000077","52.352064","","None","None","1882","Total 573.5","blade 39; widest part of hilt 57.5","","Total 556.5","","Slightly fused & bent","","","","Found with the Wilburton Hoard.","","Archaeologia XLVIII, 106,New Cambridge, 17 May 1919","","Joellen mcGann","https://www.flickr.com/photos/115096994@N02/21623431888","https://farm6.staticflickr.com/5807/21623431888_a967ab7717_m.jpg"
"46772","580","Leaf shaped Sword,I hilt + 1 shouler frag. adjoining, 2 blade frags., adjoining?","c 1/3,IIIb","Museum of Archaeology & Ethnology, Cambridge.,Purchased by the Cambridge Antiquarian Society, April 1919.,1919.6","England,Cambridgeshire,Wilburton,In fen land belonging to Mr. Oliver Claude Pell.,1882","Wilburton, Cambridgeshire, Royaume-Uni","0.1766450000000077","52.352064","","None","None","1882","573.5","blade 39; widest part of hilt 57.5","","total 556.5","","slightly fused & bent.","","","","found with the Wilburton Hoard.","","Archaeologia xlviii, 106,New Cambridge 17 May, 1919.","","Denis Antoine","https://www.flickr.com/photos/115096994@N02/21623431888","https://farm6.staticflickr.com/5807/21623431888_a967ab7717_m.jpg"
"46773","226","Leaf-shaped sword, shoulder frag. + 2 joining blad frags. + other blade frag.","C 1/3, IIIb","Museum of Archaeology & Ethnology, Cambridge, Purchased by the Cambridge Antiquarian Society, April 1919, 1919.6","England, Cambridge, Wilburton, In fen land belonging to Mr. Oliver Claude Pell, 1882","Wilburton, Cambridgeshire, UK","0.1766450000000077","52.352064","","None","None","1882","total 531","widest part of hilt 52, blade 43","","total 647","","","","","","found with the Wilburton Hoard","One edge wavy & bent & slightly fusen in one part","Archaeologia xlviii. 106, New Cambridge, 17 May 1919","","Elaine Dale","https://www.flickr.com/photos/115096994@N02/21785168376","https://farm1.staticflickr.com/711/21785168376_bed2d948ec_m.jpg"
"46773","433","Leaf Shaped Sword/Shoulder Frag & 2 joining blade frags & 1 other blade frag.","IIIb","Museum of Archaeology & Ethnology, Cambridge,Purchased by the Cambridge Antiquarian Society, April 1919,1919.6","England,Cambridgeshire,Wilburton,In fen land belonging to Mr. Oliver Claude Pell,1882","Wilburton, Cambridgeshire, UK","0.1766450000000077","52.352064","","None","None","1882","531","widest part of hilt 52; blade 43","","647","","","","","","Found with the Wilburton Hoard","One edge wavy & bent & slightly fused on one part.","Archaeologia, XLVIII, 106,New Cambridge, 17 May 1919","","Joellen mcGann","https://www.flickr.com/photos/115096994@N02/21785168376","https://farm1.staticflickr.com/711/21785168376_bed2d948ec_m.jpg"
"46773","580","Leaf shaped Sword,shoulder frag. + 2 joining blade frags. +1 other blade frag.","Hilt and blade section,c 1/3,IIIb","Museum of Archaeology & Ethnology, Cambridge.,Purchased by the Cambridge Antiquarian Society, April 1919,1919.6","England,Cambridgeshire,Wilburton,In fen land belonging to Mr. Oliver Claude Pell,1882.","Wilburton, Cambridgeshire, Royaume-Uni","0.1766450000000077","52.352064","","None","None","1882","531","widest part of hilt 52; blade 43","","total 647","","","","","","found with the Wilburton Hoard.","One edge wavy & bent & slightly fused in one part.","Archaeologia, xlviii, 106.,New Cambridge, 17 May, 1919.","","Denis Antoine","https://www.flickr.com/photos/115096994@N02/21785168376","https://farm1.staticflickr.com/711/21785168376_bed2d948ec_m.jpg"
