"taskID","userID","objectType","rightCorner","collection","site","toSearch","Lon","Lat","gridRef","dateDiscoveryDay","dateDiscoveryMonth","dateDiscoveryYear","length","width","edge","weight","patina","surface","thickness","other","composition","associations","description","publications","remarks","inputBy","imageURL","flickrURL"
"46655","543","Leaf Sword","IIc","The Manx Musuem, Douglas, Isle of Man","Isle of Man,Santan (Kirk Santan),Crogga House, near,","Port Soderick, Isle of Man","-4.5329176999999845","54.1231287","","23","5","1929","583","45","","628","","","8","","Copper 82.00, Tin 9.2, Lead 8.51, Iron 0.11, sulfur tr.","","end of hilt and tip missing","","","Jane Fellows","https://www.flickr.com/photos/115096994@N02/21784939356","https://farm6.staticflickr.com/5730/21784939356_ec014e1142_m.jpg"
"46655","677","Leaf Sword","IIc","The Marx Museum, Donglae., , note german.","Isle of Man, Santan (Kirk Shutan), Crogga River, near, 23rd May, 1929""","Crogga River, Isle of Man","-4.553300000000036","54.1317","Crogga River, Isle of Man","23","5","1929","58 2","45","","121","","","8","Much of the handwriting was difficult to decipher (there was a lot of fuzziness). I made my best possible judgement. Also there appears to be some information missing.","Copper 12.00, Tin 920, lead 1-11, non 01, Sulfar K. good of hilt, top missing,","","","","","Michael George Adams","https://www.flickr.com/photos/115096994@N02/21784939356","https://farm6.staticflickr.com/5730/21784939356_ec014e1142_m.jpg"
"46655","717","Leaf Sword","IIC","The Manx Museum, Douglas, Isle of Man.","Isle of Man, Santan (Kirk Santan), Crogga house, near, 3rd May, 1929","",,,"","23","5","1929","583","45","","628","","","8","","Copper 82.00, Tin 9.20, Lead 8.51, iron 0.11, sulphur  tr.","","End of hilt & tip missing","","","Van C. Vives","https://www.flickr.com/photos/115096994@N02/21784939356","https://farm6.staticflickr.com/5730/21784939356_ec014e1142_m.jpg"
"46656","580","Leaf shaped Sword","IVa","Manx Museum, Isle of Man,1","Isle of Man,Berrag,Jurby","Jurby, Île de Man","-4.5200589999999465","54.35903","","None","None","None","614","hilt plate 45; 25; 55,blade 47","","1056.03","","","5; 8; 7.5","","Cu. 81.70; St. 11.20; Pb. 6.15; Fe. 0.17; Zc. 0.50,99.72","","A faintly marked rounded median-ridge sinking gradually from the hiltend, with shallow fluting along the edges. 7 Rivet holes, one contains remains of rivet.","","","Denis Antoine","https://www.flickr.com/photos/115096994@N02/21784941446","https://farm1.staticflickr.com/704/21784941446_3162ce1136_m.jpg"
"46656","677","Leaf shaped Sword","IVa","Marx Museum, Isle of Man 1","Isle of Man, Barray, farby","Isle of Man","-4.548055999999974","54.236107","Isle of Man","None","None","None","61 6","hilt plate 45, 25. 55 blade 17,","","1056.03","","","5. 8. 7.5","Much of the handwriting was difficult to decipher (there was a lot of fuzziness). I made my best possible judgement. Also there appears to be some information missing.","Co. 01.30 Co. 01 10 Co 1.15 Co 11 11 12 Co th A faintly marked rounded medium ridge tinking gradually from the halt end, with shallow planting along the edges 7 rivet holes one contains remains of aint.","","","","Perimeter go what","Michael George Adams","https://www.flickr.com/photos/115096994@N02/21784941446","https://farm1.staticflickr.com/704/21784941446_3162ce1136_m.jpg"
"46656","717","Leaf Shaped Sword","IVa","Manx Museum, Isle of Man","Isle of Man, Berraj, Iurley","",,,"","None","None","None","614","Hilt Plate 45.25.55; blade 47","","1056.03","","","5.8.7 1/2","","Cu 81.70, Sr 11.20, Pb 6.15,","","A faintly marked Median-ridge sinking gradually from the hilt end, with shallow fluting along the edges.  7 rivet holes. One contains remans of rivet.","","","Van C. Vives","https://www.flickr.com/photos/115096994@N02/21784941446","https://farm1.staticflickr.com/704/21784941446_3162ce1136_m.jpg"
"46657","543","Leaf shaped sword (portion)","a red dot,IIIC","Dover Museum,Presented by Rev. W. Vallance","England,Kent,Sittingbourne","Sittingbourne, Sittingbourne, Kent, UK","0.7315959999999677","51.340402","","16","1","1862","194","hilt 43,19.5","blade 21.5","141.75","a little green but blade is mostly golden bronze","Fairly smooth. Hilt slightly corroded.","blade 6.75","Bottom left of card says ""JCM"". I have converted inches in the Associations to metric measurements.","","Found in an urn with 6 bronze rings measuring from 1 1/2 - 2 1/4 ins [38-57 mm] in diameter,Three feet [900mm] away was another urn containing 4 Sock. Axes, 1 gouge","Originally 3 pieces fund,Four of the holes are filled. There are no rivets attached. There is another measurement (20) on the diagram","C. Roach Smith Collectanea Antiqua I 1845 pp. 101-102","","Jane Fellows","https://www.flickr.com/photos/115096994@N02/21623209358","https://farm6.staticflickr.com/5755/21623209358_681bd10c57_m.jpg"
"46657","580","Leaf shaped Sword (portion)","IIIc","Dover Museum,presented by Rev. W. Vallance.","England,Kent,Sittingbourne,16th Jan. 1862","Sittingbourne, Sittingbourne, Kent, Royaume-Uni","0.7315959999999677","51.340402","","16","1","1862","194","blade 21.5,hilt 43; 19.5","","141.75","a little green patina but blade is mostly golden bronze.","fairly smooth. Hilt slightly corroded.","blade 6.75","","","Found in an urn with 6 bronze rings measuring from 1 1/2 - 2 1/4 cms in diameter.","four of the holes are filed. There are no rivets attached.","C. Roach Smith Collectanea Antiqua I, 1848, pp. 101-102","Originally 3 pieces found.,Three feet away was another urn containing 4 Sock. Axes.,JCM","Denis Antoine","https://www.flickr.com/photos/115096994@N02/21623209358","https://farm6.staticflickr.com/5755/21623209358_681bd10c57_m.jpg"
"46657","677","Leaf shaped sword (portion)","III C","Dover Museum, , pres. by Rev. W. Vallance.","England, Kent, Sittingbourne 16th Jan. 1862","Sittingbourne, Sittingbourne, Kent, UK",,,"Sittingbourne, Sittingbourne, Kent, UK","16","1","1862","194","blade 21.5 hilt 43 19.5","","141.75","a little green patina but blade is mostly golden bronze.","fairly smooth. Hilt slightly corroded.","blade 6.75","","four of the holes are filled. There are no rivets attached.","Found in an hon with 6 bronze rings measuring from 1 1/2 - 2 1/4 ins in diameter","Originally 3 pieces found.","C. Roach Smith Collection u Antiqua I 1848 pp. 101 - 102","J M Three feet away was another Urn containing 4 Sock Axes. 1 gouge., , , , Filled Holes.","Michael George Adams","https://www.flickr.com/photos/115096994@N02/21623209358","https://farm6.staticflickr.com/5755/21623209358_681bd10c57_m.jpg"
"46658","580","Sword Fragment","Frag.","Mr. Lemmon, Saltwood","England,Kent,Saltwood,Hayne Wood, on line of railway, cutting, 6 ft. below surface, lying on stratum of sand, c. 25 yards N.E. by N. of summit of hill. Found June 4, 1872? (Kent LXXIV. NE.)","Saltwood, Kent, Royaume-Uni","1.0688129000000117","51.0857408","","4","6","1872","40","42","","52","green & brown","smooth","9","","","Part of a large hoard; see card for first sword fragment.","Fragment of shoulders; rivet holes torn; on each side of mid rib are three incised lines on one face of blade, on the other face (drawn in sketch) in out side of midrib are four incisions.","Evans,Journ. Anthrop. Inst. III 230.,Ant. Journ. XXX, 279.,Jessup. Arch. of Kent, 107.","","Denis Antoine","https://www.flickr.com/photos/115096994@N02/21189998303","https://farm6.staticflickr.com/5741/21189998303_41eb9dc678_m.jpg"
"46658","677","Sword Fragment","Axe Frag","Mc Lennon, , Saltwood","England, Kent, Saltwood, Haynt Wood, on line of railway cutting,, 6 ft. below surface, lying on stratuns of sand, c 25 jaids N. E. by N. of sumont of hill. Found June 4, 1872. (Kent LXXIV. NE.),","Saltwood, Kent, UK",,,"Saltwood, Kent, UK","4","6","1872","40","42","","52","green or brown patina","Smooth","9","Some of the handwriting was difficult to decipher. I made my best possible judgement.","","Part of a laye haul; see card for first sword fragment.","Fragment of shoulders: rivet holes torn; on each side of mid rib are three incised lines on one face of blade; on the other face (drawn in stretch) in one side of midrib are four incisions.","Evans, , Jowrn: Anthsop: Inot. III. 230., , Ash: Jowrn XXX. 279., , Jessup. Anh: if Kent. 107.","","Michael George Adams","https://www.flickr.com/photos/115096994@N02/21189998303","https://farm6.staticflickr.com/5741/21189998303_41eb9dc678_m.jpg"
"46658","1076","Sword Fragment","[...] Frag","Mr Lemmon, , Saltwood","England, Kent, Saltwood, Hayne Wood, on [...] of railway cutting, 6 fr. below surface, lying on stratum of sand, c 25 yards N.E. by N. of summit of hill.","","1.0757059999999683","51.078072","Kent LXXIV NE","4","6","1872","40","42","","52","green or brown","Smooth","9","","","Part of a large hoard; see card for first sword fragment","Fragment of shoulders: rivet holes torn; on each side of mid rib are three incised lines on one facet of blade; on the other facet ([...] in sketch) [...] side of midrib are four incisions.","Loans, , Journ: Anrthop: [...]. III. 230., , Arcg: Jorun XXX. 279., , [...] Arch: of Kent. 107.","","Ben Lewis","https://www.flickr.com/photos/115096994@N02/21189998303","https://farm6.staticflickr.com/5741/21189998303_41eb9dc678_m.jpg"
"46659","433","Sword Fragment/Shoulder Fragment","IVa","Folkstone Museum","England,Kent,Saltwood,Hayne Wood, on line of railway cutting 6 ft below surface, lying on stratum of sand c. 25 yards NE by N of summit of hill,Found June 4, 1872","Saltwood, Hythe, Hythe, Kent CT21, UK","1.0757059999999683","51.078072","Kent LXXIN NE","4","6","1872","101","49.5","","113","Green brown, mostly green.","Rather rough.","6 across blade section","","","Part of a large hoard; now consisting of: 5 socketed celts; 16 fragments of socketed celts; 2 spearheads V; 2 spearhead fragments; 14 sword fragments; 2 sicket fragments; 2 socketed knife fragments; 3 bracelet fragments; 1 socketed gouge; 1 looped mount; 1 chape; 1 chisel; 1 disc; miscasting of a socket; 1 linch pin; 14 lumps; and some pieces now missing, see Evans & Arch. Journ. XXX","Fragment consisting of part of hilt, shoulders, and part of blade. Hilt broken across a rivet hole, below is another with rivet still in place. Two rivet holes in each shoulder, one of them being stopped up. Shoulders straight; except for a slight rounding at their points, Ricasso notches. Blade broken off 10mm below ricasso notches. Hilt is irregularly cast.Traces of wood still adhering round rivet in hilt","Arch. Journ. XXX, 279,Evans,Journ. Anthrop. Inst. III, 230,Jessup, Arch. of Kent, 107","","Joellen mcGann","https://www.flickr.com/photos/115096994@N02/21799291782","https://farm1.staticflickr.com/616/21799291782_e68b31b234_m.jpg"
"46659","580","Sword Fragment","c,IVa","Folkestone Museum","England,Kent,Saltwood,Hayne Wood, on line of railway cutting, 6 ft. below surface, laying on stratum of sand c. 25 yards N.E. by N. of summit of hill,Found June 4, 1872. (Kent LXXIV. N.E)","Saltwood, Kent, Royaume-Uni","1.0688129000000117","51.0857408","","None","None","None","101","49.5","","113","green brown, mostly green.","rather rough.","6 across blade-section","","","Part of a large hoard; [...] consisting of: 5 Socketed Celts; 16 fragments of Socketed Celts; 2 Spearheads V; 2 Spearhead fragments; 14 Sword fragments; 2 Sickle fragments; 2 Socketed Knife fragments; 3 Bracelet fragments; 1 Socketed Gouge; 1 [...] mount; 1 Chapt; 1 Chisel, 1 disc; miscasting of a socket; 1 [...] pin; 14 lumps; and some pieces now missing, see Evans & Arch. Journ. XXX.","Fragment consisting od part of hilt, shoulders, and part of blade. Hilt broken across a rivet hole, below is another with rivet still in place. Two rivet holes in each shoulder, one of them being stopped up. Shoulders straight, except for a slight rounding at their points Ricasso notches. Blade broken off 10 mm. below ricasso notches, Hilt is irregularly cast. Traces of wood still adhering round rivet in hilt.","Arch. Journ. XXX, 279.,Evans,Journ. Anthrop. Inst. III, 230.,Jessup. Arch. of Kent, 107.","","Denis Antoine","https://www.flickr.com/photos/115096994@N02/21799291782","https://farm1.staticflickr.com/616/21799291782_e68b31b234_m.jpg"
"46659","677","Sword Fragment","IVa","Folhestone Museum","England, Kent, Saltwood, Hagnt Wood, on line of railway cutting, 6 ft. below surface, lying on stratum of sand c 25 yards N.E. by N. of summit of hill Found June 4, 1872 (Kent LXXIN. N.E)","Saltwood, Kent, UK",,,"Saltwood, Kent, UK","4","6","1872","101","49.5","","113","traces of wood still adhering round risot in hilt: green brown, mostly greene.","rather rough.","6 aiwrs blade. action","Some of the handwriting was difficult to decipher. I made my best possible judgement. Also some information appears to be missing.","","Part of a large honrd; woir consisting of: 5 socketed celts; 16 Fragts of Socketed Celts; 2 Spearheads V; 2 spearhead frayts; 14 sword fragts; 2 richle frgts; 2 socketed knife fragts; 3 bracket fragts; 1 socketed gorgt; 1 loped nrount; 1 chapt; 1 chisel; 1 dsn; mis cashy of a socket; 1 Linch pin; 14 lumps; and some pieces hoir missing, see lonsi & Anh Towsn. xxx.","Fragment consisting of part of hilt, shoulders, and part of blade. Hilt broken across a rivet. hole, below is another with rivet still in place. Two rivet holes in each shoulder, one of them being stopped into shoulders straight: except for a slight rounding at their points Ricasso notches. Blade broken off 10mm. below risano notches, Hilt is irregularly cast.","Ash: Jowm. xxx. 279., , Poens, , Jairn: Anthwp: Inct: III. 230., , Jessup. Arch: of Kent. 107.","","Michael George Adams","https://www.flickr.com/photos/115096994@N02/21799291782","https://farm1.staticflickr.com/616/21799291782_e68b31b234_m.jpg"
"46660","433","Fragment of Sword Hilt","Frag","Mr. Lemmon, Saltwood","England,Kent,Saltwood,Hayne Wood, on line of railway cutting 6 ft. below surface, lying on stratum of sand, c. 25 yards NE by N of summit of hill. Found June 4, 1872","Saltwood, Hythe, Hythe, Kent CT21, UK","1.0757059999999683","51.078072","Kent LXXIV NE","4","6","1872","53","25","","40","Greyish green patina","Smooth","","","","Part of a large hoard; see card for first sword fragment.","Part of hilt. Two rivet holes, below the second is a slight central thickening; slight flanges along the edge. The whole is slightly bent.","Arch. Journ. XXX 278,Evans,Jessup, Arch. of Kent, 107,Journ. Anthrop. Instit. III, 230","","Joellen mcGann","https://www.flickr.com/photos/115096994@N02/21799292792","https://farm6.staticflickr.com/5821/21799292792_33d4873e1e_m.jpg"
"46660","580","Fragment of Sword Hilt","c,Frag.","Mr. Lemmon, Saltwood.","England,Kent,Saltwood,Hayne Wood, on line of railway cutting, 6 ft. below surface, laying on stratum of sand c. 25 yards N.E. by N. of summit of hill,Found June 4, 1872. (Kent LXXIV. N.E)","Saltwood, Kent, Royaume-Uni","1.0688129000000117","51.0857408","","4","6","1872","53","25","","40","greyish-green","smooth","","","","Part of a large hoard; see card for first sword fragment.","Part of hilt. Two rivet holes, below the second is a slight central thickening; slight flanges along the edge. The whole is slightly bent.","Arch. Journ. XXX, 279.,Evans,Jessup. Arch. of Kent, 107,Journ. Anthrop. Instit. III, 230.","","Denis Antoine","https://www.flickr.com/photos/115096994@N02/21799292792","https://farm6.staticflickr.com/5821/21799292792_33d4873e1e_m.jpg"
"46660","1091","Fragment of sword hilt","Frag,e","Mr. Lemmon, Saltwood","England, Kent, Saltwood. Hayne Wood on line of milway cutting, 6ft below surface, lying on stratum of sand, c. 25 yds N.E. by N. of summit of hill.","Saltwood, Kent, UK",,,"Kent LXXIV NE","4","6","1872","53","25","","","Greyish green","Smooth","","First card. All corrections / suggestions / comments welcome.","","Part of a layt hoard; see card for first sword fragment","Part of hilt. Two rivet holes; below the second is a slight central thickening; slight flanges along the edge; the whole is slightly bent.","Arch. Journ. XXX. 279. Evans., , Jessup. Arch. of Kent, 107, , Journ. Anthrop Instit. III 230","","Barbara Palmer","https://www.flickr.com/photos/115096994@N02/21799292792","https://farm6.staticflickr.com/5821/21799292792_33d4873e1e_m.jpg"
"46661","433","Sword Fragment","IVa","Mr. Lemmon, Saltwood","England,Kent,Saltwood,Hayne Wood, on line of railway cutting, 6 ft. below surface, lying on stratum of sand, c. 25 yards NE by N of summit of hill. Found June 4, 1872","Saltwood, Hythe, Hythe, Kent CT21, UK","1.0757059999999683","51.078072","Kent LXXIV NE","4","6","1872","83","48 across shoulders","","80","Green & brown","Mostly smooth.","5","","","Part of large hoard; see card for first sword fragment.","Fragment consisting of shoulders & upper part of blade. Cutting edges of blade chipped & blunt; ricasso notches, one almost completely broken away. Rivet hole in each shoulder, above the rivet was there develop slight flanges to the hilt-piece; mid rib extending the whole length of the fragment. Considerably bent.","Arch. Journ. XXX, 279,Evans,Jessup, Arch. of Kent, 107,Journ. Anthrop. Inst. III, 230","","Joellen mcGann","https://www.flickr.com/photos/115096994@N02/21623213258","https://farm1.staticflickr.com/608/21623213258_58db0ebd3a_m.jpg"
"46661","580","Sword Fragment,shoulder fragment","IVa","Mr. Lemmon, Saltwood","England,Kent,Saltwood,Hayne Wood, on line of railway cutting, 6 ft. below surface, laying on stratum of sand c. 25 yards N.E. by N. of summit of hill,Found June 4, 1872. (Kent LXXIV. N.E)","Saltwood, Kent, Royaume-Uni","1.0688129000000117","51.0857408","","4","6","1872","83","48 across shoulders","","80","green & brown","mostly smooth","5","","","Part of large hoard; see card for first sword fragment.","Fragment consisting of shoulders & upper part of blade. Cutting edges of blade chipped & blunt; ricasso notches, one almost completely broken away. Rivet hole in each shoulder; above the rivet holes there develop slight flanges & the hilt-piece; mid rib extending the whole length of the fragment. Considerably bent.","Arch. Journ. XXX, 279.,Evans,Jessup, Arch. of Kent, 107.,Journ. Anthrop. Inst. III, 230.","","Denis Antoine","https://www.flickr.com/photos/115096994@N02/21623213258","https://farm1.staticflickr.com/608/21623213258_58db0ebd3a_m.jpg"
"46661","677","Sword Fragment.","IVa","Mr Lernrnon, , Saltwood","England, Kent, Saltwood, Hayne Wood, on line of railway cutting, 6ft. below surface, lying on stratum of sand, c 25 yards N.E. by N. of summit of hill. Found June 4, 1872. (Kent LXXIV. NE)","Saltwood, Kent, UK",,,"Saltwood, Kent, UK","4","6","1872","83","48 across shoulders","","80","green or brown patina","mostly smooth","5","Some of the handwriting was difficult to decipher. I made my best possible judgement. Also some information appears to be missing.","","Part of layt housd; see card for first sword fragc.","Fragment consisting of shoulders & upper part of blade. Cutting edges of blade chipped & blunt; ricasso nohhes, me almost completely broken away. Rivet hole in each shoulder: above that rivet lwhs these develop slight flanges to the hilt-piece; mid rib extending the whole length of the fragment. Coincidently bent.","Anh: Jaum: XXX 279., , Evans, , Jessup. Anh: of Kent. 107., , Journ: Anthrop: Inst: III. 230.","","Michael George Adams","https://www.flickr.com/photos/115096994@N02/21623213258","https://farm1.staticflickr.com/608/21623213258_58db0ebd3a_m.jpg"
"46662","433","Sword","IIa","Mr. H. Baze (1952),In 1958 in the possession of Alec who kept a whelk stall at Dymchurch","Kent,Folkstone,East Wear Bay, dredged 40 yards off shore; off site Roman Villa,April or May 1951","Folkestone, Kent, UK","1.1694559999999683","51.081397","","None","5","1951","625.48","","","","","","","Length: 24 5/8"" = 625.48mm","","","Immediately below the outer rivet-hole on each side, a small raised feature of semi-circular section (it is too ill-defined to rank properly as a beading or moulding) curves inwards for a couple of inches, after which it tapers away? J.D.C.","Arch. Cont. LXV, 90ff","DF(S)","Joellen mcGann","https://www.flickr.com/photos/115096994@N02/21811105105","https://farm6.staticflickr.com/5752/21811105105_cd1037de0a_m.jpg"
"46662","580","Sword","Prob all poss.,IIa","Mr. H. Brice (1952),In 1958 in the possession of Alec who kept a whelk stall at Dymchurch.","Kent,Folkestone,East Wear Bay, dredged 40 yds off shore, off site Roman Villa.,April or May 1951","Folkestone, Kent, Royaume-Uni","1.1694559999999683","51.081397","","None","None","1951","625.475","","","","","","","","","","""Immediately below the outer rivet-hole on each side a small raised [...] of semi-circular section (it is too ill-defined to [...] properly as a beading or moulding) [...] [...] J.D.C.","Arch. Cant. LXV, [...]","DF (S)","Denis Antoine","https://www.flickr.com/photos/115096994@N02/21811105105","https://farm6.staticflickr.com/5752/21811105105_cd1037de0a_m.jpg"
"46662","677","Sword","PROBY ALL POSS., , IIa","Mr. H. Bnze (1952), , In 1958 in the possession of 'Alec who kept a whelk stall at Dymchorch'.","Kent, Folkstove, East Wear Bay dradgate 40 yds off shore, oft S.h Ronan Uka. Apanlon May 1951","Kent, UK","0.5217254000000366","51.2787075","Kent, UK","None","5","1951","24 5/8","","","","","","","Some of the handwriting was difficult to decipher. I made my best possible judgement. Also some information appears to be missing.","""Immearatily Below the outer rivet-hole on each side a small raised featway rent-crrailar section (it 13 hou ill. define to tank properly as a beading or moulding) eurhes ihwards for a compling inches, aftr uhrch F tarus away ? J. D. C.","","","Arch. Cant. L XV, Goff.","DF (S)","Michael George Adams","https://www.flickr.com/photos/115096994@N02/21811105105","https://farm6.staticflickr.com/5752/21811105105_cd1037de0a_m.jpg"
"46663","433","Hilt of Sword","IVa","Dover Museum","England,Kent,Dover,Buckland Brick Field","Dover, Kent, UK","1.3134026999999833","51.1278758","","None","None","None","78","42, 22, 24","","49.59","No patina","Fairly smooth, very slight encrustment, good deal of golden bronze showing, clay or sand nearly all over.","6, 1","","","Dug up with a number of celts & fragments","","","","Joellen mcGann","https://www.flickr.com/photos/115096994@N02/21799295622","https://farm1.staticflickr.com/582/21799295622_d9a5b5f1a3_m.jpg"
"46663","580","Hilt of Sword","IVa","Dover Museum","England,Kent,Dover,Buckland Brick Fields.","Douvres, Kent, Royaume-Uni","1.3134026999999833","51.1278758","","None","None","None","78","42; 22; 24","","49.59","no patina","fairly smooth. very slight encrustment. good deal of golden bronze showing. clay or sand nearly all over.","6; 1","","","Dug up with a number of celts & fragments.","","","","Denis Antoine","https://www.flickr.com/photos/115096994@N02/21799295622","https://farm1.staticflickr.com/582/21799295622_d9a5b5f1a3_m.jpg"
"46663","817","Hilt of Sword","IVa","Dover Museum","England,Kent,Dover,Buckland Brick Fields","Dover, Kent, UK","1.3134026999999833","51.1278758","","None","None","None","78","42","6","49.59","no","fairly smooth, very slight encrustment, good deal of golden bronze showing, clay or sand nearly all over.","","Width shows ""42mm  22mm  24mm"". Thickness shows ""6mm  1mm"".","","Dug up with a number of celts & fragments.","","","","JP OConnor","https://www.flickr.com/photos/115096994@N02/21799295622","https://farm1.staticflickr.com/582/21799295622_d9a5b5f1a3_m.jpg"
"46664","433","Sword","","Twickenham Gravel Co., Lts.,The Wilderness, Blackheath, near Camberley, Surrey,(Shown to London Museum, Dec. 1962)","Kent,Darenth,in bed of old course of river Darenth, near existing bridge,September 1962","Darenth, Dartford, Kent, UK","0.24185869999996612","51.4194914","TQ.5606.7006","None","9","1962","608","","","","","","","","","","Blade has somewhat flattened, mid-rib and bevelled edges. On each face a slight groove follows the outline of the blade until it converges on the mid-rib about 6 cm. from point. On each face surface of metal changes on semi-circular line immediately below hilt. Hilt broken and sword corroded.","","","Joellen mcGann","https://www.flickr.com/photos/115096994@N02/21624208529","https://farm6.staticflickr.com/5736/21624208529_c2edb331b4_m.jpg"
"46664","580","Sword","","Twickenham Gravel Co. Ltd.,The Wilderness, Blackheath, near Camberley, Surrey.,(shown to London Museum, Dec. 1962.)","Kent,Darenth,in bed of old course of river Darenth, near existing bridge,National grid TQ.5606.7086,September 1962","Darenth, Dartford, Kent, Royaume-Uni","0.24185869999996612","51.4194914","","None","9","1962","608","","","","","","","","","","Blade has somewhat flattened mid-rib and bevelled edges. On each face a slight groove follows the outline of the blade until it converges on the mid-rib about 6 cm. from point. On each face surface of metal changes on semi-circular line immediately below hilt. Hilt broken and sword corroded.","","","Denis Antoine","https://www.flickr.com/photos/115096994@N02/21624208529","https://farm6.staticflickr.com/5736/21624208529_c2edb331b4_m.jpg"
