"taskID","userID","objectType","rightCorner","collection","site","toSearch","Lat","Lon","gridRef","dateDiscoveryDay","dateDiscoveryMonth","dateDiscoveryYear","length","width","edge","weight","patina","surface","thickness","other","composition","associations","description","publications","remarks","inputBy","imageURL","flickrURL","Processing","lon","lat","project"
"4471","433","Adze","","Herts County Museum, St. Albans, lent by Capt. J.H. Ball, RAF","austria","austria","47.20003","13.19995900","","None","None","None","144","30","22","138","covered with roughish patina of dull light green (roughness probably caused by casting)","fairly smooth","20","Site: Unspecified location in Austria - geolocation not accurate to 10 kms, , Width: edge 21.5; middle 30, , Thickness: 20 1/4 mm; 6 1/2 mm, , Weight: 138.19 gms","Copper","","","","","Joellen mcGann","http://farm8.staticflickr.com/7458/13306658614_5e2df47dc4_b.jpg","http://www.flickr.com/photos/MicroPasts/13306658614","superuser",13.2,47.2,"drawB8"
"4472","433","Axe","","Herts County Museum, St. Albans, lent Capt. J.H. Ball, RAF","austria","austria","47.20003","13.19995900","","None","None","None","185","58","79","695","dull patina olive green","smooth","38","Site: unspecified location in Austria - geolocation is not accurate to 10 kms, , Width: edge 78 3/4 mm; middle 57.5 mm; butt 44., , Thickness: 37 3/4 mm; 33.5 mm; 7 mm; 34 mm., , Weight: 694.57 gms","","","Marked on one side of the septum with a stroke and a cross. This mark is repeated on outside of wing opposite the loop.  Possibly the owner's mark.  A good deal has been cleaned off.  showing golden bronze.","","","Joellen mcGann","http://farm4.staticflickr.com/3679/13306658374_069fcbb62e_b.jpg","http://www.flickr.com/photos/MicroPasts/13306658374","superuser",13.2,47.2,"drawB8"
"4473","433","Adze","","Herts County Museum, St. Albans, lent by Capt. J.H. Ball, RAF","austria","austria","47.20003","13.19995900","","None","None","None","255","74","66","1432","no real patina","rough musch pocked all over. Red, brown and some corrosive green. Dark brown copper shows a good deal.","42","Site: unspecified location in Austria - geolocation not accurate to 10 kms, , Width: edge 66; across socket 74; butt 19.5, , Thickness 41.5; 33, , Weight: 1431.63 gms","Copper","","","","","Joellen mcGann","http://farm8.staticflickr.com/7064/13306450373_dbd2488082_b.jpg","http://www.flickr.com/photos/MicroPasts/13306450373","superuser",13.2,47.2,"drawB8"
"4474","433","Adze","","Herts County Museum, St. Albans, lent by Capt. J.H. Ball, RAF","austria","austria","47.20003","13.19995900","","None","None","None","271","56","53","1002","some patina dull, medium green and dull dark copper colour","smooth generally but a little rough from casting","16","Site: Unspecified location in Austria - geolocation not accurate to 10 kms, , Width: edge 53; middle 56; butt blade 41, , Thickness: 16; 34.5; 15.5, , Weigh: 1002,2 gms","Copper","","","","","Joellen mcGann","http://farm8.staticflickr.com/7225/13306296385_40d15da0cb_b.jpg","http://www.flickr.com/photos/MicroPasts/13306296385","superuser",13.2,47.2,"drawB8"
"4475","433","Adze","","Herts County Museum, St. Albans, lent by Capt. J.H. Ball, RAF","austria","austria","47.20003","13.19995900","","None","None","None","245","58","47","914","medium and dark green. This is a good deal scraped off. Showing dark red copper.","fairly smooth","30","Site: Unspecified location in Austria - geolocation not accurate to 10 kms, , Width: 46.5 edge; 58 1/4 across socket; 37 butt edge, , Thickness: across socket 29.5, , Weight: 914.28 gms","Copper","","Round the socket are 5 round indentations. These are on the concave side of the adze.","","","Joellen mcGann","http://farm3.staticflickr.com/2856/13306296215_2bf5813029_b.jpg","http://www.flickr.com/photos/MicroPasts/13306296215","superuser",13.2,47.2,"drawB8"
"4476","433","Battle axe","","Herts County Museum, St. Albans, lent by Capt. J.H. Ball, RAF","austria","austria","49.39226","11.88159962","","None","None","None","181","19","","400","dark green (jade) not very thick. Dark bronze shows through.","Slightly pitted and smooth polished","","Width: 19x26.5; 21 3/4 x 15.5; socket 30 x 33, , Weight: 400.42 gms","Bronze","","","","","Joellen mcGann","http://farm4.staticflickr.com/3689/13306449713_d8289d0bcf_b.jpg","http://www.flickr.com/photos/MicroPasts/13306449713","superuser",11.8816,49.3923,"drawB8"
"4477","433","Axe","","Herts County Museum, St. Albans, lent by Capt. J.H. Ball, RAF","austria","austria","47.20003","13.19995900","","None","None","None","204","48","78","829","thick polished patina dark olive green, partly cleaned showing golden bronze","smooth","37","Site: unspecified location in Austria - geolocation not accurate to 10 kms, , Length: 203.5, , Width: edge 77.5; at section 46; butt 48; with loop 57.5, , Thickness: 37; 8; 37.5, , Weight: 829.23 gms","","","Splendidly preserved. Sides of wings are faintly faceted.","","","Joellen mcGann","http://farm8.staticflickr.com/7133/13306295765_65012be554_b.jpg","http://www.flickr.com/photos/MicroPasts/13306295765","superuser",13.2,47.2,"drawB8"
"4478","433","Axe","","Herts County Museum, St. Albans","austria","austria","47.20003","13.19995900","","None","None","None","189","","53","439","shiny patina dark greeny brown","smooth","6","Site: unspecified location in Austria - geolocation not accurate to 10 kms, , Length: 188.5, , Width: edge 53, , Thickness: blade 5.5; 5, Socket 27.5; 25, , Weight: 439.42 gms","","","","","","Joellen mcGann","http://farm8.staticflickr.com/7140/13306656734_7b09b58f03_b.jpg","http://www.flickr.com/photos/MicroPasts/13306656734","superuser",13.2,47.2,"drawB8"
"4479","433","Axe","","Winchester Museum","south america, bolivia, from the bank of the river san mateo at the upper sources of the river amazon, 3000 miles from the sea","san mateo river, bolivia","-17.01978","-65.36623759","","None","None","None","98","86","55","588","","metal. stained green in places","24","Width: edge 55; butt 86, , Weight: 588.15 gms","","","","","","Joellen mcGann","http://farm4.staticflickr.com/3779/13306295185_960788cf1d_b.jpg","http://www.flickr.com/photos/MicroPasts/13306295185","superuser",-65.3662,-17.0198,"drawB8"
"4480","433","Adze","","Herts County Museum, St. Albans, Ball Collection","central europe","hungary","51.50146","13.48558589","","None","None","None","268","56","73","1106","bronzey matt","smooth","20","Site: Unspecified location in Central Europe - geolocation not accurate to 10 kms, , Width: edge 72.5; edge 45; middle 56, , Thickness: 19.5; 25; 11, , Weight: 1105.64 gms","","","","","","Joellen mcGann","http://farm8.staticflickr.com/7142/13306448803_936469dcb4_b.jpg","http://www.flickr.com/photos/MicroPasts/13306448803","superuser",13.4856,51.5015,"drawB8"
"4481","433","Adze","","Herts County Museum, St. Albans, Ball Collection","central europe","","51.67829","11.65155410","","None","None","None","274","57","54","1006","dark green","rough","16","Site: unspecified location in Central Europe - geolocation not accurate to 10 kms, , Width: edge 54; edge 39.5; middle 56.5, , Thickness: 15.5; 34; 13, , Weight: 1006.42 gms","","","","","","Joellen mcGann","http://farm8.staticflickr.com/7114/13306294765_bb577eda21_b.jpg","http://www.flickr.com/photos/MicroPasts/13306294765","superuser",11.6516,51.6783,"drawB8"
"4481","433","Adze","","Herts County Museum, St. Albans, Ball Collection","central europe","","51.67829","11.65155410","","None","None","None","274","57","54","1006","dark green","rough","16","Site: unspecified location in Central Europe - geolocation not accurate to 10 kms, , Width: edge 54; edge 39.5; middle 56.5, , Thickness: 15.5; 34; 13, , Weight: 1006.42 gms","","","","","","Joellen mcGann","http://farm8.staticflickr.com/7114/13306294765_bb577eda21_b.jpg","http://www.flickr.com/photos/MicroPasts/13306294765","superuser",11.6516,51.6783,"drawB8"
"4482","433","Adze","","Herts County Museum, St. Albans, Ball Collection","central europe","","51.51450","11.56366348","","None","None","None","213","60","33","1077","no patina","rough, dull brown, very ecrusted","31","Site: unspecified location in Central Europe - geolocation not accurate to 10 kms, , Length: 212.5 mm, , Width: middle 60; butt 39; edge 33, , Thickness: middle 30.5; butt 16, , Weight: 1077.3 gms","","","","","","Joellen mcGann","http://farm4.staticflickr.com/3776/13306655824_5a67b03253_b.jpg","http://www.flickr.com/photos/MicroPasts/13306655824","superuser",11.5637,51.5145,"drawB8"
"4483","433","Adze","","Herts County Museum, Ball Collection","central europe","","51.84150","12.35467910","","None","None","None","243","57","42","1219","patches of dark brown - matt","rough","20","Site: unspecified location in Central Europe - geolocation not accurate to 10 kms, , Length: 242.5 mm, , Width: edge 42; middle 56.5; edge 37, , Thickness 20; 26; 16, , Weight: 1219.05 gms","","","","","","Joellen mcGann","http://farm3.staticflickr.com/2882/13306655714_f31e9c3545_b.jpg","http://www.flickr.com/photos/MicroPasts/13306655714","superuser",12.3547,51.8415,"drawB8"
"4484","433","Adze","","Herts County Museum, St. Albans, Ball Collection","central europe","","51.62376","11.56366348","","None","None","None","258","75","66","1446","no patina","rough dark greeny brown","17","Site: unspecified location in Central Europe - geolocation not accurate to 10 kms, , Length: 257.5 mm, , Width: edge 65.5; 40; middle 75, , Thickness: 17; 32; 16, , Weight: 1445.85 gms","","","","","","Joellen mcGann","http://farm4.staticflickr.com/3714/13306294145_06136f80c6_b.jpg","http://www.flickr.com/photos/MicroPasts/13306294145","superuser",11.5637,51.6238,"drawB8"
"4485","433","Axe","","Private Collection, Capt. W.H. Murray, 11.4.24, (at S of A)","china","china","34.83792","103.59367700","","None","None","None","155","70","50","390","some rich polished patina jade green, this appears to have been partly chipped away. Matte at edge.","smooth. dark reddy copper.","4","Site: Unspecified location in China - geolocation not accurate to 10 kms, , Length: 154.5, , Width: edge 50 ; socket 70; middle 45.5, , Thickness: 3.5; 8; 11.5; 12.75; 9.75; 18.5; 23; 35, , Weight: 389.81 gms.","","","Edge blunt and burred. One side of socket is cracked, crushed, and broken.  Decorated with raised lines and dots. Nearly in middle of this specimen is a hole. Sides of this hole are shaped as shown in section.","","","Joellen mcGann","http://farm4.staticflickr.com/3693/13306447663_720b99da3a_b.jpg","http://www.flickr.com/photos/MicroPasts/13306447663","superuser",103.5937,34.8379,"drawB8"
"4486","433","Battle Axe","","Farnham Museum, Dorset","hungary, komarom","komarom, hungary","47.74173","18.12182560","","None","None","None","172","47","27","227","","smooth dark bronze","28","Site: Komarom is in Hungary and not Czechoslovakia, , Width: edge 27; socket 47; butt 40, , Thickness: socket 28; butt 40, , Weight: 226.8","","","","","","Joellen mcGann","http://farm8.staticflickr.com/7095/13306654994_535308e1df_b.jpg","http://www.flickr.com/photos/MicroPasts/13306654994","superuser",18.1218,47.7417,"drawB8"
"4487","433","Holed Axes","","Nationalmuseet, Copenhagen","denmark","denmark","55.67025","10.33332830","","None","None","None","","","","","","","","This card is a list of 14 axes from several areas in Denmark.","","","List overleaf of specimens either plain or with decoration now invisible: Decorated specimens are separately carded., , No.; Weight; Provenance; Remarks, , 11237; 864; Sjaelland/Zealand; plain, badly corroded., , 20552; 1152; unknown; plain, badly corroded., , 26013; 1314; Tarnborg; Slagelse; ornament weathered and unintelligible., , B377; 1326; Brande; Ris; Plain, , B1383; 1443; Jylland; Plain, , B3096 (1); 1538; Bregninge; Skippinge; Plain and rough, dull brass colour., , B3096 (2); 1826;Bregninge; Skippinge; plain and rough, dull brass colour., , B3096 (3); 1995; Bregninge; Skippinge; plain and rough, dull brass colour., , B3096 (4); 1868;Bregninge; Skippinge; plain and rough, dull brass colour., , B3096 (5); 1849.5; Bregninge; Skippinge; plain and rough, dull brass colour., , B4961; 1720.5; Gislinge; Tusse; , , B9612; 1235; Tranebjerg; Samso; Plain, corroded., , B10894; 1287; Bolslunde, Slagelse; Plain, corroded, broken in two., , B11335; 1363; Sovind; Vor; Plain, corroded.","The artist writes as follows: "" The holed axes in the Bronze Age series are included in Period I according to accepted classification.  Sophus Muller, hoever, told me that he has ceased to regard to regard them as so early and would place them in Period II. He stressed the native manufacture, pointing to some of the unique curvilinear motifs.""","","Joellen mcGann","http://farm4.staticflickr.com/3813/13306446913_9f974bcf7d_b.jpg","http://www.flickr.com/photos/MicroPasts/13306446913","superuser",10.3333,55.6703,"drawB8"
"4488","433","Holed Axe","","Nationalmuseet, Copenhagen, No. B 3092","denmark, skippinge, bregninge","bregninge, denmark","54.81386","12.07863008","","None","None","None","203","24","","1725","","","37","Width: butt 23.5, across lower part of hole 46.5; diameter of hole 32 x 34, , Thickness: butt 37 (butt 33); edge 55.5","","","Decoration similar on both faces: only one side decorated. Butt decorated with 3 hatched bands.","","","Joellen mcGann","http://farm4.staticflickr.com/3686/13306446713_b0c736b62f_b.jpg","http://www.flickr.com/photos/MicroPasts/13306446713","superuser",12.0786,54.8139,"drawB8"
"4489","433","Holed Axe","","Nationalmuseet, Copenhagen, No. B3095","denmark, skippinge, bregninge","bregninge, denmark","54.81391","12.07858717","","None","None","None","198","20","","1655","","Pale dull bronze colour.","31","Width: butt 20; near hole 51.5; diameter of hole 34, , Thickness: butt 30,5; 51.5","","","Faintly engraved on both faces and one side, also on butt.","","","Joellen mcGann","http://farm8.staticflickr.com/7141/13306654294_76127e8615_b.jpg","http://www.flickr.com/photos/MicroPasts/13306654294","superuser",12.0786,54.8139,"drawB8"
"4490","433","Holed Axe","","Nationalmuseet, Copenhagen, No. B 3094","denmark","denmark","57.18281","8.01521307","","None","None","None","191","12.5","","1606","pale dull bronze colour","","","Two names appear under site: Bregnivze, S. and Skippinge, W., , Note under length: ""Drawn as 184.5 mm, , Width: butt: 12.5, across hole 41 mm, ,","","","Faint decoration on one side (?face drawn) only; both faces (?sides) once more decoration also heads now too slight for drawing.","","","Joellen mcGann","http://farm8.staticflickr.com/7341/13306446243_e481817884_b.jpg","http://www.flickr.com/photos/MicroPasts/13306446243","superuser",8.0152,57.1828,"drawB8"
"4491","433","Holed Axe","","Nationalmuseet, Copenhagen, No. B3093","denmark, skippinge, bregninge","bregninge, denmark","54.81394","12.07875883","","None","None","None","188","22","","1597","dull pale bronze colour","","36","Width: 22; across hole 40, , Thickness: butt 36; edge 52.5, ,","","","Fairly engraved on both faces on one side, also 3 shaded bars across butt.  Note employment of small arcs placed end to end as a decorative motif.","","","Joellen mcGann","http://farm8.staticflickr.com/7304/13306654364_318d6a8b20_b.jpg","http://www.flickr.com/photos/MicroPasts/13306654364","superuser",12.0788,54.8139,"drawB8"
"4492","433","Holed Axe","","Nationalmuseet, Copenhagen, No. 16892","denmark, sokkelund, sollerod","sollerod, denmark","55.81269","12.50707183","","None","None","None","","","","1684","","","","","","","","Illustrated in Sophus Muller's ""Oldtidens Kunst Bronzealderen,"" p. 2, fig 6.","","Joellen mcGann","http://farm4.staticflickr.com/3692/13306653744_9798d743b2_b.jpg","http://www.flickr.com/photos/MicroPasts/13306653744","superuser",12.5071,55.8127,"drawB8"
"4493","433","Holed Axe","","Nationalmuseet, Copenhagen, No. 26012","denmark, lynge, sigerlevvester","lynge, denmark","55.84408","12.28218958","","None","None","None","206","33","","2147","","","39","Width: butt 33; across bosses 53; diameter of perforation 35, , Thickness: butt 39; edge 58, ,","","","Circular boss on each side at shoulder level with hole.  Design very crudely executed; hatched triangles and pairs of arcs.","","","Joellen mcGann","http://farm8.staticflickr.com/7087/13306653424_c952c5a5b6_b.jpg","http://www.flickr.com/photos/MicroPasts/13306653424","superuser",12.2822,55.8441,"drawB8"
"4494","433","Holed Axe","","Nationalmuseet, Copenhagen, No. 2868","denmark, norvang, ringive","ringive, denmark","55.79552","9.10421566","","None","None","None","176","28","","1710","","","50","Length: 175.5, , Width: butt 27.75; shoulders 44; diameter of hole 28, , Thicknesses: butt 50; edge 61","","","Badly corroded in parts and edge damaged. Unusual decoration crudely executed.","","cf. faceting of British stone mace-heads and outer do.","Joellen mcGann","http://farm3.staticflickr.com/2846/13306653174_c0416339d5_b.jpg","http://www.flickr.com/photos/MicroPasts/13306653174","superuser",9.1042,55.7955,"drawB8"
"4495","433","Holed Axe","","Nationalmuseet, Copenhagen, No. B4938","denmark, hjerm, sir","sir, denmark","56.40412","8.58836686","","None","None","None","214","17","","1495","","","30","Width: butt 17; across hole 46.5; diameter of hole 35, , Thickness: butt 29.5; edge 53","","","Decoration faintly visible in patches on one face and one side: reverse badly decayed: one side plain. Damaged near hole and almost cracked through.","","","Joellen mcGann","http://farm8.staticflickr.com/7088/13306445023_93a3621af3_b.jpg","http://www.flickr.com/photos/MicroPasts/13306445023","superuser",8.5884,56.4041,"drawB8"
"4496","433","Holed Axe","","Nationalmuseet, Copenhagen, No. B 7548","denmark","denmark","57.14706","7.87239080","","None","None","None","191","18","","150","","","40","Under site two names appear: Malt, H. and Fuvling, S., , Width: butt 18; shoulder 42, , Thickness: butt 40; edge 62.5, , Weight: 149.5 gr, ,","","","Diameter of note 26 mm., , , , Decoration original and crude in execution; ruined by decay of surface.","","","Joellen mcGann","http://farm4.staticflickr.com/3805/13306444933_dded88cbab_b.jpg","http://www.flickr.com/photos/MicroPasts/13306444933","superuser",7.8724,57.1471,"drawB8"
"4497","433","Holed Axe","","Nationalmuseet, Copenhagen, No. 6606","denmark, holbo, soborg","soborg, denmark","55.73574","12.51539593","","None","None","None","189","22","","1450","","","","Width: butt 22; shoulder 45","","","No decoration visible on reverse or on sides.","","","Joellen mcGann","http://farm3.staticflickr.com/2889/13306444493_814e2e5f14_b.jpg","http://www.flickr.com/photos/MicroPasts/13306444493","superuser",12.5154,55.7357,"drawB8"
"4498","433","Holed Axe","","Nationalmuseet, Copenhagen, No 18154","denmark, jerslev, egtved","egtved, denmark","55.61822","9.31227379","","None","None","None","205","16","","1846","","decayed, especially near cutting edge; deep scars on one side.","45","Width: butt 16; shoulder 40; diameter of hole 28 x 29 , , Thickness: butt 44.5; edge 55","","","Decoration crude and irregular.  Butt engraved with 3 shaded bars, central hatched triangles forming lozenges between.","","","Joellen mcGann","http://farm4.staticflickr.com/3809/13306291095_e373b08da8_b.jpg","http://www.flickr.com/photos/MicroPasts/13306291095","superuser",9.3123,55.6182,"drawB8"
"4499","433","Axe","","Private Collection, 1923, H.S. Cowper Collection","egypt, cairo, bought 1905","cairo, egypt","30.04882","31.24366630","","None","None","None","223","78","40","142","dark rough patina","","4","Width: middle 78; blade 40, , Thickness: blade 4; 6, , Weight: 142.33 gms","","","","","","Joellen mcGann","http://farm3.staticflickr.com/2854/13306290835_51e27e1952_b.jpg","http://www.flickr.com/photos/MicroPasts/13306290835","superuser",31.2437,30.0488,"drawB8"
"4500","433","Axe","","Private Collection, Prof. Sayce, 1921","egypt, hammamat, (vi dynasty)","wadi hammamat, egypt","25.96866","33.54686624","","None","None","None","194","23","62","","","","","Width: edge 62; butt 23","copper, no tin, traces of antimony","","","","","Joellen mcGann","http://farm8.staticflickr.com/7386/13306444373_510b3f27f9_b.jpg","http://www.flickr.com/photos/MicroPasts/13306444373","superuser",33.5469,25.9687,"drawB8"
"4501","433","Axe","","Private Collection, Prof. Sayce, 1921","egypt, hammamat","wadi hammamat, egypt","25.96866","33.54686624","","None","None","None","201","24","59","","","","","Width: edge 59; butt 24","Copper, no tin, trace of antimony","","","","","Joellen mcGann","http://farm8.staticflickr.com/7365/13306443653_cfb1f46d6c_b.jpg","http://www.flickr.com/photos/MicroPasts/13306443653","superuser",33.5469,25.9687,"drawB8"
"4502","433","Axe","","Private Collection, W.S. Cowper Collection, bought 1903","egypt, luxor","luxor, egypt","25.70210","32.64718590","","None","None","None","92","37","60","156","scoured off","","3","Width: edge 60; middle 37; butt 48, , Thickness: 3; 6, , Weight: 156.18","","","","","","Joellen mcGann","http://farm4.staticflickr.com/3785/13306289995_18b3fc6b95_b.jpg","http://www.flickr.com/photos/MicroPasts/13306289995","superuser",32.6472,25.7021,"drawB8"
"4503","433","Axe","","Private Collection, Prof. Sayce.","egypt, naqadah, from an early tomb","naqada, egypt","25.90324","32.72456342","","None","None","None","138","122","","","","","","","copper","","","","","Joellen mcGann","http://farm4.staticflickr.com/3738/13306650984_a28ef9067a_b.jpg","http://www.flickr.com/photos/MicroPasts/13306650984","superuser",32.7246,25.9032,"drawB8"
"4504","433","Axe","","Private Collection, Prof. Sayce","egypt, naqada, from an early tomb","naqada, egypt","25.90556","32.72319013","","None","None","None","118","105","","","","","","","Copper","","","","","Joellen mcGann","http://farm3.staticflickr.com/2871/13306650784_74eecd54ab_b.jpg","http://www.flickr.com/photos/MicroPasts/13306650784","superuser",32.7232,25.9056,"drawB8"
"4505","433","Axe","","Private Collection, H.S. Cowper Collection","egypt, assiut, bought 1903","assiut egypt","27.18564","31.18575481","","None","None","None","101","96","","255","rough green","","5","Width: middle 96, back 107, , Thickness 5, 3, , Weight: 255.21 gms","","","","","","Joellen mcGann","http://farm8.staticflickr.com/7441/13306651014_689ac0d5c5_b.jpg","http://www.flickr.com/photos/MicroPasts/13306651014","superuser",31.1858,27.1856,"drawB8"
"4506","433","Axe","","Private collection, Prof. Sayce","egypt, naqada, from an early tomb","naqada, egypt","25.90556","32.72353346","","None","None","None","146","151","","","","","","","copper","","","","","Joellen mcGann","http://farm8.staticflickr.com/7007/13306289605_6fdb862eba_b.jpg","http://www.flickr.com/photos/MicroPasts/13306289605","superuser",32.7235,25.9056,"drawB8"
"4507","433","Axe","","Private Collection, Prof. Sayce","egypt, naqada, from an early tomb","naqada, egypt","25.90386","32.72542173","","None","None","None","169","151","","","","","","","copper","","","","","Joellen mcGann","http://farm4.staticflickr.com/3816/13306288905_13dcf29b1d_b.jpg","http://www.flickr.com/photos/MicroPasts/13306288905","superuser",32.7254,25.9039,"drawB8"
"4508","433","Axe","","","egypt, naqada, from an early tomb","naqada, egypt","25.90000","32.71666700","","None","None","None","192","171","","","","","","","Copper","","","","","Joellen mcGann","http://farm4.staticflickr.com/3720/13306649934_80383db4bc_b.jpg","http://www.flickr.com/photos/MicroPasts/13306649934","superuser",32.7167,25.9,"drawB8"
"4509","433","Axe","","University College of Wales Museum, Aberystroyth, Hilton Prices Collection, Given by J.B. Willams, Dolpforgan","egypt, samined","egypt","26.25405","29.26754690","","None","None","None","","","","","","","","Site: Could not locate Samined in Egypt.  Geolocation not accurate to 10 kms.","","","","","","Joellen mcGann","http://farm8.staticflickr.com/7094/13306288395_fd9e52f7e6_b.jpg","http://www.flickr.com/photos/MicroPasts/13306288395","superuser",29.2675,26.254,"drawB8"
"4510","433","Scrapes","","Private Collection, D. Sams Esq. Late of Luxor, Egypt, Sothebys 23.v.21, Lot 45","egypt, thebes (waset in current-day luxor)","luxor, egypt","25.69158","32.64031944","","None","None","None","39","","37","6","light green dull patina with a thin encrustment of soil","slightly rough","1","Length: 38.5 mm, , Width: edge 37, , Thickness: 1 mm (an even thickness all over), , Weight: nearly 6.2 gms","","15 chisels and 3 scrapers found wrapped together in a tomb at Thebes.","","","one of 3 - all of similar size and shape","Joellen mcGann","http://farm4.staticflickr.com/3704/13306649474_d939344ac4_b.jpg","http://www.flickr.com/photos/MicroPasts/13306649474","superuser",32.6403,25.6916,"drawB8"
"4511","433","Axe","","Sotheby's Sale 14.12.25, Lot 285, property of Mans. Fenardent","egypt, beni hasan","beni hasan, egypt","27.90404","30.85533794","","None","None","1904","112","21","34","","mottled green","rough. slightly encrusted (flatly), some soil encrusted","4","Width: edge 34; butt 21, , Thickness: 4; 5","","","Edge bevelled this side only. Made of flat metal.","","Label: Beni Hasan 1904; BC 2300","Joellen mcGann","http://farm8.staticflickr.com/7113/13306649144_7b06636f92_b.jpg","http://www.flickr.com/photos/MicroPasts/13306649144","superuser",30.8553,27.904,"drawB8"
