"taskID","userID","objectType","rightCorner","collection","site","toSearch","Lon","Lat","gridRef","dateDiscoveryDay","dateDiscoveryMonth","dateDiscoveryYear","length","width","edge","weight","patina","surface","thickness","other","composition","associations","description","publications","remarks","inputBy","imageURL","flickrURL","Processing","project"
"12311","64","Socketed Axe","UII2","British Museum, WG 2141,Given by J. Pierpoint-Morgan Esq, 1909.,Greenwell Collection.","England,HUMBERSIDE, (Yorks),Sproatley,1852","Sproatley, Hull, East Riding of Yorkshire HU11, UK","-0.1916","53.7944","","None","None","1852","86.5","37","","201","Metallic green","","35","","","Hoard of 9 socketed axes","With rounded rib below lip of socket; loop","","Inacc,C1","Hugh Fiske","https://farm6.staticflickr.com/5570/15148074905_a8c8bc9689_b.jpg","https://www.flickr.com/photos/MicroPasts/15148074905","superuser","DrawerA16"
"12312","64","Socketed Axe","UII2","British Museum, WG 2142,Given by J. Pierpoint-Morgan Esq, 1909.,Greenwell Collection.","England,HUMBERSIDE, (Yorks),Sproatley,1852","Sproatley, Hull, East Riding of Yorkshire HU11, UK","-0.1916","53.7944","TA 19 34","None","None","None","83","49","","187","metallic green","","38","","","Hoard of 9 socketed axes","Striated faces","","Inacc,C1","Hugh Fiske","https://farm6.staticflickr.com/5595/15148074695_4431aaa93c_b.jpg","https://www.flickr.com/photos/MicroPasts/15148074695","superuser","DrawerA16"
"12313","64","Socketed Axe","UIII2","British Museum, WG 2143,Given by J. Pierpoint-Morgan Esq, 1909.,Greenwell Collection.","England,HUMBERSIDE, (Yorks),Sproatley,1852","Sproatley, Hull, East Riding of Yorkshire HU11, UK","-0.1916","53.7944","TA 19 34","None","None","1852","85.5","43","","155","metallic brown & green","","37.5","","","Hoard of 9 socketed axes","edge chipped at angle","","Inacc,C1","Hugh Fiske","https://farm6.staticflickr.com/5592/15147678872_fa816909f1_b.jpg","https://www.flickr.com/photos/MicroPasts/15147678872","superuser","DrawerA16"
"12314","64","Socketed Axe","MI2",", , British Museum, WG 2144,Given by J. Pierpoint-Morgan Esq, 1909.,Greenwell Collection.","England,HUMBERSIDE, (Yorks),Sproatley,1852","Sproatley, Hull, East Riding of Yorkshire HU11, UK","-0.1916","53.7944","","None","None","1852","102","50","","222","brown & green","","41","","","Hoard of 9 socketed axes.","Three parallel ribs on faces.","","Inacc,C1","Hugh Fiske","https://farm4.staticflickr.com/3918/14961515378_66763c303c_b.jpg","https://www.flickr.com/photos/MicroPasts/14961515378","superuser","DrawerA16"
"12315","64","SOCKETED AXE,frag.","H?2","B.M. 93.4-26.81","Kent,Thanet Minster,Ebbsfleet","25 Galley Hill Road, Northfleet, Gravesend, Kent DA11 9BH, UK","0.3157","51.4501","TR 30 64","None","None","None","","","","","","","","","","","","","See new index,C1","Hugh Fiske","https://farm6.staticflickr.com/5582/14961556520_03f7493806_b.jpg","https://www.flickr.com/photos/MicroPasts/14961556520","superuser","DrawerA16"
"12316","727","SOCKETED AXE looped broken","-","British Museum, 93  4-26  82, Presented by A. W. Franks, 26/4/93","KENT (isle of Thanet), Minster,, Ebbsfleet, 1893","Kent, UK","0.5217","51.2787","TR, 30, 64","None","None","None","64","41","-","-","-","-","-","Lower Left, in a different hand: ""ND 75”  C1","-","Founder's hoard, 93  4-26  9-151","-","Proc. Soc. Ant. 2nd ser. XIV. 309, XV. 138, VCH Kent, I, 322, R.F. Jessup, ‘Kent’, 110","-","MARLA WALCOTT","https://farm4.staticflickr.com/3925/14961556100_f5214c2542_b.jpg","https://www.flickr.com/photos/MicroPasts/14961556100","most detailed record","DrawerA16"
"12317","727","Socketed Celt  Frag.","H-2","British Museum, 93  4.26. 82, Presented by A.W. Franks Esq., 26/4/1893","England, Isle of Thanet, Minster (Ebbs Fleet 1893), Founder's hoard","","0.5217","51.2787","TR, 30, 64","None","None","None","-","-","-","150","brownish green","corroded","3.9","Publications: VCH Kent, I, 322"" and """"R.F. Jessup, ‘Kent’, 110.259"" in another hand.  C1","-","9-151","Two crescent ribs.","VCH Kent, I, 322, Proc. Soc. Ant. 2' S vol XIV p.309, XV. 138, L XV. 138, R.F. Jessup, ‘Kent’, 110.259","Hoard consisting of 1 palstave, 2 wigned celts, 13 socketed celts, 3 spear-heads, fragment of sickle, triangular knife, socketed knife, socketed hammer, fragment of implement, flanged ring, 3 pieces of […], and 2 jets","MARLA WALCOTT","https://farm6.staticflickr.com/5580/15148214425_29d9cae3a1_b.jpg","https://www.flickr.com/photos/MicroPasts/15148214425","most detailed record","DrawerA16"
"12318","727","SOCKETED AXE, frag.","H?2","British Museum, 93.  4-26.  82","KENT, Thanet, Minster,, Ebbsfleet,","Kent, UK","0.5217","51.2787","TR, 30, 64","None","None","None","-","-","-","-","-","-","-","Lower Left, in a different hand: ""See new index”  C1","-","-","-","-","-","MARLA WALCOTT","https://farm4.staticflickr.com/3858/14961555930_16d73b8d4e_b.jpg","https://www.flickr.com/photos/MicroPasts/14961555930","most detailed record","DrawerA16"
"12319","727","SOCKETED AXE frag.","-","LONDON, British Museum, 93  4.26. 83, Presented by A.W. Franks Esq., 26/4/1893","KENT (Isle of Thanet), Minster,, Ebbsfleet, 1893","Kent","0.5217","51.2787","TR, 30, 64","None","None","None","74","-","-","-","-","","-","Lower Left, in a different hand: ""ND 75”  C1","","Founder's hoard, 93 4-26 9-151","","Proc. Soc. Ant. 2nd ser. XIV. 309, XV. 138, VCH Kent, I, 322, R.F. Jessup, ‘Kent’, 110","-","MARLA WALCOTT","https://farm4.staticflickr.com/3913/14961654898_150c71b498_b.jpg","https://www.flickr.com/photos/MicroPasts/14961654898","most detailed record","DrawerA16"
"12320","727","Socketed Axe","UII2","British Museum, W.G. 2132, Given by J. Pierpont Morgan Esq., 1909., Greenwell Collection","HUMBERSIDE,, West Hatton, 1852","","0.5217","51.2787","SE, 90, 20","None","None","None","86","39","-","174","gren + brown","-","38","Lower Left, in a different hand: ""Inacc. drawing”","-","Part of a hoard of 18 socketed axes, scrap metal + casting jet.","hole in lip of socket","Arch. Journ. X, 19","-","MARLA WALCOTT","https://farm4.staticflickr.com/3889/15147816822_68078fb2ac_b.jpg","https://www.flickr.com/photos/MicroPasts/15147816822","most detailed record","DrawerA16"
"12321","727","Socketed Axe","MII3","British Museum, W.G. 2133, Given by J. Pierpont Morgan Esq., 1909, Greenwell Collection","HUMBERSIDE,, West Hatton","","0.5217","51.2787","SE, 90, 20","None","None","None","91","48","-","165","green + brown","-","45","Lower Left, in a different hand: ""Not acc.”  C1","-","Part of a hoard of 18 socketed axes, scrap metal + casting jet.","Three thick parallel ribs., Hole near lip of socket.","Arch. Jour. X, 69.","-","MARLA WALCOTT","https://farm4.staticflickr.com/3854/15147817142_7d449b2928_b.jpg","https://www.flickr.com/photos/MicroPasts/15147817142","most detailed record","DrawerA16"
"12322","730","Socketed Axe","K II 2","British Museum, w.9.2134, Given by J. Pierpont Morgan, Esq. 1909., Greenwell Collection","HUMBERSIDE,, Halton West, 1852","",,,"SE 90, 20","None","None","1852","76","49","","193","brown","","43","lower left corner has ""luacc."", , lower right corner has ""C1"" or ""CI""","oblong section; single rib on each face; loop.","Part of a hoard of 18 socketed axes, scrap metal & casting jet.","","Arch. Journ. X, 69.","","Janet Levy","https://farm6.staticflickr.com/5586/15147816432_28ee7f30fa_b.jpg","https://www.flickr.com/photos/MicroPasts/15147816432","most detailed record","DrawerA16"
"12323","730","2 Socketed Axe Fragments","frags., 2 M-2","British Museum, W. 9. 2135 and 2137, Given by J. Pierpont Morgan, Esq. 1909., Greenwell Collection.","HUMBERSIDE , West Halton, 1852.","",,,"SE 90, 20","None","None","1852","2135 71 mm, (2137) 44 mm","2135 36 mm, (2137) 33 mm","","132 gms, 51 gms","brown","","39 mm","Lower left corner: ""luacc."", , Lower right corner: ""C1"" or ""CI""","Square section; edge missing.","Part of a hoard of 18 socketed axes, scrap metal & casting jet.","","","","Janet Levy","https://farm6.staticflickr.com/5578/14961555040_50f4bfaff3_b.jpg","https://www.flickr.com/photos/MicroPasts/14961555040","most detailed record","DrawerA16"
"12324","730","Socketed Axe","M I 2","BM. W. G. 2135","England, Linc., West Halton","",,,"","None","None","None","","","","","","","","Information above was all that this card contained. The measurements and so forth were blank. There was no drawing either.","","","","","","Janet Levy","https://farm6.staticflickr.com/5560/15125196936_2e24790622_b.jpg","https://www.flickr.com/photos/MicroPasts/15125196936","most detailed record","DrawerA16"
"12325","730","Socketed Axe. Fragment.","Frag., BI","British Museum. W. G. 2136., Given by J. Pierpont Morgan Esq. 1909, Greenwell Coll.","HUMBERSIDE, West Halton, 1852.","",,,"SE 90, 20","None","None","1852","53","47","","83","","","","Lower left corner: ""Not acc."", , Lower right corner: ""C1"" or ""CI""","","Part of a hoard of 18 sock. Axes, scrap metal & casting jet.","","","","Janet Levy","https://farm4.staticflickr.com/3922/15148212755_b456dab4bb_b.jpg","https://www.flickr.com/photos/MicroPasts/15148212755","most detailed record","DrawerA16"
"12326","730","Socketed Celt.","III frag., U-Frag","British Museum WG 2137 [...]","HUMBERSIDE, West Halton","",,,"SE 90, 20","None","None","None","53","28","","40","Green & brown mixed.","irregular","25 overall","Lower left corner: A OK, , Lower right corner: ""CI"" or ""C1""","","Hoard.","Small fragt. only, cutting edge & [...], being broken, with a large trianglular fracture, extending up one side of the blade., Small oval hole on one edge near cutting, edge, which shows signs of having been corroded.","","","Janet Levy","https://farm6.staticflickr.com/5584/15145229021_1ac876f093_b.jpg","https://www.flickr.com/photos/MicroPasts/15145229021","most detailed record","DrawerA16"
"12327","64","Jet","","British Museum, WG 2138,Given by J. Pierpoint Morgan Esq, 1909,Greenwell Collection.","HUMBERSIDE,,West Halton,1852","West Halton, Scunthorpe, North Lincolnshire DN15, UK","-0.6327","53.6783","SE 90 20","None","None","None","","","","65","brown","","","","","Part of a hoard of 18 socketed axes, scrap metal & casting jet.","forked into 2 round bars","Arch. Journ. X, 69.","Inacc. drawing,C1","Hugh Fiske","https://farm4.staticflickr.com/3877/15145229121_9652723500_b.jpg","https://www.flickr.com/photos/MicroPasts/15145229121","superuser","DrawerA16"
"12328","64","Copper Cake Frag.","1.","British Museum, WG 2139,Given by J. Pierpoint Morgan Esq, 1909,Greenwell Collection.","HUMBERSIDE,,West Halton,1852","West Halton, Scunthorpe, North Lincolnshire DN15, UK","-0.6327","53.6783","SE 90 20","None","None","None","57","","","53","green","encrusted","","Length 2 1/4""","","Part of a hoard of 18 socketed axes, scrap metal & casting jet.","oval cake, fairly flat","Arch. Journ. X, 69.","C1","Hugh Fiske","https://farm4.staticflickr.com/3922/14961653438_e8530ee212_b.jpg","https://www.flickr.com/photos/MicroPasts/14961653438","superuser","DrawerA16"
"12329","64","Knife Tanged,Straight-edged,(2 cards)","C","British Museum,Greenwell Colln.,WG 1720,Given by J. Pierpoint Morgan 1909","England,KENT,,Swanscombe,,Broadness Marsh","Swanscombe, Swanscombe, Kent DA10, UK","0.3054","51.4454","TQ 60 74","None","None","None","121","blade 20,tang 15","","25.67","","","blade 3","","","Broadness Hoard, 7 spearheads, knife & ferrule","","Proc. Soc. Ant. XXIII 160,R.F. Jessup 'Kent' 110.263","AOK,C1","Hugh Fiske","https://farm6.staticflickr.com/5556/15145228661_dab1eb269b_b.jpg","https://www.flickr.com/photos/MicroPasts/15145228661","superuser","DrawerA16"
"12330","64","Tanged Knife,Straight edged,(2 cards)","C","British Museum WG 1720","England Thames,Kent,Greenhithe & Northfleet (between),off Broadness,R. Thames, dredged","Swanscombe, Swanscombe, Kent DA10, UK","0.3054","51.4454","","None","None","None","120","blade 19,tang 15","","25.26","dull green","rough","blade 2.5","","","From a hoard, also Nos WG 1712 to 1721,(8 spearheads + a ferrule)","Short raised rib on tang","Proc. S.A. 2nd ser. XXIII 160,R.F. Jessup 'Kent' 110.263","C1","Hugh Fiske","https://farm6.staticflickr.com/5582/15145228391_4ae3635b5b_b.jpg","https://www.flickr.com/photos/MicroPasts/15145228391","superuser","DrawerA16"
"12331","580","Spearhead VI","M/L","British Museum, WG. 1712","Kent, Swanscombe, Broadness Marsh, R. Thames dredged","Swanscombe, Swanscombe, Kent DA10, Royaume-Uni","0.3054","51.4454","TQ 60 74","None","None","None","261","blade 64, socket 24","","379.63","dull brownish green. bronze on socket + slight patina.","","blade 14, socket 24","","","From ahoard. also Nos WG. 1712 to 1721. (7 other spearheads. ferrule + knife)","2 crescent shaped openings in blade. Long rivet through socket.","Proc. Soc. Ant. XXIII. 160., R.F. Jessup 'Kent' 110. 263 - No 13 Pl. V.","A OK, Internal section, section above perforations","Denis Antoine","https://farm6.staticflickr.com/5591/15125195596_6d17ae5926_b.jpg","https://www.flickr.com/photos/MicroPasts/15125195596","superuser","DrawerA16"
"12332","580","Spearhead VI","M","British Museum, Greenwell Collection, WG. 1713. 62., Given by T. Pierpont Morgan 1909.","Kent, Swanscombe, Broadness Marsh, Northfleet Hole, Erith, R. Thames","Swanscombe","0.3054","51.4454","TQ 60 74","None","None","None","142","blade 66, socket 23","","171.56","slight green","dirty brown encrustation","blade 16, socket 23","","","Broadness Hoard. 7 spearheads. knife + ferrule.","","Proc. Soc. Ant. XXIII 160., R.F. Jessup 'Kent' 110. 263.","Rather inacc.","Denis Antoine","https://farm4.staticflickr.com/3892/15145227771_572000d02a_b.jpg","https://www.flickr.com/photos/MicroPasts/15145227771","superuser","DrawerA16"
"12333","580","Spearhead VI ? frag.","X","British Museum, Greenwell Collection WG. 1714 63., Given by T. Pierpont Morgan 1909.","Kent, Swanscombe, Broadness Marsh, Northfleet Hole, Erith, R. Thames.","Swanscombe, Swanscombe, Kent DA10, Royaume-Uni","0.3054","51.4454","TQ 60 74","None","None","None","145","51","","60.6","remains of rich green patina","","9","","","Broadness Hoard. 7 spearheads. knife + ferrule.","edges damaged.","Proc. Soc. Ant. XXII 160, R.F. Jessup 'Kent' 110. 263","A OK, Internal section","Denis Antoine","https://farm4.staticflickr.com/3846/14961553540_e9eebae66f_b.jpg","https://www.flickr.com/photos/MicroPasts/14961553540","superuser","DrawerA16"
"12334","580","Spearhead V","T, Internal section","British Museum WG. 1716","Kent, Swanscombe, Broadness Marsh, Greenhithe + Northfleet (between), R. Thames (dredged)","Swanscombe, Swanscombe, Kent DA10, Royaume-Uni","0.3054","51.4454","TQ 60 74","None","None","None","184","blade 45, socket 23","","160.67","no patina","dull bronze . whitish encrustation on part of blade + socket face.","blade 13, socket 21.5","","","from a hoard. also Nos 1712 to 1721. (7 other spearheads. ferrule + knife)","Fragments of wood adhere inside socket rim. 2 rivet holes. left one nearly filled.","Proc. Soc. Ant. XXIII. 160, R. F. Jessup 'Kent'. 110. 263","A OK","Denis Antoine","https://farm6.staticflickr.com/5573/14961553220_f20a8521dc_b.jpg","https://www.flickr.com/photos/MicroPasts/14961553220","superuser","DrawerA16"
"12335","580","Spearhead V","T","British Museum. WG 1716. 57., Given by T. Pierpont Morgan 1909, Greenwell Collection.","Kent, Swanscombe, Broadness Marsh, Northfleet Hole, R. Thames","Swanscombe, Swanscombe, Kent DA10, Royaume-Uni","0.3054","51.4454","TQ 60 74","None","None","None","185","blade 45, socket 23","","153.3","faint","encrusted","blade 15, socket 22","","","Broadness hoard. 7 spearheads. knife + ferrule.","2 rivet holes.","Proc. Soc. Ant. XXIII. 160, R. F. Jessup 'Kent'. 110. 263","","Denis Antoine","https://farm6.staticflickr.com/5557/14961553030_7ed571cd34_b.jpg","https://www.flickr.com/photos/MicroPasts/14961553030","superuser","DrawerA16"
"12336","580","Spearhead V","T","British Museum. WG 1717. 58., Given by T. Pierpont Morgan 1909, Greenwell Collection.","Kent, Swanscombe, Broadness Marsh, Broadness, R. Thames, Northfleet Hole. Erith. dredged","Swanscombe, Swanscombe, Kent DA10, Royaume-Uni","0.3054","51.4454","TQ 60 74","None","None","None","167","blade 39, socket 26","","114.22","","","blade 14, socket 26","","","Broadness Hoard. 7 spearheads. knife + ferrule.","Punched design on socket.","Proc. Soc. Ant. XXIII. p. 169 fig. 5, R. F. Jessup 'Kent'. 110. 263","Inacc.","Denis Antoine","https://farm4.staticflickr.com/3867/14961645347_8721e77f95_b.jpg","https://www.flickr.com/photos/MicroPasts/14961645347","superuser","DrawerA16"
"12337","580","Spearhead V","L, Internal section, 2m section above","British Museum WG. 1718.","Kent, Swanscombe, Broadness Marsh, Greenhithe + Northfleet, R. Thames. dredged","Swanscombe, Swanscombe, Kent DA10, Royaume-Uni","0.3054","51.4454","TQ 60 74","None","None","None","158","53 blade","","138.4","very slight patina. dull greenish brown.","","15 blade","","","One of a hoard. also Nos 1712 to 1721. (7 other spearheads. ferrule + knife)","Small hole in surface of rib. Broken off at base of wings. 2 crescent shaped openings in blade.","Proc. Soc. Ant. XXIII. 160, R. F. Jessup 'Kent'. 110. 263.","","Denis Antoine","https://farm6.staticflickr.com/5596/15148210615_3e66671c5e_b.jpg","https://www.flickr.com/photos/MicroPasts/15148210615","superuser","DrawerA16"
"12338","580","Spearhead V","L","British Museum. WG 1718. 59., Given by T. Pierpont Morgan 1909, Greenwell Collection.","Kent, Swanscombe, Broadness Marsh, Northfleet Hole, Erith, R. Thames","Swanscombe, Swanscombe, Kent DA10, Royaume-Uni","0.3054","51.4454","TQ 60 74","None","None","None","161","blade 54. 38., socket 15","","127.36","slight","","blade 11, socket 16","","","Broadness Hoard. 7 spearheads. Knife + ferrule.","","Proc. Soc. Ant. XXIII. 160, R. F. Jessup 'Kent'. 110. 263","Inacc. ;] internal section, Section across perforations","Denis Antoine","https://farm4.staticflickr.com/3871/15145227301_873f1e45e4_b.jpg","https://www.flickr.com/photos/MicroPasts/15145227301","superuser","DrawerA16"
"12339","580","Ferrule","IVB","British Museum. WG 1721. 54., Given by T. Pierpont Morgan 1909, Greenwell Collection.","Kent, Swanscombe, below Limehouse, Broadness, Northfleet Hole, Erith, R. Thames. dredged","Swanscombe, Swanscombe, Kent DA10, Royaume-Uni","0.3054","51.4454","TQ 60 74","None","None","None","243","socket 16, end 12","","102.85","very little patina other than this.","black.","end 12","","","Broadness Hoard. 7 spearheads. Knife + ferrule.","","Proc. Soc. Ant. XXIII. 160, R. F. Jessup 'Kent'. 110. 263","","Denis Antoine","https://farm4.staticflickr.com/3888/15125194446_0e3da073a8_b.jpg","https://www.flickr.com/photos/MicroPasts/15125194446","superuser","DrawerA16"
"12340","580","Ferrule","IVB","British Museum WG. 1721.","Kent, Swanscombe, Below Limehouse, Broadness, Greenhithe + Northfleet (between), off Broadness, R. Thames. dredged.","Swanscombe, Swanscombe, Kent DA10, Royaume-Uni","0.3054","51.4454","TQ 60 74","None","None","None","243","15.5, 15","","107.56","very dark brown. slight green.","upper part of surface is rough.","15.5, 14","","","From a hoard. also Nos WG 1712 to 1720. (8 spearheads. + a knife)","2 rivet holes.","Proc. Soc. Ant. XXIII. 160, R. F. Jessup 'Kent'. 110. 263","A OK (section)","Denis Antoine","https://farm6.staticflickr.com/5560/15147812672_21dd3dd499_b.jpg","https://www.flickr.com/photos/MicroPasts/15147812672","superuser","DrawerA16"
"12341","580","Spearhead fragment","H L","B. M. 1913. 5-17.1","R. Thames, Kent, Swanscombe, Broadness Marsh","Swanscombe, Swanscombe, Kent DA10, Royaume-Uni","0.3054","51.4454","TQ 60 74","None","None","None","","","","","","","","","","","","","","Denis Antoine","https://farm4.staticflickr.com/3905/15148209145_b8dd6daf69_b.jpg","https://www.flickr.com/photos/MicroPasts/15148209145","superuser","DrawerA16"
"12342","580","Sword Blade fragment","","London, British Museum, 1903. 7-23. 7","Kent, Cliffe (Hoo)","Cliffe, Rochester, Medway ME3, Royaume-Uni","0.4975","51.4621","TQ 73 76","None","None","None","79","33","","","light green patina with dark patches","smooth","","","","Hoard of 8 objets","","","KW","Denis Antoine","https://farm4.staticflickr.com/3890/15145225571_66c6ca6f25_b.jpg","https://www.flickr.com/photos/MicroPasts/15145225571","superuser","DrawerA16"
"12343","580","Socketed Gouge","","London, British Museum, 1903. 7-23. 8","Kent, Cliffe (Hoo)","Cliffe, Rochester, Medway ME3, Royaume-Uni","0.4975","51.4621","","None","None","None","77","16","","","","pale green corrosion","","","","Hoard of 8 objects","","","KW","Denis Antoine","https://farm4.staticflickr.com/3842/15148209045_76b83fd2c2_b.jpg","https://www.flickr.com/photos/MicroPasts/15148209045","superuser","DrawerA16"
"12344","580","Spearhead","","London, British Museum, 1903. 7-23.9","Kent, Cliffe (Hoo)","Cliffe, Rochester, Medway ME3, Royaume-Uni","0.4975","51.4621","","None","None","None","118","25","","","","original surface shiny yellowish-brown; where this is worn away, pale green corrosion","","","","Hoard of 8 objects","","","KW","Denis Antoine","https://farm4.staticflickr.com/3908/15148208995_a70300257c_b.jpg","https://www.flickr.com/photos/MicroPasts/15148208995","superuser","DrawerA16"
"12345","580","Spearhead","","London, British Museum, 1903. 7-23. 9","Kent, Cliffe (Hoo)","Cliffe, Rochester, Medway ME3, Royaume-Uni","0.4975","51.4621","TQ 73 76","None","None","None","","","","","","","","","","","","","See new index","Denis Antoine","https://farm4.staticflickr.com/3899/15148208935_dc5a852aa1_b.jpg","https://www.flickr.com/photos/MicroPasts/15148208935","superuser","DrawerA16"
"12346","580","Socketed Axe","UI2","B. M. 93. 4-26. 43","Kent, Thanet, Minster, Ebbsfleet","Thanet, Kent, Royaume-Uni","1.3485","51.3603","TR 30 64","None","None","None","","","","","","","","","","","","","See new index","Denis Antoine","https://farm4.staticflickr.com/3910/14961499259_035e3e7cb7_b.jpg","https://www.flickr.com/photos/MicroPasts/14961499259","superuser","DrawerA16"
"12347","580","Socketed Axe looped","","London, British Museum, 93. 4-26. 43, presented by A.W. Franks, 26/4/93","Kent, (Isle of Thanet), Minster, Ebbsfleet, 1893","Thanet, Kent, Royaume-Uni","1.3485","51.3603","TR 30 64","None","None","1893","","53 (blade)","","","","","","","","founder's hoard, 93. 4-26. 9-151","","Proc. Soc. Ant. 2nd ser., XIV, 309, XV, 138, VCH Kent. I, 322, R.F. Jessup. 'Kent', 110","No 75","Denis Antoine","https://farm6.staticflickr.com/5558/15148208685_be25611059_b.jpg","https://www.flickr.com/photos/MicroPasts/15148208685","superuser","DrawerA16"
"12348","580","Socketed Celt","UII2","British Museum., 93. 4-26. 44, Presented by A.W. Franks Esq., 1893","England, Kent, Isle of Thanet, Minster, Ebbs Fleet","Thanet, Kent, Royaume-Uni","1.3485","51.3603","TR 30 64","None","None","None","110","40","","337","green","corroded","43","","","9-151, 34 fragments of swords, 32 socketed celts, 39 fragments of celts, 3 palstaves, 7 fragments of palstaves, 3 spearheads, 5 fragments of spearheads, 3 tubes, 1 fragment of sickle, 1 socketed knife, 1 socketed hammer, 1 triangular knife, 1 disk, 1 fragment of implement, 1 fragment of knife,  2 fragments of blades, 2 plates, 5 jets","","V.C.H. Kent I. 322. 325, Proc. S.A. 2d 5 vol XIV p. 309, XV 138, R.F. Jessup 'Kent' 110. 259","Inacc., See new index","Denis Antoine","https://farm4.staticflickr.com/3878/14961643157_4fa67bae82_b.jpg","https://www.flickr.com/photos/MicroPasts/14961643157","superuser","DrawerA16"
"12349","580","Socketed Axe looped","","London, British Museum, 93. 4-26. 44, presented by A.W. Franks, 26/4/93","Kent, (Isle of Thanet), Minster, Ebbsfleet, 1893","Thanet, Kent, Royaume-Uni","1.3485","51.3603","TR 30 64","None","None","1893","109","54 (blade)","","","","","","","","founder's hoard, 93. 4-26. 9-151","","Proc. Soc. Ant. 2nd ser., XIV, 309, XV, 138, VCH Kent. I, 322, R.F. Jessup. 'Kent', 110","","Denis Antoine","https://farm4.staticflickr.com/3887/15148208605_f19754f682_b.jpg","https://www.flickr.com/photos/MicroPasts/15148208605","superuser","DrawerA16"
"12350","580","Socketed Celt","UI2","London, British Museum, 93. 4-26. 45, presented by A.W. Franks Esq., 1893","England, Kent, Isle of Thanet, Minster, Ebbsfleet","Thanet, Kent, Royaume-Uni","1.3485","51.3603","TR 30 64","None","None","None","100","42","","270","green","very corroded","43","","","9-151, 34 fragments of swords, 32 socketed celts, 39 fragments of celts, 3 palstaves, 7 fragments of palstaves, 3 spearheads, 5 fragments of spearheads, 3 tubes, 1 fragment of sickle, 1 socketed knife, 1 socketed hammer, 1 triangular knife, 1 disk, 1 fragment of implement, 1 fragment of knife,  2 fragments of blades, 2 plates, 5 jets","","V.C.H. Kent I. 322. 325, Proc. S.A. 2nd 5 vol XIV p. 309, XV 138, R.F. Jessup 'Kent' 110. 259","Inacc., See new index","Denis Antoine","https://farm4.staticflickr.com/3908/15145225011_d13e0e21e6_b.jpg","https://www.flickr.com/photos/MicroPasts/15145225011","superuser","DrawerA16"
"12351","580","Socketed Axe looped","","London, British Museum, 93. 4-26. 45, presented by A.W. Franks, 26/4/93","Kent, (Isle of Thanet), Minster, Ebbsfleet, 1893","Thanet, Kent, Royaume-Uni","1.3485","51.3603","TR 30 64","None","None","None","100","53","","","","","","","","founder's hoard, 93. 4-26. 9-151","","Proc. Soc. Ant. 2nd ser., XIV, 309, XV, 138, VCH Kent. I, 322, R.F. Jessup. 'Kent', 110","ND 75","Denis Antoine","https://farm6.staticflickr.com/5572/15148208045_d6e61c8d6f_b.jpg","https://www.flickr.com/photos/MicroPasts/15148208045","superuser","DrawerA16"
"12352","580","Socketed Axe","UI2","B. M. 93. 4-26. 46","Kent, Thanet, Minster, Ebbsfleet","Thanet, Kent, Royaume-Uni","1.3485","51.3603","TR 30 64","None","None","None","","","","","","","","","","","","","See new index","Denis Antoine","https://farm6.staticflickr.com/5584/15145224531_ae6c56ddd9_b.jpg","https://www.flickr.com/photos/MicroPasts/15145224531","superuser","DrawerA16"
