"taskID","userID","objectType","rightCorner","collection","site","toSearch","Lon","Lat","gridRef","dateDiscoveryDay","dateDiscoveryMonth","dateDiscoveryYear","length","width","edge","weight","patina","surface","thickness","other","composition","associations","description","publications","remarks","inputBy","imageURL","flickrURL","Processing","project"
"3998","433","Palstave Fragment","","Hancock, Frederick - private (1979(,'Annada Coins', The Arches, Charing Cross","england,kent,faversham,brenley corner","faversham, kent","0.9215","51.2985","c. TR 01 61","None","None","None","45","20","","90","","Dull brown to pale green dry surface - little rough","9","","","8. Single Find","Dimensions: EL 44.5mm; min W. 20.2mm; Bst. (max) 24mm; T sep end 8.5mm; Wt 90.25 gms,Typology: rounded rep. angles, near rect. sep. end; long pendant triangular hollows - deep with approx. 'V' section; waisting to bl. just below st.; broad rounded st. top.,Manufacture: variable stump of cg. flash; two hollows in one side prob. cg. flaws.,Condition: haft break sl. irreg. sur. and anc.; bl. break also anc. but fairly smooth - poss. not snapped/broken; v. small scratch at either break revealing v. silvery metal colour,Attached Material: pockets of pale fawn soil - plus little chalky? material","a) Mime-Walker - pers. comm.","Circumstances: Apparently recovered using a metal detector, c. 3 years earlier, by F. Hancock himself. From a 'Roman Villa site', not buried under a view road at Brenley Corner (a); a bierra bar (DF) submitted at the same time from the site, was said not to be in direct association; a 'handful' of other material was mentioned, presumably from the same site;,Archive: PIF,PRBAF: DF (S), SI,Ext. CI,rec. SN, July 79,Source Sb. A,Sub. Inf. P. Mime-Walker 7/3/79","Joellen mcGann","http://farm8.staticflickr.com/7227/13305720034_48ac9f335c_b.jpg","http://www.flickr.com/photos/MicroPasts/13305720034","superuser","drawB16"
"3999","433","Palstave","II1S","Wisbeck Museum","england,kent,folkestone?,(actually site unknown)","folkestone, kent","1.1664","51.0887","","None","None","None","155","25","53","312","Patches of shiny green.","Slightly pitted. Dark greeny brown.","29","Width: edge 53mm; middle 25mm; butt 20mm,Thickness: 29mm; 9mm; 31mm,Weight: 311.85 gms","","","","","","Joellen mcGann","http://farm8.staticflickr.com/7252/13305719734_42289752c2_b.jpg","http://www.flickr.com/photos/MicroPasts/13305719734","superuser","drawB16"
"4000","433","Palstave","III1A","Herts Cty. Mus. St. Albans,Ball Collection","england,kent,canterbury","canterbury, kent","1.0719","51.2968","","None","None","None","103","25","37","","Dark green matt","Smooth, slightly pocked","23","Width: edge 37mm; middle 24.5mm; butt 20mm,Thickness: 23mm; 14mm; 6mm; 14.5mm","","","","","","Joellen mcGann","http://farm3.staticflickr.com/2843/13305719484_05f80c7e66_b.jpg","http://www.flickr.com/photos/MicroPasts/13305719484","superuser","drawB16"
"4001","433","Palstave Looped","IV3A","Herts. Cty. Mus., St. Albans,Ball Collection","england,kent,canterbury","canterbury, kent","1.0719","51.2968","","None","None","None","164","30","36","439","No patina","Rough encrusted green","28","Width: edge 35.5mm; middle 29.5mm; butt 24mm,Thickness: 28mm; 17mm; 9.5mm,Weight: 439.42 gms","","","","","","Joellen mcGann","http://farm4.staticflickr.com/3725/13305719224_fda95684f7_b.jpg","http://www.flickr.com/photos/MicroPasts/13305719224","superuser","drawB16"
"4002","433","Palstave Looped","IV3C","Herts. Cty. Mus., St. Albans,Ball Collection","england,kent,canterbury","canterbury, kent","1.0719","51.2968","","None","None","None","179","28","47","567","No patina","Rough - green","12","Length: 178.5mm,Width: edge 47mm; middle 27.5mm; butt 21mm,Thickness: 12mm; 20mm; 13mm; 26mm; 11mm; 39mm,Weight: 566.99 gms","","","","","","Joellen mcGann","http://farm4.staticflickr.com/3810/13305505073_41e50e429c_b.jpg","http://www.flickr.com/photos/MicroPasts/13305505073","superuser","drawB16"
"4003","433","Palstave","II1F","Herts. Cty. Mus., St. Albans,Ball Collection","england,kent,canterbury","canterbury, kent","1.0719","51.2968","","None","None","None","168","24","65","454","No patina.","Rough, green, encrusted.","35","Width: edge 64.5mm; middle 24mm; butt 20mm,Thickness: 34.5mm; 27mm; 7mm; 29mm,Weight: 453.6 gms","","","","","","Joellen mcGann","http://farm3.staticflickr.com/2891/13305718724_feec74393f_b.jpg","http://www.flickr.com/photos/MicroPasts/13305718724","superuser","drawB16"
"4004","433","Palstave","II1F","Herts. Cty. Mus., St. Albans,Ball Collection","england,kent,canterbury","canterbury, kent","1.0719","51.2968","","None","None","None","172","25","69","454","Patches of patina green (dark)","Rough, very encrusted - green","22","Width: edge 68.5mm; middle 25mm; butt 19.5mm,Thickness: 22mm; 23mm; 22.5mm; 7.5mm,Weight: 453.6 gms","","","","","","Joellen mcGann","http://farm8.staticflickr.com/7326/13305718584_7fa70f0926_b.jpg","http://www.flickr.com/photos/MicroPasts/13305718584","superuser","drawB16"
"4005","433","Palstave","II1A","Maidstone Museum,Donor Bernard Arudd Esq. (from the collection of the late G.M. Arnold, FSA)","england,kent,canterbury (near)","canterbury, kent","1.0719","51.2968","","None","None","None","151","21","48","340","Some emerald green patina.","Very rough. Heavily pitted and encrusted.","25","Width; edge 48mm; butt 21mm,Thickness: 25mm; 9mm,Weight: 340.19 gms","","","","","","Joellen mcGann","http://farm4.staticflickr.com/3741/13305355295_c517f72ec1_b.jpg","http://www.flickr.com/photos/MicroPasts/13305355295","superuser","drawB16"
"4006","433","Palstave","II1A","Maidstone Museum","england,kent,canterbury,in the neighborhood of","canterbury, kent","1.0719","51.2968","","None","None","None","165","24","68","425","Dull green patina.","Smooth. Dark bronze and green colour.","25","Width: edge 68mm; centre 24mm; butt 18mm,Thickness: 25mm; 9.5mm,Weight: 425.25 gms","","","","","","Joellen mcGann","http://farm8.staticflickr.com/7200/13305718104_75a0035b41_b.jpg","http://www.flickr.com/photos/MicroPasts/13305718104","superuser","drawB16"
"4007","433","Looped Palstave","IV3D","Maidstone Museum,Purchased, 1931","england,kent,chatham,walderslade,robin hood lane","robin hood lane, chatham","0.5265","51.3385","","None","None","None","149","","38","397","Dark green/olive green; mottled.","Chipped.","27","Length: 5 7/8"" = 149.225 mm,Width: Maximum across blade - 1 1/2"" = 38.1mm,Thickness: Maximum 1 1/16"" = 26.9875mm,Weight: 14 oz = 396.893 gms","","","Central and side ribs, on both faces of blade. Small casting hole (?) in centre of implement.","Recorded in Arch. Cant., XLVI, p. 195","","Joellen mcGann","http://farm3.staticflickr.com/2846/13305504113_220e08c4a0_b.jpg","http://www.flickr.com/photos/MicroPasts/13305504113","superuser","drawB16"
"4008","433","Bronze Palstave","I1A","British Museum, 71.10-2.5","england,kent,chatham,dockyard","dockyard, chatham","0.5247","51.3922","TQ 75 67","None","None","None","146","25","63","476","Brown","Slightly pitted.","23","Width: butt 25mm; blade 63mm","Bronze","","Slight side and stop ridges. Edges of blade broken. Marks of casting. Slight shoulder on each side.","R.F. Jessup, 'Kent', 99, 253, Pl V no. 10,Evans, B. Imps. 74,V.C.H. Kent I 335","From the excavation for the extension of the Chatham Dockyard. Presented by the Lords Commissioners of the Admiralty.,AOK,CI","Joellen mcGann","http://farm4.staticflickr.com/3796/13305354545_fc8a4bc2a3_b.jpg","http://www.flickr.com/photos/MicroPasts/13305354545","superuser","drawB16"
"4009","433","Bronze Palstave","II1D","British Museum, WG 1857","england,kent,chislet,(or canterbury)","chislet, kent","1.1916","51.3343","TR 22 64","None","None","None","170","22","66","459","Green.","Corroded on blade.","26","Width: butt 22mm; blade 66mm","Bronze","","Strong side and stop ridges. Central rib below stop ridges. End of butt slightly flat. Broad blade.","R.F. Jessup, 'Kent' 254","AOK","Joellen mcGann","http://farm4.staticflickr.com/3762/13305354335_347d682678_b.jpg","http://www.flickr.com/photos/MicroPasts/13305354335","superuser","drawB16"
"4010","433","Palstave","II1J","Private Collection,Mr. Frederick Wright,West Court Farm,15.VII.23,Now in Rochester Museum, Kent","england,kent,cliffe,100 yards west of west court farm, in a large chalk pit.","cliffe, kent","0.4937","51.4581","","None","None","None","176","24","66","","","","8","Width: edge 66mm; middle 24mm; butt 20mm,Thickness: 8mm; 28mm","","","","","","Joellen mcGann","http://farm3.staticflickr.com/2866/13305354145_b19313171d_b.jpg","http://www.flickr.com/photos/MicroPasts/13305354145","superuser","drawB16"
"4011","433","Palstave","I1A","Private Collection,W.M. Newton, Esq., Dartford, Kent.,4.8.20","england,kent,ebbsfleet","ebbsfleet, kent","0.3195","51.4416","","None","None","None","117","25","52","305","Traces of dark brown patina in sockets. Otherwise no patina.","Smooth dark bronze colour and a good deal of golden bronze showing. Small pitting all over.","28","Width: edge 52mm; butt 25mm,Thickness: 28mm; 8mm,Weight: 304.76 gms","","","","","","Joellen mcGann","http://farm8.staticflickr.com/7396/13305717034_e3b89293a7_b.jpg","http://www.flickr.com/photos/MicroPasts/13305717034","superuser","drawB16"
"4012","433","Palstave Looped","IV1C","Herts County Museum, St. Albans,lent by Capt. J. H. Ball, RAF,49","england,kent,faversham","faversham, kent","0.8912","51.3144","","None","None","None","149","31","41","411","Some patina of pale green","Rough and encrusted a good deal.","25","Length: 148.5mm,Width: edge 41mm; middle 31mm; butt 21.5mm,Thickness: 25mm; 7mm,Weight: 411.05 gms","","","Loop is solid, probably from encrustment. Rib below stop is less distinct on other side.","","","Joellen mcGann","http://farm4.staticflickr.com/3822/13305502883_abe03646ae_b.jpg","http://www.flickr.com/photos/MicroPasts/13305502883","superuser","drawB16"
"4013","433","Palstave Unlooped","","London, British Museum,55.5-10.3","england,kent,goudhurst","goudhurst, kent","0.4639","51.1134","","None","None","None","166","64","","","","","","","","Hoard of ?6 palstaves, 3 remaining.","","Jessup, 'Kent', 99, 256,Arch. J. XII, 193","ND74","Joellen mcGann","http://farm3.staticflickr.com/2884/13305502533_cdb2bd7e91_b.jpg","http://www.flickr.com/photos/MicroPasts/13305502533","superuser","drawB16"
"4014","433","Palstave Unlooped","","London, British Museum,55.3-10.2","england,kent,goudhurst","goudhurst, kent","0.4639","51.1134","","None","None","None","153","77","","","","","","","","Hoard of ?6 palstaves, 3 remaining.","","Jessup, 'Kent', 99, 256,Arch. J. XII, 193","","Joellen mcGann","http://farm4.staticflickr.com/3743/13305716284_2eb4a20df2_b.jpg","http://www.flickr.com/photos/MicroPasts/13305716284","superuser","drawB16"
"4015","433","Palstave Unlooped","","London, British Museum,55.3-10.1","england,kent,goudhurst","goudhurst, kent","0.4639","51.1134","","None","None","None","155","68","","","","","","","","Hoard of ?6 palstaves, three remaining.","","Jessup, 'Kent', 99, 256,Arch. J. XII, 193","Found while deepening ditch, arranged in two rows.","Joellen mcGann","http://farm3.staticflickr.com/2867/13305352975_d47daa0584_b.jpg","http://www.flickr.com/photos/MicroPasts/13305352975","superuser","drawB16"
"4016","433","Bronze Palstave","I1D","British Museum,55.3-10.2","england,kent,goudhurst","goudhurst, kent","0.4639","51.1134","","None","None","None","156","26","77","508","Green","Pitted.","33","Width: butt 26mm; blade 77mm","Bronze","5 other, 3 recorded in all. Presented by Stringer, Stringer Esq., Gouldhurst.","Strong side and stop ridges. End of butt and edge of blade slightly broken. Central rib below stop ridges.","R.F. Jessup, 'Kent', 99, 256, Pl. V, no. 15,Arch. Journ. XII, 193","Found with five others of dimilar shape while deepening ditch, arranged in two continuous piles, 4 in each. The thin edge of one celt resting on the butt end of another.,AOK,CI","Joellen mcGann","http://farm4.staticflickr.com/3677/13305716294_6df79f73e1_b.jpg","http://www.flickr.com/photos/MicroPasts/13305716294","superuser","drawB16"
"4017","433","Bronze Palstave","I1K","British Museum,55.3-10.1","england,kent,goudhurst,49","goudhurst, kent","0.4639","51.1134","","None","None","None","159","23","70","402","Green","Slightly rough and corroded.","26","Width: butt 23mm; blade 70mm","Bronze","5 others, 3 only recorded in all.","Slight side and stop ridges. End of butt broken. Trident rib on each face below stop ridges.","R.F. Jessup, 'Kent"", 99, 256.,Arch. Journ. XII, 193","Presented by Stringer, Stringer Esq. Found with 5 others: see note on 55.3-10.2,Inacc.,CI","Joellen mcGann","http://farm8.staticflickr.com/7391/13305715534_7c9d0d5bf1_b.jpg","http://www.flickr.com/photos/MicroPasts/13305715534","superuser","drawB16"
"4018","433","Bronze Palstave","II1U","British Museum,55.3-10.3","england,kent,goudhurst","goudhurst, kent","0.4639","51.1134","TQ 72 37","None","None","None","167","19","66","403","Green","Slightly pitted and corroded.","26","Width: butt 19mm; blade 66mm","Bronze","5 others, 3 recorded in all.","Slight side and stop ridges. Slight indentation below stop ridge. Break across centre of blade.","R.F. Jessup, 'Kent', 99, 256,Arch. Journ. XII, 193","Presented by Stringer, Stringer.,See note on 55.3-10.2,CI","Joellen mcGann","http://farm4.staticflickr.com/3805/13305352185_6377c18c5b_b.jpg","http://www.flickr.com/photos/MicroPasts/13305352185","superuser","drawB16"
"4019","433","Palstave","II1A","Vize Collection,original no. 3045,(Sotheby's No. 40/3),The property of Mr. Maycock,15 Spencer Rd, Putney,1915","england,kent,lewisham,bed of ravensbourne,february 1907","lewisham, kent","-0.0045","51.4146","","None","2","1907","171","26","65","443","Very little patina, olive, dark green.","Smooth. Where patina is broken away, a greyish brown colour shows.","9","Width: edge 65mm; middle 26mm; butt 17.5mm,Thickness: 8.75mm,Weight: 442.96 gms","","","","","","Joellen mcGann","http://farm3.staticflickr.com/2807/13305714924_1749c453d7_b.jpg","http://www.flickr.com/photos/MicroPasts/13305714924","superuser","drawB16"
"4020","433","Palstave","II1P","Maidstone Museum,given by S. J. Bartlett, Esq.","england,kent,maidstone,found in a wood near the bell inn now (1935) known as the 'blue door' on the sutton road, maidstone.","sutton road, maidstone, kent","0.5424","51.2502","","None","None","None","143","23","55","248","Shiny olive green patina","One side much scratched by finder.","20","Width: edge 55mm; centre 22.5mm; butt 20mm,Thickness: 20mm; 8.5mm,Weight: 248.06 gms","","","","","","Joellen mcGann","http://farm4.staticflickr.com/3698/13305714614_69500467f2_b.jpg","http://www.flickr.com/photos/MicroPasts/13305714614","superuser","drawB16"
"4021","433","Palstave","I1F","Maidstone Museum","england,kent,maidstone,off fant lane,found in dredging away a shelf in bed of r. medway (? an old ford).","fant lane, maidstone, kent","0.5005","51.2627","","None","None","None","166","25","74","425","Dark brown patina, chemically removed in places, exposing golden colour of metal on edges.","Has a rippled effect, excentuated by cleaning off of patina, especially on blade.","25","Width: edge 74mm; at ridge 24.5mm; butt 18mm,Weight: 15 oz. = 425.243 gms","","","","R.F. Jessup, 'Kent', 258","","Joellen mcGann","http://farm4.staticflickr.com/3732/13305714334_3902f1b1c2_b.jpg","http://www.flickr.com/photos/MicroPasts/13305714334","superuser","drawB16"
"4022","433","Palstave Frag. Looped","","London, British Museum, 93.4-26.120,Presented by A. W. Franks,26/4/93","england,kent,(isle of thanet),minster,ebbsfleet,1893","minster, kent","0.8027","51.4239","","None","None","1893","87","","","","","","","","","Founder's hoard, 93.4-26.9-151","","Proc. Sock Ant. 2nd Ser. XIV, 309, XV 138,V.C.H. Kent, I 322,R.F. Jessup, 'Kent', 110","ND 76","Joellen mcGann","http://farm3.staticflickr.com/2822/13305350895_bc5ca6e13d_b.jpg","http://www.flickr.com/photos/MicroPasts/13305350895","superuser","drawB16"
"4023","433","Palstave","II1J","Maidstone Museum, 1929,From G. Payne's Collection, without history","england?,kent, north? (almost certainly),probably from murston?","murston,  kent","0.7522","51.3381","","None","None","None","192","","70","","Soft green patina, typical of bronzes from Murston District of North Kent (N.G. Cook).","Still has traces of brick earth deposit from which is was dug.","30","Thickness: at stop ridge 30mm","","","Cutting edge thick and rounded at the corners.. Midrib on faces well marked.","","","Joellen mcGann","http://farm8.staticflickr.com/7321/13305350555_a4fa138c0a_b.jpg","http://www.flickr.com/photos/MicroPasts/13305350555","superuser","drawB16"
"4024","433","Palstave","II1K","Maidstone Museum,Given by H. Dunning, 1930,Ex. G. Payne's Collection","england,north kent,sittingbourne?","sittingbourne, kent","0.7342","51.3397","","None","None","None","197","67","","595","Olive green/light brown","Very rough","32","Length: 7 3/4"" = 196.85mm,Width: Maximum 2 5/8"" = 66.675mm,Thickness: Maximum 1 1/4"" = 31.75mm,Weight: 21 oz = 595.34 gms","","","Central and side ribs on both faces of blade: 2 small depressions between the three ribs, at top end.","References to Sittingbourne hoard in Evans, Jessup, etc.","E.P.","Joellen mcGann","http://farm3.staticflickr.com/2809/13305713164_0aa311f144_b.jpg","http://www.flickr.com/photos/MicroPasts/13305713164","superuser","drawB16"
"4025","433","Palstave","I1F","Maidstone Museum,given by Mr. G. Smeed.","england,kent,murston, near sittingbourne,1864","murston, kent","0.7522","51.3381","","None","None","1864","135","26","60","361","Only a little light green patina extending about 12mm from edge on each side.","Very rough and heavily encrusted.","29","Width: edge 60mm; centre 26mm; butt 22mm,Thickness: 29mm; 9mm,Weight: 361.45 gms","","","","R.F. Jessup, 'Kent', 259","","Joellen mcGann","http://farm4.staticflickr.com/3795/13305713434_37d1b3ab4e_b.jpg","http://www.flickr.com/photos/MicroPasts/13305713434","superuser","drawB16"
"4026","433","Palstave","","Redlands Ltd. - private (no.1),Bradbourne Vale Road pit, Sevenoaks, Kent","england,kent,otford,bradbourne vale,road pit,""found in redland's gravel pit""","bradbourne vale, otford, kent","0.1872","51.2869","c. TQ 523 (5254?) 572 (5773?)","None","None","None","150","","74","","","Bright gold; scattered pocks of green colour - stripped?","","","","7a Area Find","","a) Gawod 197, no. 2","Archive: PIF, AFI,PRBAF: DF (S), SI,Ext: CI,Rec. SN Oct. 78,Source: Sb. A.,Sub. Inf. Dr. J.G. Harrison, Marryward, St. Rodolph's Road Nov. 76","Joellen mcGann","http://farm4.staticflickr.com/3699/13305499583_8bf1f2cd46_b.jpg","http://www.flickr.com/photos/MicroPasts/13305499583","superuser","drawB16"
"4027","433","Palstave","","Redlands Ltd. - private (no. 2),Bradbourne Vale Road Pit, Sevenoakes, Kent","england,kent,otford,bradbourne vale road,pit","bradbourne vale, otford, kent","0.1872","51.2869","c. TQ 523 (5254?) 572 (5772?)","None","None","None","164","","48","","","Dull gold surface","","","","7a. Area Find","","a) Garrod 197, no. 1","Archive: PIF, AFI,PRBAF: DF (S), SI,Ext. CI,Rec. SN Oct. 78,Source: Sb. A.,Sub. Inf: Dr. J.G. Harrison, Merrywood, St. Rodolph's Rd. C. Nov. 76","Joellen mcGann","http://farm8.staticflickr.com/7029/13305712444_56328916ac_b.jpg","http://www.flickr.com/photos/MicroPasts/13305712444","superuser","drawB16"
"4028","433","Palstave Looped","IV1A","Maidstone Museum","england,kent,peckham near maidstone,probably east peckham; picked up on the roadside about 1912)","east peckham, kent","0.3866","51.2131","","None","None","1912","141","28","45","425","None of the original patina remains, except at the bottom of the pock-markings which cover the whole surface.","Has been rubbed (rough golden bronze)","30","Width: edge 45mm; butt 28mm,Thickness: 30mm; 11.5mm,Weight: 425.25 gms","","","","R.F. Jessup, 'Kent', 260","","Joellen mcGann","http://farm4.staticflickr.com/3706/13305499193_2929e02639_b.jpg","http://www.flickr.com/photos/MicroPasts/13305499193","superuser","drawB16"
"4029","433","Palstave","","Canterbury Museum, 462","england,kent,petham","petham, kent","1.0459","51.2228","","None","None","None","162","66","","","","Patina removed; poor casting; badly corroded; butt broken","","","","","","","MJR","Joellen mcGann","http://farm8.staticflickr.com/7454/13305498883_f9c916a82b_b.jpg","http://www.flickr.com/photos/MicroPasts/13305498883","superuser","drawB16"
"4030","433","Palstave Looped","I1H","Rochester Museum,Donor Stewart Esq.,Bloors Place, Rainham","england,kent,rainham (chatham)","rainham, kent","0.6015","51.3643","","None","None","None","126","21","47","","","Smooth. Dark bronze colour. Golden bronze visible. Very slight encrustment.","34","Width: blade 47mm; butt 21mm,Thickness: 34mm; 10mm","","","","R.F. Jessup, 'Kent' 260","","Joellen mcGann","http://farm3.staticflickr.com/2874/13305348345_35c025eece_b.jpg","http://www.flickr.com/photos/MicroPasts/13305348345","superuser","drawB16"
"4031","433","Palstave","II1F","Ashmolean Museum, Oxford,Evans Collection,1927.2586","england,kent,reculver, near,1884","reculver, kent","1.1978","51.3787","","None","None","1884","163","23","63","335","Black-green patina, rather glossy.","","9","Width; edge 63mm; centre 23mm; butt 19mm,Thickness: centre 9mm; 24mm","","","V-shaped depression below stop-ridge. Patina entirely flaked off one face of blade, partially off edge of other face and off one side except butt.","R.F. Jessup, 'Kent', 261","","Joellen mcGann","http://farm8.staticflickr.com/7020/13305711084_45c76cf9d6_b.jpg","http://www.flickr.com/photos/MicroPasts/13305711084","superuser","drawB16"
"4032","433","Palstave","II1F","Liverpool Museum,6951M,formerly in the Rolfe Collection","england,kent,richborough district (probably)","richborough, kent","1.332","51.2924","","None","None","None","170","24","67","","Bright green patina","","28","Width: edge 66.5mm; middle 24mm; butt 22mm","","","","","","Joellen mcGann","http://farm3.staticflickr.com/2859/13305347945_dcd263cb69_b.jpg","http://www.flickr.com/photos/MicroPasts/13305347945","superuser","drawB16"
"4033","433","Palstave","I1F","Liverpool Museum, 6952M,formerly Rolfe Collection","england,kent,richborough","richborough, kent","1.332","51.2924","","None","None","None","162","27","63","432","Bright green patina.","Mostly covered with encrustrations. Parts retain original smooth finish.","28","Width: edge 63mm; middle 27mm; butt 21.5mm,Thickness: 27.5mm,Weight: 432.33 gms","","","","","","Joellen mcGann","http://farm8.staticflickr.com/7081/13305348065_d47b5251c6_b.jpg","http://www.flickr.com/photos/MicroPasts/13305348065","superuser","drawB16"
"4034","433","Palstave (blade)","II1A","Liverpool Museum,6954M,Rolfe Collection, Richborough Dist.","england,kent,richborough (near)","richborough, kent","1.332","51.2924","","None","None","None","110","28","68","354","Green patina","","23","Width: edge 68mm; middle 28mm,Weight: 354.37 gms","","","In poor condition.","","","Joellen mcGann","http://farm4.staticflickr.com/3715/13305710384_6421e7d4ef_b.jpg","http://www.flickr.com/photos/MicroPasts/13305710384","superuser","drawB16"
"4035","433","Palstave","II1A","Liverpool Museum,6974M,formerly in Rolfe Collection","england,kent,richborough","richborough, kent","1.332","51.2924","","None","None","None","168","24","65","468","Green patina.","Incrusted.","27","Width: edge 65mm; middle 23.5mm; butt 24mm,Weight: 467.77 gms","","","In very bad condition. Weathered off in flakes and flanges broken except one. Edge broken off. Septum has round hollowed surfaces.","","","Joellen mcGann","http://farm8.staticflickr.com/7406/13305347845_d5b35233a7_b.jpg","http://www.flickr.com/photos/MicroPasts/13305347845","superuser","drawB16"
"4036","433","Palstave (blade)","II1A","Liverpool Museum,6978M,formerly Rolfe Collection","england,kent,richborough?","richborough, kent","1.332","51.2924","","None","None","None","105","24","61","276","","Highly corroded and encrusted.","27","Width: edge 61mm; middle (where broken) 24mm,Weight: 276.41 gms","","","Broken off at middle, only the blade remaining. Edge is irregular.","","","Joellen mcGann","http://farm4.staticflickr.com/3815/13305497283_12ba395986_b.jpg","http://www.flickr.com/photos/MicroPasts/13305497283","superuser","drawB16"
"4037","433","Palstave","II1F","Liverpool Museum,7050M,formerly in Rolfe Collection","england,kent,from richborough district (probably)","richborough, kent","1.332","51.2924","","None","None","None","160","30","49","397","Bright green patina.","Several portions - completely corroded.","30","Width: edge 49mm; middle 30mm; butt 17mm,Weight: 396.88 gms","","","Very poor condition.","","","Joellen mcGann","http://farm8.staticflickr.com/7118/13305346945_011ab3f1ac_b.jpg","http://www.flickr.com/photos/MicroPasts/13305346945","superuser","drawB16"
"4038","433","Palstave","I1F","Liverpool Museum,7051M,Rolfe Collection","england,kent,richborough (near)?","richborough, kent","1.332","51.2924","","None","None","None","170","17","48","418","Light green patina.","Corroded and specimen much broken. Encrusted.","9","Width; edge 48mm; butt 17mm,Thickness: 9mm; 24mm,Weight: 418.14 gms","","","V-shaped depression below stop.","","","Joellen mcGann","http://farm3.staticflickr.com/2825/13305346735_4875afbe0c_b.jpg","http://www.flickr.com/photos/MicroPasts/13305346735","superuser","drawB16"
