"taskID","userID","objectType","rightCorner","collection","site","toSearch","Lat","Lon","gridRef","dateDiscoveryDay","dateDiscoveryMonth","dateDiscoveryYear","length","width","edge","weight","patina","surface","thickness","other","composition","associations","description","publications","remarks","inputBy","imageURL","flickrURL","Processing","lon","lat","project"
"4256","433","Battle Axe","","Private collection, Lord Howard de Walden, 1923, Belgrave Square SW","albania, ioannina 1819","albania","41.00003","19.99996190","","None","None","1819","180","40","73","907","dark blackish green, with golden bronze showing","smooth","27","Site - Ioannina is a city in modern Greece - although Janina was a subregion of the Ottoman Empire that encompassed most of Albania., , Width: edges 72.71; centre 40, , Thickness: 26.5 middle, , Weight: 907.2 gms","","","","","Labelled: Bipennis, or double headed Macedonian Battle Axe, discovered near Ioannina in Albania in 1819. The only known specimen.","Joellen mcGann","http://farm4.staticflickr.com/3723/13306383743_9867ef6027_b.jpg","http://www.flickr.com/photos/MicroPasts/13306383743","superuser",20,41,"drawB8"
"4257","433","Flanged Celt","","Herts County Museum, St. Albans, lent by Capt. J.H. Ball, RAF","austria?, huthanger, kirchahorn","","48.40618","14.37616347","","None","None","None","144","24","28","227","dark green. polished","smooth. clay adheres to septum","8","Site: names under site do not appear to be geographic locations, , Width: edge 28; middle 24; butt 23.5, , Thickness: 7.5; 23.5, , Weight: 226.8 gms","","","","","","Joellen mcGann","http://farm3.staticflickr.com/2889/13306592564_711e132f4a_b.jpg","http://www.flickr.com/photos/MicroPasts/13306592564","superuser",14.3762,48.4062,"drawB8"
"4258","433","Flanged Celt","","Herts County Museum, St. Albans, leant by Capt. J.H. Ball, RAF","austria","austria","47.20003","13.19995900","","None","None","None","103","15","28","128","no patina","pocket and rather rough, dark bronze colour. The pits are rust colour and a good deal of mud covers the surface.","16","Site: unspecified location in Austria - geolocation not accurate to 10 kms, , Width: edge 28; middle 15; butt 24, , Thickness: 15.5; 8, , Weight: 127.56 gms","","","Faceted side","","","Joellen mcGann","http://farm3.staticflickr.com/2852/13306592384_fe309559a3_b.jpg","http://www.flickr.com/photos/MicroPasts/13306592384","superuser",13.2,47.2,"drawB8"
"4259","433","Flanged Celt","","London School of Economics, Houghton Street WL2","bohemia, chaco","","50.85342","14.37616348","","None","None","None","133","26","52","197","covered with patina this is light green in the rough holes, remains of patina very dark brown and thick with green beneath. The thick patina is nearly all chipped off.","very rough","15","Site: Cannot locate Chaco, , Width: edge: 52; middle 25.5; butt 23, , Thickness 15; 8.5; 16; 6, ,","","","A very [dt?] stop. Both sides a good deal filed. Surface very rough, but covered with patina this is light green in the rough holes. remains of patina very dark brown and thick with green beneath. The thick patina is nearly all chipped off.","","","Joellen mcGann","http://farm4.staticflickr.com/3723/13306231545_5acb22ee9b_b.jpg","http://www.flickr.com/photos/MicroPasts/13306231545","superuser",14.3762,50.8534,"drawB8"
"4260","433","Flanged Axes","","Nationalmuseet, Copenhagen","denmark","","56.37038","9.63006972","","None","None","None","","","","","","Decoration is a factor independent of form.","","This is a list of 22 flanged axes studied at the national museum in Copenhagen.  There is additional information about the 22 items available in the ""Description"" box.","All the Flanged Axes in the museum so far analysed have proved to be of COPPER, quite free of tin.","","List of 22 Flanged Axes, 2 main types are represented in the summary lists:, Cf. MLXX(c) Carded full size, Cf. MLXX (b), For keeled flanges see B5155, For bevelled flanges, see B8688., See overleaf, Rounded butt,, Concave sides,, Expanded edge, Linear or ripple decoration frequent., , No., Weight, Hundred (County); Parish; Form; Remarks, , B300; 459; Sjaelland; Horbelev; Ripple lines, , 16201; 521; Falslev; Torkildstrup; flanges flat, , 3151; 386; Maribo A.; [...]; flanges bevelled do slightly, , 7328; 510.5; Provenance unknown; butt damaged, , 8127; 325; Provenance unknown; do., , 9523; 436; Provenance unknown; plain, , B4487; 623; Provenance unknown; plain., , B4481; 708; Provenance unknown; plain, , B9389; 110.5; Provenance unknown; plain; corroded, , B7838; 215; Provenance unknown; plain, , B9818; 432.5; Borglum; Bronderslev; Plain, corroded, , B3370; 268; Ramso; Ejby; Plain, badly corroded, , B7838; 214; Provenance unknown; Plain, , B465; 475; Provenance unknown; flanges very slight, , ?; 605; Provenance unknown; with lines badly corroded, butt damaged, , 26066; 493; Provenance unknown; Butt almost square, , ?; 364; Provenance unknown; Butt almost square, , 26059; 401.5; Provenance unknown; Butt rounded, , B4486; 709; Provenance unknown; Deep flanges, line decoration, , ?; 365; Provenance unknown; do., , 26051; 403; Jylland; Lyngby; Flanges shallower., , ?; 617; Frederiksborg; Brandtant; flanges deep, , , ,","","","Joellen mcGann","http://farm4.staticflickr.com/3717/13306231375_0677755444_b.jpg","http://www.flickr.com/photos/MicroPasts/13306231375","superuser",9.6301,56.3704,"drawB8"
"4261","433","Flanged Axes","","Nationalmuseet, Copenhagen","denmark","","56.61298","9.36639785","","None","None","None","","","","","","","","Card is composite list of 22 flanged axes from the National Museum in Copenhagen.  Details for the 22 items are listed under ""Description""","","","Butt squarish., Sides straight or only slightly concave., Edge moderately expanded., , No; Weight; Hundred; Parish; Form; Remarks, , 26066; 493.5; Provenance unknown; Lines on face. , , B4487; 623; Provenance unknown; No lines., , B465; 476; Provenance unknown; Lines: butt damaged., , 9523; 436; Provenance unknown; No lines., , 8127; 325; Provenance unknown; Lines in two bands., , B704; 944; Bornholm; Aalber [Aalborg?]; No lines; butt damaged., , B494; 849; Sjaelland; Ebbelnord [?]; Lines; butt damaged., , B3143; 370;  Provenance unknown; Corroded., , B6816; 450; Ame [?]; Tommerup; Corroded., , B3484; 552; Vester Flokkebjerg; Tjaereby; Corroded., , B10789; 631; Provenance unknown; Corroded, very., , 16823; 677; Kalundborg; Corroded on surface; reverse triangle design, damaged., , B10790; 614; Provenance unknown; Ripple decoration., , ?; 109; Provenance unknown; flange [...], , B3888(a); 419; Stovring;Harridslev; too badly corroded for description., , B3888 (b); 617.5; Stovring; Harridslev; Too badly corroded for description., , B3888 (c); 908; Stovring; Harridslev; Well preserved, line decoration., , B3888 (f); 452; Stovring; Harridslev; Decayed, markedly [...] Flange slight., , B3888 (g); 271; Stovring;Harridslev; Decayed, markedly [...] Flanges slight., , 4558; 557; Selahandal [?]; No decription given., , 6428; 436; Provenance unknown; No description given., , B10153; 92; Ars; Svallerup; No description given.","","Note: B3888 (d) and (e) are carded full size","Joellen mcGann","http://farm4.staticflickr.com/3799/13306592174_b370d8bcc6_b.jpg","http://www.flickr.com/photos/MicroPasts/13306592174","superuser",9.3664,56.613,"drawB8"
"4262","433","Flanged Axe","","Nationalmuseet, Copenhagen, No. 26063","denmark; flenstofte, fyn","fyn, denmark","55.34233","10.23658214","","None","None","None","110","25","79","426","","","14","Width: butt 25; edge 79","","","Thick butt, almost square. Axe heavy for its size. Plain flanges. Decoration of hatched and plain triangles in 4 rows, uppermost partially weathered between 4 obliquely hatched bands. Heavy engraving, somewhat crude execution.","","","Joellen mcGann","http://farm8.staticflickr.com/7021/13306591724_294d81d35a_b.jpg","http://www.flickr.com/photos/MicroPasts/13306591724","superuser",10.2366,55.3423,"drawB8"
"4263","433","Flanged Axe","","Nationalmuseet, Copenhagen, No. B 3647","denmark; jutland; hjorring; astrup","astrup, denmark","55.08717","10.33520120","","None","None","None","249","39","115","1253","Copper shines through in places on upper face.","Very well preserved, but underside not so fresh.","18","Width: below butt 39; edge 115.","","","Cutting edge sharp. Fairly deep plain flanges. Decorated band of hatched alternate triangles over 79 engraved lines.","","","Joellen mcGann","http://farm3.staticflickr.com/2850/13306382443_e437ff5f26_b.jpg","http://www.flickr.com/photos/MicroPasts/13306382443","superuser",10.3352,55.0872,"drawB8"
"4264","433","Flanged Axe","","Nationalmuseet, Copenhagen, No. B8688","denmark, norvang, grejs","grejs, denmark","55.76292","9.54677792","","None","None","None","154","30","64","385","Lustrous green.","","16","Site: Appears to be Grejs and not Geve in Norvang., , Width: below butt 30; edge 64, , Thickness: 15.5","","","Flanges bevelled - cutting edge damaged. 6 lines on lower part of face produced by slight facets.","","","Joellen mcGann","http://farm4.staticflickr.com/3729/13306591464_aed273632c_b.jpg","http://www.flickr.com/photos/MicroPasts/13306591464","superuser",9.5468,55.7629,"drawB8"
"4265","433","Flanged Axe","","Nationalmuseet, Copenhagen, No. 26067","denmark, jutland, aalborg","aalborg, denmark","57.04822","9.91939390","","None","None","None","188","33","83","794","","","","Width: edge (recorded as 82.5, drawn as 84); below butt 33, 30; Depth of flanges 18.75","","","","","","Joellen mcGann","http://farm8.staticflickr.com/7376/13306591334_b38d8d67bc_b.jpg","http://www.flickr.com/photos/MicroPasts/13306591334","superuser",9.9194,57.0482,"drawB8"
"4266","433","Flanged Axe","","Nationalmuseet, Copenhagen, No. D XCIX","denmark, provenance unknown","denmark","55.67025","10.33332830","","None","None","None","241","131","34","1399","Lustrous jade patina","","21","Site: Unspecified location in Denmark - geolocation not accurate to 10 kms, , Width: butt 34; edge 131, , Weight: 1398.5 gms","","","Butt damaged, Decoration of fairly heavy lines below centre of face, Deep plain flanges.","","","Joellen mcGann","http://farm4.staticflickr.com/3690/13306381893_3391af7a15_b.jpg","http://www.flickr.com/photos/MicroPasts/13306381893","superuser",10.3333,55.6703,"drawB8"
"4267","433","Flanged Axe","","Nationalmuseet, Copenhagen, No. 10183 (1)","denmark, provenance unknown","denmark","55.67025","10.33332830","","None","None","None","189","30","91","736","Green patina; bronze shining through","","19","Site: Unspecified location in Denmark - geolocation not accurate to 10 kms, , Width: butt 30; edge 91, , Thickness: 18.5","","","Well preserved. Flanges plain, only decoration faint ripples.","","","Joellen mcGann","http://farm8.staticflickr.com/7439/13306591264_494bb3ce2b_b.jpg","http://www.flickr.com/photos/MicroPasts/13306591264","superuser",10.3333,55.6703,"drawB8"
"4268","433","Flanged Axe","","Nationalmuseet, Copenhagen, No. 10183 (2)","denmark, provenance unknown","denmark","55.67025","10.33332830","","None","None","None","132","27","63","408","","well preserved - dark green","16","Site: unspecified location in Denmark - geolocation not accurate to 10 kms, , Site: below butt 27; edge 63","","","Plain flanges, Shallow cutting edge, No decoration","","","Joellen mcGann","http://farm4.staticflickr.com/3771/13306381213_d4a43b1060_b.jpg","http://www.flickr.com/photos/MicroPasts/13306381213","superuser",10.3333,55.6703,"drawB8"
"4269","433","Flanged Axe","","Nationalmuseet, Copenhagen, No. B 3688","denmark; skippinge; varsler","skippinge denmark","55.76575","11.36814117","","None","None","None","197","31","100","701","Dark rusty green.","Moderately preserved.","16","Width: below butt 31; edge 100","","","No decoration. Flanged. Slightly damaged butt.","","","Joellen mcGann","http://farm8.staticflickr.com/7199/13306590244_a4a509217d_b.jpg","http://www.flickr.com/photos/MicroPasts/13306590244","superuser",11.3681,55.7657,"drawB8"
"4270","433","Flanged Axe","","Nationalmuseet, Copenhagen, No. MLXX (a)","denmark; sjaelland (zealand); store heddinge","store headinge, denmark","55.51366","12.14456557","","None","None","None","","","","","","","","","","","Well preserved and beautifully decorated.","Sophus Muller. 'Oldliden Kunst Bronzealderon', p. 3. Fig. 8","","Joellen mcGann","http://farm8.staticflickr.com/7003/13306229485_6a84454fc4_b.jpg","http://www.flickr.com/photos/MicroPasts/13306229485","superuser",12.1446,55.5137,"drawB8"
"4271","433","Flanged Axe","","Nationalmuseet, Copenhagen, No. MLXX (b)","denmark, zealand (sjaelland), store heddinge","store heddinge, denmark","55.30812","12.38762520","","None","None","None","165","28","81","430","","","12","Length: 164.5, , Width: butt 28 (drawn as 25); edge 80.5, , Thickness: 11.5","","","No decoration, Flanges rather slight","","","Joellen mcGann","http://farm3.staticflickr.com/2844/13306380613_b576342605_b.jpg","http://www.flickr.com/photos/MicroPasts/13306380613","superuser",12.3876,55.3081,"drawB8"
"4272","433","","","Nationalmuseet, Copenhagen, No. MLXX (c)","denmark; sjaelland (zealand); store heddinge","store heddinge, denmark","55.30812","12.38762520","","None","None","None","160","29","68","415","","","15","Length: 159.5, , Width: below butt 28.75; edge 67.75 (drawn as 69)","","","No decoration.","","","Joellen mcGann","http://farm4.staticflickr.com/3780/13306380363_00dfc421bc_b.jpg","http://www.flickr.com/photos/MicroPasts/13306380363","superuser",12.3876,55.3081,"drawB8"
"4273","433","Flanged Axe","","Nationalmuseet, Copenhagen, No. MLXX (d)","denmark; sjaelland (zealand); store heddinge","store heddinge, denmark","55.30812","12.38762520","","None","None","None","185","29","94","530","","","12","Width: butt 29, edge 94, , Thickness: 11.5","","","Broad recurved edge. No decoration.","","","Joellen mcGann","http://farm3.staticflickr.com/2815/13306589464_8c06248493_b.jpg","http://www.flickr.com/photos/MicroPasts/13306589464","superuser",12.3876,55.3081,"drawB8"
"4274","433","","","Nationalmuseet, Copenhagen, No. B8068","denmark; sonderhald; skorring","skorring, denmark","56.36348","10.27194000","","None","None","None","137","27","61","435","Luscious green.","","20","Width: below butt 26.5, edge 61, , Thickness: 19.5, ,","","","Flanges bevelled at sides, flattening out on to edge, angle of edge damaged. Faint broad ripples on lower half of face.","","","Joellen mcGann","http://farm8.staticflickr.com/7404/13306589264_f73d84db12_b.jpg","http://www.flickr.com/photos/MicroPasts/13306589264","superuser",10.2719,56.3635,"drawB8"
"4275","433","","","Nationalmuseet, Copenhagen, No. 9036","denmark; vennebjerg; hans; hjorring","hjorrring, denmark","57.54438","9.99261855","","None","None","None","159","18","70","352","","corroded and damaged","21","Site:  Written as Njorning, but appears to be Hjorning Parish in Vennebjerg.  , , Width: butt 18, edge 70","","","Square butt. Very deep flanges curving inwards.","","","Joellen mcGann","http://farm8.staticflickr.com/7319/13306228235_e8abf7ab95_b.jpg","http://www.flickr.com/photos/MicroPasts/13306228235","superuser",9.9926,57.5444,"drawB8"
"4276","433","Flanged Axe","","Nationalmuseet, Copenhagen, No. B9037","denmark, vennebjerg h., hans (s.), horring (sch.)","vennebjerg, denmark","57.45091","9.85447780","","None","None","None","119","19","62","208","","very badly corroded","17","Length: 119 (drawn as 117), , Width: butt 19; centre 27; edge 62, , Thickness: 16.5","","","No decoration. One corner of butt damaged: central indentation. Flanges flatten out on to edge and towards butt.","","""Combines 2 Italian characteristics a) indented butt - b) Flanges flatten out on to cutting edge also towards butt.""","Joellen mcGann","http://farm8.staticflickr.com/7028/13306228035_95c749d763_b.jpg","http://www.flickr.com/photos/MicroPasts/13306228035","superuser",9.8545,57.4509,"drawB8"
"4277","433","Flanged Axe","","Nationalmuseet, Copenhagen, No. B9038","denmark; vennebjerg; hans; hjorring","hjorring, denmark","57.45718","9.98559980","","None","None","None","44","21","53","267","","","17","Site: Appears to be Hjorring Parish rather than Njorning., , Length: 43.5, , Width: butt 21, edge 52.5","","","Sides of flanges bevelled. No decoration.  Not very well preserved.","","","Joellen mcGann","http://farm3.staticflickr.com/2814/13306379583_a1ab256799_b.jpg","http://www.flickr.com/photos/MicroPasts/13306379583","superuser",9.9856,57.4572,"drawB8"
"4278","433","Flanged Axe","","Nationalmuseet, Copenhagen, No. B9039","denmark; vennebjerg; hans; hjorring","hjorring, denmark","57.45718","9.98559980","","None","None","None","","","","376","","","","Site:  Appears to be Hjorring Parish in Vennebjerg rather than Njorring (does not appear to exist).","","","Almost identical with No. B9036, in 2 pieces, broken near butt.","","","Joellen mcGann","http://farm4.staticflickr.com/3814/13306227785_8af41d3567_b.jpg","http://www.flickr.com/photos/MicroPasts/13306227785","superuser",9.9856,57.4572,"drawB8"
"4279","433","","","Nationalmuseet, Copenhagen, No. B5310","denmark; love; saeby","saeby, denmark","57.34189","10.51584243","","None","None","None","227","31","116","847","","","13","Width: butt 31; edge 115.5, , Thickness: 12.5, ,","","","Decoration faint and rather poorly executed. Slight flanges with herringbone pattern extending to faces but not sides.","","","Joellen mcGann","http://farm3.staticflickr.com/2880/13306227405_b57db7ba0d_b.jpg","http://www.flickr.com/photos/MicroPasts/13306227405","superuser",10.5158,57.3419,"drawB8"
"4280","433","Flanged Axe","","Nationalmuseet, Copenhagen, No. 3888(d)","denmark; stovring; harridslev","harridslev, denmark","56.50063","10.13141160","","None","None","None","220","36","76","779","Lustrous patina on face drawn.","","14","Width: below butt 36; edge (broken) 75.5","","","Flanges plain. Edge damaged. Face drawn shows herringbone decoration roughly drawn above centre and 5 slight facets below producing 5 angles of intersection. reverse badly damaged and corroded","","","Joellen mcGann","http://farm8.staticflickr.com/7264/13306587494_630edc5c83_b.jpg","http://www.flickr.com/photos/MicroPasts/13306587494","superuser",10.1314,56.5006,"drawB8"
"4281","433","Flanged Axe","","Nationalmuseet, Copenhagen, No. 3888 (e)","denmark; stovning, harridslev","harridslev, denmark","56.50063","10.13141160","","None","None","None","205","30","73","621","","","","","","","Seriously decayed and corroded.","","Width: below butt 30; edge 73","Joellen mcGann","http://farm4.staticflickr.com/3795/13306226195_02996050f1_b.jpg","http://www.flickr.com/photos/MicroPasts/13306226195","superuser",10.1314,56.5006,"drawB8"
"4282","433","Flanged Axe","","Nationalmuseet, Copenhagen, No. 3887","denmark; stovring; harridslev","harridslev, denmark","56.50063","10.13141160","","None","None","None","337","48","110","1357","","","16","Width: edge 110; butt 48, , Thickness: 15.5, , Note on card that: ""sketch of edge not received.""","","","Plain and corroded. Flanges poorly developed. Square end to butt.  Cutting edge expanded.","","","Joellen mcGann","http://farm8.staticflickr.com/7322/13306586654_b24918d5df_b.jpg","http://www.flickr.com/photos/MicroPasts/13306586654","superuser",10.1314,56.5006,"drawB8"
"4283","433","Flanged Axe","","Nationalmuseet, Copenhagen, No. 2870","denmark, no provenance listed","denmark","55.67025","10.33332830","","None","None","None","119","20","57","210","","badly corroded","","Site: Unspecified location in Denmark - geolocation not accurate to 10 kms, , Width: butt 20; edge 57, ,","","","Flanged","","","Joellen mcGann","http://farm4.staticflickr.com/3703/13306377163_ddc6711f38_b.jpg","http://www.flickr.com/photos/MicroPasts/13306377163","superuser",10.3333,55.6703,"drawB8"
"4284","433","Flanged Axe","","Nationalmuseet, Copenhagen, No. 6838","denmark (?); no provenance listed.","denmark","55.67025","10.33332830","","None","None","None","139","22","62","365","","","","Width: butt 22, edge 62","","","Flanges bevelled and flattened out on to cutting edge. Rounded butt. Edge expanded.","","","Joellen mcGann","http://farm4.staticflickr.com/3690/13306225485_17c23b6992_b.jpg","http://www.flickr.com/photos/MicroPasts/13306225485","superuser",10.3333,55.6703,"drawB8"
"4285","433","Flanged Axe","","Nationalmuseet, Copenhagen, No. 11011","denmark (?); no provenance listed.","","56.22407","10.24530410","","None","None","None","122","22","56","206","","well preserved.","","Width: butt 22; edge 56","","","Markedly waisted. Rounded butt. Edge expanded.  Bevelled flange.","","","Joellen mcGann","http://farm8.staticflickr.com/7345/13306585994_f2a9138702_b.jpg","http://www.flickr.com/photos/MicroPasts/13306585994","superuser",10.2453,56.2241,"drawB8"
"4286","433","Slightly Flanged Axe","","Nationalmuseet, Copenhagen, No. 15102","denmark; no history given.","","56.17517","9.89374160","","None","None","None","104","19","53","176","","","","Width: butt 19; edge 53","","","Very slightly flanged.","","","Joellen mcGann","http://farm8.staticflickr.com/7019/13306376323_5ec90b2a37_b.jpg","http://www.flickr.com/photos/MicroPasts/13306376323","superuser",9.8937,56.1752,"drawB8"
"4287","433","Flanged Axe","","Nationalmuseet, Copenhagen, No. 11073","denmark; not listed","","56.22407","9.98163223","","None","None","None","157","18","71","490","","","","Width: butt (broken) 18; edge 71","","","Hopelessly decayed.","","","Joellen mcGann","http://farm4.staticflickr.com/3732/13306376073_2edb1e549e_b.jpg","http://www.flickr.com/photos/MicroPasts/13306376073","superuser",9.9816,56.2241,"drawB8"
"4288","433","Flanged Axe","","","denmark; no history given","","56.22407","10.15741348","","None","None","None","147","14","47","256","","","","Width: butt 14; edge 47","","","Badly decayed.","Nationalmuseet, Copenhagen, No 18186","","Joellen mcGann","http://farm3.staticflickr.com/2886/13306585184_56b01fa951_b.jpg","http://www.flickr.com/photos/MicroPasts/13306585184","superuser",10.1574,56.2241,"drawB8"
"4289","433","Slightly Flanged Axe","","Nationalmuseet, Copenhagen, No. ?","denmark; no history given.","","56.32167","10.15741348","","None","None","None","131","21","57","336","","generally decayed","","Width: butt 21; edge 57","","","Square butt. Scarcely flanged. Slight medial expansion of faces. Cutting edge damaged.","","","Joellen mcGann","http://farm3.staticflickr.com/2808/13306375623_693c25b17f_b.jpg","http://www.flickr.com/photos/MicroPasts/13306375623","superuser",10.1574,56.3217,"drawB8"
"4290","433","Flanged Axe","","Nationalmuseet, Copenhagen, No. ?","denmark; no history given","","56.22407","9.89374160","","None","None","None","138","27","60","292","","","","Width: butt 27, edge 60","","","Badly damaged and decayed, especially butt. Flanges bevelled. Edge expanded.","","","Joellen mcGann","http://farm4.staticflickr.com/3765/13306584704_68c6e7a8cb_b.jpg","http://www.flickr.com/photos/MicroPasts/13306584704","superuser",9.8937,56.2241,"drawB8"
"4291","433","Flanged Axe","","Nationalmuseet, Copenhagen, No. ?","denmark (?)","","56.27290","10.06952285","","None","None","None","118","21","53","206","","","","Width: butt 21; edge 53","","","Butt shallow curve. Edge moderately expanded.","","","Joellen mcGann","http://farm4.staticflickr.com/3784/13306224215_f7160b9e4f_b.jpg","http://www.flickr.com/photos/MicroPasts/13306224215","superuser",10.0695,56.2729,"drawB8"
"4292","433","Flanged Axe","","Nationalmuseet, Copenhagen, No. ?","denmark (?); no history given.","","56.22407","9.98163222","","None","None","None","130","25","63","320","","","","Width: butt 25; edge 63","","","Square butt (? cut after manufacture); Shallow edge (? worn down).","","","Joellen mcGann","http://farm8.staticflickr.com/7077/13306223545_45f1a98173_b.jpg","http://www.flickr.com/photos/MicroPasts/13306223545","superuser",9.9816,56.2241,"drawB8"
"4293","433","Flanged Axe","","Nationalmuseet, Copenhagen, No. ?","denmark","","66.65664","-5.48711778","","None","None","None","106","20","51","151","","","10","Site: Denmark, geolocation accuracy more than 10km , , Length: 105.5, , Width: butt 19.5; edge 51","","","Very badly decayed., Butt notched, one angle slightly damaged.","","""moderated butt, Italian characteristics""","Joellen mcGann","http://farm8.staticflickr.com/7441/13306223465_b2885826d0_b.jpg","http://www.flickr.com/photos/MicroPasts/13306223465","superuser",-5.4871,66.6566,"drawB8"
"4294","433","Flanged Axe","","Nationalmuseet, Copenhagen, No. ?","denmark, no details given","","56.17517","10.24530410","","None","None","None","113","24","60","275","","","","Site: Denmark only, not accurate to 10 km, , Widthe: butt 24; edge 60","","","Flanges widest below middle. flattening out on to edge. Rounded butt.","","","Joellen mcGann","http://farm8.staticflickr.com/7195/13306583664_0d37252c66_b.jpg","http://www.flickr.com/photos/MicroPasts/13306583664","superuser",10.2453,56.1752,"drawB8"
"4295","433","","","Nationalmuseet, Copenhagen, No. B3240","denmark, jutland, aarhus, vinding, skjellerup","skjellerup, denmark","56.62802","9.86270900","","None","None","None","150","29","65","363","","","","Weight: 362.5","","","Butt rounded and corroded., Sides only slightly flanged.","","","Joellen mcGann","http://farm3.staticflickr.com/2815/13306374203_712fbdd32e_b.jpg","http://www.flickr.com/photos/MicroPasts/13306374203","superuser",9.8627,56.628,"drawB8"
"4296","433","Flanged Axe","","Nationalmuseet, Copenhagen, B9092","denmark, funen island (fyn), bogense","bogense, denmark","55.57256","10.09551823","","None","None","None","148","24","65","360","","hopelessly decayed","","Width: butt 24; edge 65","","","Squared butt","","","Joellen mcGann","http://farm8.staticflickr.com/7127/13306583184_b26b9b082c_b.jpg","http://www.flickr.com/photos/MicroPasts/13306583184","superuser",10.0955,55.5726,"drawB8"
