"taskID","userID","objectType","rightCorner","collection","site","toSearch","Lat","Lon","gridRef","dateDiscoveryDay","dateDiscoveryMonth","dateDiscoveryYear","length","width","edge","weight","patina","surface","thickness","other","composition","associations","description","publications","remarks","inputBy","imageURL","flickrURL","Processing","lon","lat","project"
"50353","433","Sword (part of)","","Private Collection,F. Ransom Esq., Hitchin","Unprovenanced","","51.5855735","-0.6160753000000341","","None","None","None","116","26..5, 38, 45, 21.5","","131.1","Thin olive green patina with golden bronze faintly visible.","Smooth. With a very little clay here + there.","8.25, 3.5","","","","","","","Joellen mcGann","https://www.flickr.com/photos/115096994@N02/23031926013","https://farm1.staticflickr.com/625/23031926013_3dc5d10cd8_m.jpg","superuser",-0.6161,51.5856,"SwordsPt3"
"50354","433","Leaf shaped sword","IV","Private Collection,1923,Lord Howard de Walden,Belgrave Square S.W.","Thames,from the Thames","River Thames, United Kingdom","51.5855735","-0.6160753000000341","","None","None","None","706","blade 36.5; hilt 60, 34","","815.06","Matte patina, dull dirty blackish colour - golden bronze shows.","Smooth. Tiny stones adhere round one group of rivets.","blade 9 + 13 at hilt end","","","","9 rivets - 12 to 19mm long. Hilt is flat except for slightly flanged side edges. Good condition.","","","Joellen mcGann","https://www.flickr.com/photos/115096994@N02/23030829044","https://farm1.staticflickr.com/583/23030829044_701d80177d_m.jpg","superuser",-0.6161,51.5856,"SwordsPt3"
"50355","433","Leaf shaped sword","","Unknown loc.,Private Collection,Sotheby's Lot 305, 24,v,21","""Irish Type"" (Vide catalogue)","","51.5855735","-0.6160753000000341","","None","None","None","492","blade 35.25, 27.5; hilt plate 38.5, 19.5","","496.4","Thin dark emerald green patina with golden bronze showing through at intervals.","Smooth","hilt plate 9; blade 3.75, 7.5, 3.75","","Bronze","","The bevelling is indistinct + the revised centre of blade is not sharply defined + less distinct towards middle of blade. Pierved for 4 rivets - one remaining. Blade broken + repaired in 3 places.","","","Joellen mcGann","https://www.flickr.com/photos/115096994@N02/23030828124","https://farm6.staticflickr.com/5634/23030828124_44a1529598_m.jpg","superuser",-0.6161,51.5856,"SwordsPt3"
"50356","433","Sword","","Warwick County Museum,Mus. No. A.196,Previously Earl of Aylesford","England,County: Warwickshire,Town or parish: Meridan,Details of find unknown. Sword was presented to Warwickshire Natural History and Archaeological Society in June 1852 by the Earl of Aylesford.","Meriden, Coventry, West Midlands, UK","52.438655","-1.647762000000057","","None","None","None","571.5","44.45","","","","","7.62","Length: 22.5 in. = 571.5mm,Width: 1.75 in = 44.45mm (just below hilt),Thickness: 0.3 in. = 7.62mm (just below hilt)","","","Leaf shaped blade and straight shoulders, slight swelling in outline of grip, widest part nearest shoulder. Two rivet holes on one shoulder, but metal broken away on other shoulder at rivet holes. One rivet hole in hilt set i longitudinal groove; within same groove a dimple (mid-way between hole and widening for shoulder) perhaps for another hole which had not been perforated. The groove forks below dimple, but is deeper on side of surviving shoulder rivet holes. At junction of hilt and shoulder side pressure has pressed edges up slightly. Blade, an elongated oval, broken at 9.4 in. (238.76mm) from tip: pieces fit together. Outer face (.5mm) in many places flaked off, but surviving surface and metal appears stable.","1. 17th Annual Report of the Warwickshire Natural History and Archaeological Society, April, 1853, p. 3.,2. F. W. Shotton, Proc. Coventry Natural History and Scientific Society, vol. U, 1938, pp. 190 & 191.","","Joellen mcGann","https://www.flickr.com/photos/115096994@N02/23031924193","https://farm6.staticflickr.com/5735/23031924193_7395c5ffe2_m.jpg","superuser",-1.6478,52.4387,"SwordsPt3"
"50357","433","Sword","","Warwick County Museum,Mus. No. A.195,Previously Earl of Aylesford","England,County: Warwickshire,Town or parish: Meriden,Details of find unknown. Sword was presented to Warwickshire Natural History and Archaeological Society in June, 1852, by the Earl of Aylesford.","Meriden, Coventry, West Midlands, UK","52.438655","-1.647762000000057","","None","None","None","525.78","40.64","","","","","8.89 at base of hilt","Length: 20.7 in. = 525.78mm,Width: 1.6 in. = 40.64mm,Thickness: 0.35 in. = 8.89mm at base of hilt","","","Leaf shaped blade, shoulders curving slightly to blade. Elongated holes on shoulders appear to have been each a pair of rivet holes, with outer edge on one shoulder partly, on other completely gone. Blade an elongated oval, tip missing about 3/4 inch and broken across at 7.85 in. from surviving end: pieces fit together. Rather more than 1/2 of grip and pommel missing.Outer face (.5mm) in many places flaked off, but surviving surface and metal appear stable.","1. 17th Annual Report of the Warwickshire Natural History and Archaeological Society, April 1853, p. 3.,2. F. W. Shotton, Proc: Coventry Natural History and Scientific Society, Vol. I, 1938, pp. 190 + 191.","","Joellen mcGann","https://www.flickr.com/photos/115096994@N02/23550430012","https://farm1.staticflickr.com/591/23550430012_f1a18323de_m.jpg","superuser",-1.6478,52.4387,"SwordsPt3"
"50358","433","Sword","IVa","Warwick Museum,98,Labelled: Ancient British Bronze Sword, Meriden, Presented by the Earl of Aylesford","England,Warwickshire,Meriden","Meriden, Coventry, West Midlands, UK","52.438655","-1.647762000000057","","None","None","None","530","32, 45, 23, 36","","","Here and there patches of the original patina surface the other parts are etched away to a considerable depth.","","","","Bronze","","No further data","","","Joellen mcGann","https://www.flickr.com/photos/115096994@N02/23030826714","https://farm6.staticflickr.com/5728/23030826714_6785f7b42e_m.jpg","superuser",-1.6478,52.4387,"SwordsPt3"
"50359","433","Sword","Var.","Warwick Museum,No. 97,Labelled: Ancient British Bronze Swords, Meriden, presented by the Earl of Aylesford","England,Warwickshire,Meriden","Meriden, Coventry, West Midlands, UK","52.438655","-1.647762000000057","","None","None","None","527","40, 22, 36","","","Here and there are patches of the original surface patina other patches of the surface are eaten to a considerable + uniform depth ""etched"" away as it were","","","","Bronze","","No data","","","Joellen mcGann","https://www.flickr.com/photos/115096994@N02/23576553401","https://farm1.staticflickr.com/644/23576553401_cefe6c566b_m.jpg","superuser",-1.6478,52.4387,"SwordsPt3"
"50360","433","Sword","","Private - Mr. Peter Lews","England,Wiltshire,Market Lavington,Spin Hill,Found by Mr. Peter Lews while searching with a metal-detector in July 1997","Spin Hill, Market Lavington, Devizes, Wiltshire SN10 4NR, UK","51.29203649999999","-1.9883906000000025","SU 008 547","None","7","1997","1st frag 229; 2nd frag 120","29 (2nd frag.)","","1st frag 170; 2nd frag. 87","","","blade 6","","","Single Find","Dimensions: L 229 mm; Wt. 170 g blade 6mm thick; 2nd frag - L 120mm; Width 29mm; Wt 87 g,Typology: sword steeply pitted shoulders, 6 small rivet holes w/5 rivets. Tang + shoulders flanked by 9mm high flanges. Slot in tang.,Condition in 2 parts - hilt and blade","","","Joellen mcGann","https://www.flickr.com/photos/115096994@N02/23576552451","https://farm6.staticflickr.com/5746/23576552451_0605847750_m.jpg","superuser",-1.9884,51.292,"SwordsPt3"
"50361","433","Leaf Shaped Sword","IIIb","Salisbury, S. Wilts. and Blackmore Museum,34 label on blade,Presented by Miss Brown.","England,Wilts.,Upton Scudamore,Cow Down Hill","Upton Scudamore, Warminster, Wiltshire BA12, UK","51.228795","-2.193025000000034","","None","None","None","175, 95","blade 28, 32, 29; hilt 54, 20, 15, 26","","260","Dark green","","8, 7","","","","Broken in two. Broken by plough. The breaks look new.","Arch. Journal CIV","","Joellen mcGann","https://www.flickr.com/photos/115096994@N02/23550427832","https://farm6.staticflickr.com/5795/23550427832_d2be69747d_m.jpg","superuser",-2.193,51.2288,"SwordsPt3"
"50362","433","Sword","IVa","Ashmolean Museum, Oxford,1836, p. 122 No. 32,Given by Sir William Knatchbutt, 1746","England,Wiltshire,Winterbourne Earls,Figsbury Rings","Figsbury Ring (E-bound), Salisbury, Wiltshire SP4, UK","51.10076100000001","-1.7238009999999804","","None","None","1704","355 + 271","blade 38; handle 48.5","","609.8","Dark green patina","","8","","","","Two low ridges on tang; centre hole on tang not perforated, though sunk on both sides. Edge much dented.","","Described in catalogue: ""32 A brass sword found in 1704, when ploughing at Figsbury, in a great circular escarpment about 2 miles from Sarum, on the London Road, broken as it now is by the plough-share. The entrenchment on the Great Roman Causeway from Broughton to Old Sarum.""","Joellen mcGann","https://www.flickr.com/photos/115096994@N02/23632915306","https://farm1.staticflickr.com/624/23632915306_604db400be_m.jpg","superuser",-1.7238,51.1008,"SwordsPt3"
"50363","433","Leaf shaped sword","IIIc","Worcester Museum","England,Worcestershire,dredged near Worcester,(Edwards says ""just below Diglis"")","Diglis, Worcester, Worcester, UK","52.17965909999999","-2.2214820000000373","","None","None","None","588","hilt 21, 52; blade 30, 43","","","","corroded, dirty colour","","","","","","Edwards: ""The Museum as an Index to the County's Antiquities,"" Trans. Worcs. Nat.Club III, p. 277.","","Joellen mcGann","https://www.flickr.com/photos/115096994@N02/23291037119","https://farm6.staticflickr.com/5701/23291037119_f51fd27448_m.jpg","superuser",-2.2215,52.1797,"SwordsPt3"
